name,entity_type,constituency,coordinator,city,country
Indigenous Peoples Cultural Support Trust,Non-governmental organizations,Constituency - Indigenous peoples,Mr. Patrick Cunningham,Kingston upon Thames,United Kingdom of Great Britain and Northern Ireland
Indigenous Research and Training Institute - IEPÉ,Non-governmental organizations,Constituency - Indigenous peoples,Sra. Patricia de Almeida Zuppi,São Paulo - SP,Brazil
Indigenous Work Center,Non-governmental organizations,Constituency - Indigenous peoples,Mr. Mauro Soave,Brasilia,Brazil
Indo Global Social Service Society,Non-governmental organizations,,Mr. Aravind Unni,New Delhi,India
Industrial Technology Research Institute,Non-governmental organizations,Constituency - Research and independent,Mr. Chen-An Lien,Hsinchu,China
IndustriALL Global Union,Non-governmental organizations,Constituency - Trade Unions,Mr. Brian Kohler,Geneva,Switzerland
Ingénieurs sans Frontières,Non-governmental organizations,Constituency - Environmental,Mme Margaux Stéphanie Dumonteil,Paris,France
Iniciativa Climática de Mexico,Non-governmental organizations,Constituency - Environmental,Mr. Adrian Fernandez,Mexico City,Mexico
Initiative Dévelopement,Non-governmental organizations,,,,
Initiatives of Change International,Non-governmental organizations,Constituency - Research and independent,Ms. Jennifer Freya Helgeson,Caux,Switzerland
Innovation Center for Energy and Transportation,Non-governmental organizations,Constituency - Environmental,Ms. Lucia Green-Weiskel,Pasadena,China
Innovations Bleues,Non-governmental organizations,Constituency - Environmental,Mr. Julian Stone,Saint-Herblain,France
Institut d’Etudes Politiques de Toulouse,Non-governmental organizations,,,,
Institut de Recherche pour le Développement,Non-governmental organizations,Constituency - Research and independent,Mme Anne-France Piteau,Marseille cedex 2,France
Institut du Développement Durable et des Relations Internationales,Non-governmental organizations,Constituency - Research and independent,Mme Lola Vallejo,Paris,France
Institut Européen de l’Economie de la Fonctionnalité et de la Coopération,Non-governmental organizations,,,,
"Institut national de la recherche pour l’agriculture, l’alimentation et l’environnement",Non-governmental organizations,,,,
Institut Polytechnique de Grenoble,Non-governmental organizations,Constituency - Local government and Municipal authorities,Mme Anne-Catherine Favre,Grenoble,France
Institut Veolia,Non-governmental organizations,Constituency - Environmental,Mme Lorraine de Jerphanion,Aubervilliers,France
Institute and Faculty of Actuaries,Non-governmental organizations,Constituency - Business and Industry,Ms. Mary Caroline Winchester,London,United Kingdom of Great Britain and Northern Ireland
Institute for Advanced Sustainability Studies,Non-governmental organizations,Constituency - Research and independent,Ms. Kathleen Anne Mar,Potsdam,Germany
Institute for Agricultural and Forest Management and Certification,Non-governmental organizations,Constituency - Environmental,Ms. Marina Piatto,Piracicaba,Brazil
Institute for Agriculture and Trade Policy,Non-governmental organizations,Constituency - Environmental,Ms. Shefali Sharma,Minneapolis,United States of America
Institute for Climate and Society,Non-governmental organizations,Constituency - Environmental,Sra. Cíntya Chaves,Rio de Janeiro,Brazil
Institute for Climate and Sustainable Cities (iCSC),Non-governmental organizations,,,,
"Institute for Climate Protection, Energy and Mobility - Law, Economics and Policy e.V.",Non-governmental organizations,Constituency - Research and independent,Ms. Kathryn Margaret McKenzie,Berlin,Germany
"Institute for Energy and Climate Strategies, Inc.",Non-governmental organizations,Constituency - Environmental,Mr. Dennis Clare,Brooklyn,United States of America
Institute for Environment and Development Sustainability,Non-governmental organizations,Constituency - Environmental,Ms. Abela Gloria Mutabiilwa,Dar Es Salaam,United Republic of Tanzania
Institute for Environmental Security,Non-governmental organizations,Constituency - Environmental,Mr. Ronald Kingham,The Hague,Netherlands
Institute for European Environmental Policy,Non-governmental organizations,Constituency - Environmental CAN,Ms. Irene Zafrullah,Brussels,Belgium
Institute for Global Environmental Strategies,Non-governmental organizations,Constituency - Research and independent,Mr. Kentaro Tamura,Kanagawa,Japan
Institute for Governance and Sustainable Development,Non-governmental organizations,Constituency - Environmental,Ms. Trina Chiemi Thorbjornsen,Washington,United States of America
Institute for Human Rights and Business,Non-governmental organizations,,Ms. Francesca Fairbairn,London,United Kingdom of Great Britain and Northern Ireland
Institute for Public Policy Research,Non-governmental organizations,Constituency - Environmental,Mr. Luke Murphy,London,United Kingdom of Great Britain and Northern Ireland
Institute for Sustainable Development and Research,Non-governmental organizations,Constituency - Environmental,Ms. Kalpana Chaudhari,Mumbai,India
Institute for Sustainable Energy Policies,Non-governmental organizations,Constituency - Environmental CAN,Mr. Tetsunari Iida,Tokyo,Japan
Institute for Transportation and Development Policy,Non-governmental organizations,Constituency - Research and independent,Mr. Ramon Javier Cruz-Diaz,New York,United States of America
Institute of Development Studies,Non-governmental organizations,Constituency - Research and independent,Ms. Rosalind Price,Brighton,United Kingdom of Great Britain and Northern Ireland
Institute of Electrical and Electronics Engineers,Non-governmental organizations,Constituency - ENGO,Ms. Karen McCabe,New Jersey,United States of America
"Institute of Environment and Sustainable Development in Agriculture, Chinese Academy of Agricultural Science",Non-governmental organizations,Constituency - Environmental,Ms. Yingchun Li,Beijing,China
Institute of Environmental Science for Social Change,Non-governmental organizations,Constituency - Environmental,Mr. John Colin Yokingco,Quezon City,Philippines
Institute of Environmental Well,Non-governmental organizations,Constituency - Environmental,Mr. Thiago Metzker,Belo Horizonte,Brazil
"Institute Society, Population and Nature",Non-governmental organizations,Constituency - Environmental,Mr. Guilherme Eidt Gonçalves de Almeida,Brasília,Brazil
Institution of Environmental Sciences,Non-governmental organizations,Constituency - Environmental,Mr. Joseph Lewis,London,United Kingdom of Great Britain and Northern Ireland
Institution of Mechanical Engineers,Non-governmental organizations,Constituency - Business and Industry,Mr. Matthew Rooney,London,United Kingdom of Great Britain and Northern Ireland
Institutional Investors Group on Climate Change Ltd.,Non-governmental organizations,Constituency - Business and Industry,Ms. Evagelia Emelia Holdaway,London,United Kingdom of Great Britain and Northern Ireland
Instituto Andino de Montaña,Non-governmental organizations,Constituency - Environmental,Mr. Jorge Recharte Bullard,"Miraflores, LIma",Peru
Instituto de Derecho y Economía Ambiental,Non-governmental organizations,Constituency - Environmental,Sr. Ezequiel Francisco Santagada,Asuncion,Paraguay
Instituto de Ecología y Antropología de Acción,Non-governmental organizations,Constituency - Environmental,Ms. Elke Falley-Rothkopf,Cologne,Germany
Instituto de Pesquisas Ecológicas,Non-governmental organizations,Constituency - Environmental,Mr. Eduardo Humberto Ditt,"Nazaré Paulista, SP",Brazil
Instituto Ethos de Empresas e Responsabilidade Social,Non-governmental organizations,Constituency - Business and Industry,Ms. Marina Vergueiro de Almeida,Sao Paulo,Brazil
Instituto Global Attitude,Non-governmental organizations,Constituency - Youth,Mr. Rodrigo Reis,São Paulo,Brazil
Instituto Internacional de Derecho y Medio Ambiente/International Institute for Law and the Environment,Non-governmental organizations,Constituency - Environmental,Mr. Gopal Shilpakar,Madrid,Spain
Instituto Socioambiental,Non-governmental organizations,Constituency - Indigenous peoples,Sra. Adriana Ramos,São Paulo,Brazil
Instituto Torcuato Di Tella,Non-governmental organizations,Constituency - Research and independent,Sr. Daniel Perczyk,Buenos Aires,Argentina
Insurance Bureau of Canada,Non-governmental organizations,Constituency - Business and Industry,Mr. Robin Edger,Toronto,Canada
Integrated Sustainable Energy and Ecological Development Association,Non-governmental organizations,Constituency - Environmental,Mr. Raymond Myles,New Delhi,India
"Intelligentsia International, Inc.",Non-governmental organizations,Constituency - Youth,Mr. Michal Fidler,LaBelle,United States of America
InterAcademy Partnership,Non-governmental organizations,Constituency - Research and independent,Mr. Peter McGrath,Trieste,Italy
Interchurch Organization for Development Cooperation,Non-governmental organizations,Constituency - Environmental,Ms. Regnera Catharina van der Geest,The Hague,Netherlands
InterEnvironment Institute,Non-governmental organizations,Constituency - Environmental,Mr. Thaddeus Trzyna,Sacramento,United States of America
International Air Transport Association,Non-governmental organizations,Constituency - Business and Industry,Ms. Yue Huang,Montreal,Canada
International Alliance of Indigenous and Tribal Peoples of the Tropical Forests,Non-governmental organizations,Constituency - Indigenous peoples,Mr. Estebancio Castro Diaz,Panama,Panama
International Aluminium Institute,Non-governmental organizations,Constituency - Business and Industry,Ms. Sarah Novell,London,United Kingdom of Great Britain and Northern Ireland
International Association for the Advancement of Innovative Approaches to Global Challenges,Non-governmental organizations,Constituency - Youth,Mr. Miroslav Polzer,Klagenfurt,Austria
International Association of Oil and Gas Producers,Non-governmental organizations,Constituency - Business and Industry,Mr. Daniel Walsh,London,United Kingdom of Great Britain and Northern Ireland
International Association of Public Transport,Non-governmental organizations,Constituency - Local government and Municipal authorities,Mr. Philip Turner,Brussels,Belgium
International Association of Schools of Social Work,Non-governmental organizations,Constituency - Research and independent,Ms. Lena Dominelli,Hong Kong,China
International Association of Students in Agricultural and Related Sciences,Non-governmental organizations,Constituency - Youth,Mr. Omar Farhate,Heverlee-Leuven,Belgium
International Biochar Initiative,Non-governmental organizations,Constituency - Business and Industry,Mr. Johannes Lehmann,Westerville,United States of America
International Center for Living Aquatic Resources Management,Non-governmental organizations,Constituency - Environmental,Mr. Essam Yassin Mohammed,Penang,Malaysia
"International Centre for Energy, Environment and Development Foundation",Non-governmental organizations,Constituency - Environmental,Mr. Ewah Eleri,Abuja,Nigeria
International Centre for Environment Education and Community Development,Non-governmental organizations,Constituency - Environmental,Mr. Fongoh Eric,Buea,Cameroon
International Chamber of Commerce,Non-governmental organizations,Constituency - Business and Industry,Ms. Sandra Maria Hanni,Paris,France
International Chamber of Shipping,Non-governmental organizations,Constituency - Business and Industry,Mr. Simon Bennett,London,United Kingdom of Great Britain and Northern Ireland
International Cleantech Network,Non-governmental organizations,Constituency - Environmental,Ms. Joan Juul,Copenhagen,Denmark
International Climate Change Partnership,Non-governmental organizations,Constituency - Environmental,Mr. Kevin Fay,Arlington,United States of America
International Climate Dialogue e.V.,Non-governmental organizations,Constituency - Research and independent,Mr. Björn Dransfeld,Hamburg,Germany
International Coastal and Ocean Organization,Non-governmental organizations,Constituency - Environmental,Ms. Miriam Balgos,Orleans,United States of America
International Committee of the Red Cross,Non-governmental organizations,Constituency - Environmental,Ms. Nathalie Waeber,Geneva,Switzerland
"International Copper Association, Ltd.",Non-governmental organizations,Constituency - ENGO,Mr. Steven Kukoda,New York,United States of America
International Coral Reef Society,Non-governmental organizations,Constituency - Research and independent,Mr. Rupert Ormond,Sarasota,United States of America
International Council for Mining and Metals,Non-governmental organizations,Constituency - Business and Industry,Ms. Meera Thankey,London,United Kingdom of Great Britain and Northern Ireland
International Council for Sustainable Energy,Non-governmental organizations,Constituency - Business and Industry,Ms. Laura Tierney,Washington DC,United States of America
International Council of Chemical Associations,Non-governmental organizations,Constituency - Business and Industry,Ms. Touria Lakchiri,Brussels,Belgium
International Council on Clean Transportation Inc.,Non-governmental organizations,Constituency - Environmental,Ms. Brigitte Bernal,Washington DC,United States of America
International Council on Monuments and Sites,Non-governmental organizations,Constituency - Research and independent,Mr. Andrew Potts,Charenton-le-Pont,France
International Cryosphere Climate Initiative,Non-governmental organizations,Constituency - Research and independent,Ms. Pamela Jean Pearson,Charlotte,United States of America
International Dairy Federation,Non-governmental organizations,Constituency - Business and Industry,Ms. Caroline Emond,Brussels,Belgium
International development enterprises,Non-governmental organizations,Constituency - Farmers,Mr. John Choptiany,Denver,United States of America
International Development Research Centre,Non-governmental organizations,Constituency - Research and independent,Ms. Marie-Eve Landry,"Ottawa, ON",Canada
International Dialogue for Environmental Action (IDEA),Non-governmental organizations,Constituency - Environmental,Mr. Surkhay Shukurov,Baku,Azerbaijan
International Disability Alliance,Non-governmental organizations,Constituency - Environmental,Ms. Elham Youssefian,New York,United States of America
International Education Institute of Brazil,Non-governmental organizations,Constituency - Environmental,Sra. Marcela Menezes,Brasília,Brazil
International Emissions Trading Association,Non-governmental organizations,Constituency - Business and Industry,Ms. Stephanie Olegario,Geneva,Switzerland
International Environmental Communication Association,Non-governmental organizations,Constituency - Research and independent,Mr. Mark S. Meisner,Cincinnati,United States of America
International Federation of Environmental Health,Non-governmental organizations,Constituency - Environmental,Mr. Martin Fitzpatrick,London,United Kingdom of Great Britain and Northern Ireland
International Federation of Liberal Youth,Non-governmental organizations,Constituency - Youth,Mr. Sven Gerst,London,United Kingdom of Great Britain and Northern Ireland
International Federation of Medical Students’ Associations,Non-governmental organizations,,,,
International Fertilizer Association,Non-governmental organizations,Constituency - Business and Industry,Ms. Margot Rose Clifford,Paris,France
International Food Policy Research Institute,Non-governmental organizations,Constituency - Farmers,Ms. Liangzhi You,Washington,United States of America
International Forestry Students’ Association,Non-governmental organizations,,,,
International Foundation for African Children,Non-governmental organizations,Constituency - Youth,Mr. Michael Ikechukwu Nwafejoku,Lagos,Nigeria
International Fund for Animal Welfare Inc.,Non-governmental organizations,Constituency - Environmental CAN,Ms. Megan O'Toole,Yarmouth Port,United States of America
International Gas Union,Non-governmental organizations,Constituency - Business and Industry,Mr. Paddy Blewer,"Egham, Surrey",United Kingdom of Great Britain and Northern Ireland
International Geothermal Association,Non-governmental organizations,Constituency - Business and Industry,Ms. Marit Brommer,Auckland,New Zealand
International Humanist and Ethical Union Inc,Non-governmental organizations,Constituency - Environmental,Ms. Lillie Ashworth,Washington DC,United States of America
International Hydropower Association,Non-governmental organizations,Constituency - Business and Industry,Mr. Alex Campbell,London,United Kingdom of Great Britain and Northern Ireland
International Indian Treaty Council,Non-governmental organizations,Constituency - Indigenous peoples,Mr. Alberto Saldamando,San Francisco,United States of America
International Institute for Applied Systems Analysis,Non-governmental organizations,Constituency - Research and independent,Mr. Iain Stewart,Laxenburg,Austria
International Institute for Environment and Development,Non-governmental organizations,Constituency - Research and independent,Ms. Marika Hannah Weinhardt,London,United Kingdom of Great Britain and Northern Ireland
International Institute for Sustainable Development,Non-governmental organizations,Constituency - Research and independent,Mr. Cameron Stuart Hunter,Winnipeg,Canada
International National Trusts Organisation,Non-governmental organizations,Constituency - Environmental,Ms. Catherine Leonard,London,United Kingdom of Great Britain and Northern Ireland
International Network for Sustainable Energy,Non-governmental organizations,Constituency - Environmental,Mr. Gunnar Boye Olesen,Hjortshoj,Denmark
International Network of Basin Organizations,Non-governmental organizations,Constituency - Environmental,Mr. Edouard Boinet,Paris,France
International Organization for Standardization,Non-governmental organizations,Constituency - Business and Industry,Mr. José Ignacio Alcorta,Vernier,Switzerland
International Organization of Employers,Non-governmental organizations,Constituency - Business and Industry,Mr. Robert Marinkovic,Geneva,Switzerland
International Panel of Experts on Sustainable Food Systems,Non-governmental organizations,Constituency - Research and independent,Ms. Chantal Clément,Brussels,Belgium
International Peatland Society,Non-governmental organizations,Constituency - Environmental,Ms. Susann Warnecke,Jyväskylä,Finland
International Planned Parenthood Federation,Non-governmental organizations,Constituency - Women and Gender,Ms. Raffaela Dattler,London,United Kingdom of Great Britain and Northern Ireland
International Plant Genetic Resources Institute,Non-governmental organizations,Constituency - Research and independent,Ms. Helen Thompson,Maccarese (Fiumicino),Italy
International Polar Foundation,Non-governmental organizations,Constituency - Research and independent,Ms. Nighat Johnson-Amin,Brussels,Belgium
International Programme On the State of the Ocean,Non-governmental organizations,Constituency - Environmental,Ms. Mirella von Lindenfels,Haywards Heath,United Kingdom of Great Britain and Northern Ireland
International Rivers Network,Non-governmental organizations,Constituency - Environmental,Mr. Joshua Klemm,Berkeley,United States of America
International Science Council,Non-governmental organizations,Constituency - Environmental,Ms. Katsiaryna Paulavets,Paris,France
International Society for Ecological Economics,Non-governmental organizations,Constituency - Environmental,Ms. Heidi Brault,Boston,United States of America
International Society of City and Regional Planners,Non-governmental organizations,Constituency - Environmental,Mr. Frank D'hondt,The Hague,Netherlands
International Society of Doctors for the Environment,Non-governmental organizations,Constituency - ENGO,Ms. Cathey Eisner Falvo,Basel,Switzerland
International Solar Energy Society e.V.,Non-governmental organizations,Constituency - Environmental,Ms. Jennifer McIntosh,Freiburg,Germany
International Solid Waste Association,Non-governmental organizations,Constituency - Environmental,Mr. Jose Ignacio Uribe-Echevarria,Vienna,Austria
International Trade Union Confederation,Non-governmental organizations,Constituency - Trade Unions,Mr. Bert De Wel,Brussels,Belgium
International Union of Architects,Non-governmental organizations,Constituency - Trade Unions,Ms. Sonia Cela,Paris,France
International Union of Forest Research Organizations,Non-governmental organizations,Constituency - Research and independent,Mr. Alexander Buck,Vienna,Austria
International Union of Railways,Non-governmental organizations,Constituency - Business and Industry,Mr. Vincent VU,Paris,France
International Water Association,Non-governmental organizations,Constituency - Environmental,Ms. Daniela Bemfica,London,United Kingdom of Great Britain and Northern Ireland
International Water Resources Association,Non-governmental organizations,Constituency - Environmental,Mr. Callum Clench,Madison,United States of America
International Work Group for Indigenous Affairs,Non-governmental organizations,Constituency - Environmental,Mr. Stefan Thorsell,Copenhagen,Denmark
International Youth and Student Movement for the United Nations,Non-governmental organizations,Constituency - Environmental,Mr. Oluwole David Oshota,Geneva,Switzerland
International Youth Council - Yemen,Non-governmental organizations,Constituency - Youth,Mr. Tareq Hassan,Sana'a,Yemen
International Youth Nuclear Congress,Non-governmental organizations,Constituency - Youth,Ms. Theresa Mary Green,Berkeley,United States of America
International-Lawyers.Org,Non-governmental organizations,Constituency - Research and independent,Mr. Curtis Doebbler,Geneva,Switzerland
Interreligious Climate and Ecology Network,Non-governmental organizations,Constituency - Environmental,Ms. Junghee Min,Seoul,Republic of Korea
Interuniversity Research Centre for Sustainable Development,Non-governmental organizations,Constituency - Research and independent,Mr. Francesco Fantozzi,Valmontone Rome,Italy
Inuit Circumpolar Conference,Non-governmental organizations,Constituency - Indigenous peoples,Ms. Joanna MacDonald,Ottawa,Canada
Investment Company Institute,Non-governmental organizations,Constituency - Business and Industry,Ms. Anna Driggs,Washington,United States of America
Investor Group on Climate Change Australia / New Zealand Inc.,Non-governmental organizations,Constituency - Business and Industry,Ms. Rebecca Mikula Wright,Sydney,Australia
Investor Watch,Non-governmental organizations,Constituency - Research and independent,Mr. Dominic Lyle,London,United Kingdom of Great Britain and Northern Ireland
IPIECA Limited (IPIECA),Non-governmental organizations,Constituency - Business and Industry,Mr. James Herbertson,London,United Kingdom of Great Britain and Northern Ireland
Islamic Relief Worldwide,Non-governmental organizations,Constituency - Research and independent,Mme Shahin Ashraf,Birmingham,United Kingdom of Great Britain and Northern Ireland
"Islands First, Inc.",Non-governmental organizations,Constituency - Environmental,Mr. Mark Jariabka,New York,United States of America
Israel Union for Environmental Defense,Non-governmental organizations,Constituency - Environmental,Ms. Leehee Goldenberg,Tel Aviv,Israel
Italian Climate Network,Non-governmental organizations,Constituency - Youth,Mr. Jacopo Bencini,Milan,Italy
Janvikas,Non-governmental organizations,,Mr. Mahesh Pandya,Ahmedabad,India
"Japan Atomic Industrial Forum, Inc.",Non-governmental organizations,Constituency - Business and Industry,Ms. Yuko Wada,Tokyo,Japan
Japan Automobile Manufacturers Association Inc.,Non-governmental organizations,Constituency - Business and Industry,Mr. Shingo Kawaguchi,Tokyo,Japan
Japan Center for a Sustainable Environment and Society,Non-governmental organizations,Constituency - Environmental CAN,Mr. Jiro Adachi,Tokyo,Japan
Japan Economic Research Institute,Non-governmental organizations,Constituency - Research and independent,Ms. Hiroko Hashimoto,Tokyo,Japan
Japan Environmental Council,Non-governmental organizations,Constituency - Environmental,Ms. Yukari Takamura,Tokyo,Japan
Japan Iron and Steel Federation,Non-governmental organizations,Constituency - Business and Industry,Mr. Masanobu Nakamizu,Tokyo,Japan
Jeunes Ambassadeurs pour le Climat,Non-governmental organizations,Constituency - Environmental,M. Titouan Rio,Paris,France
Jeunes Volontaires pour l’Environnement,Non-governmental organizations,,,,
Jeunesse Étudiante Catholique Internationale,Non-governmental organizations,Constituency - Youth,Mr. Innocent Odongo,Paris,France
Johns Hopkins University,Non-governmental organizations,Constituency - Research and independent,Mr. Irving Mintzer,Washington,United States of America
Joyce Foundation,Non-governmental organizations,Constituency - Environmental,Mr. Edmund Jackson Miller,Chicago,United States of America
Jubilee Debt Campaign,Non-governmental organizations,Constituency - Research and independent,Ms. Sarah-Jayne Clifton,London,United Kingdom of Great Britain and Northern Ireland
"Jubilee South Asia Pacific Movement, Inc.",Non-governmental organizations,Constituency - Environmental CJN,Ms. Lydinyda Bunyi Nacpil,Quezon City,Philippines
Julie’s Bicycle,Non-governmental organizations,,,,
Juniata College,Non-governmental organizations,Constituency - Research and independent,Mr. Matthew Powell,Huntingdon,United States of America
Just Transition Alliance,Non-governmental organizations,Constituency - Environmental,Mr. José Bravo,San Diego,United States of America
"Kadikoyu Friends of Science, Culture and Art Association",Non-governmental organizations,Constituency - Environmental,Mr. Tanay Sıdkı Uyar,Istanbul,Turkey
Karlsruhe Institute of Technology,Non-governmental organizations,Constituency - Research and independent,Ms. Kirsten Hennrich,Karlsruhe,Germany
Karnali Integrated Rural Development and Research Centre,Non-governmental organizations,Constituency - Environmental,Mr. Gobinda Bahadur Shahi,Sanepa,Nepal
