name,entity_type,constituency,coordinator,city,country
2050 Climate Group,Non-governmental organizations,Constituency - Youth,Ms. Sophie Eastwood,Edinburgh,United Kingdom of Great Britain and Northern Ireland
2° investing initiative,Non-governmental organizations,Constituency - Research and independent,Mr. Thibaut Ghirardi,Paris,France
350 the Climate Movement in Denmark,Non-governmental organizations,Constituency - Youth,Ms. Esther Michelsen Kjeldahl,Copenhagen,Denmark
350.org,Non-governmental organizations,Constituency - Environmental CJN,Ms. Cansin Leylim Ilgaz,Brooklyn,United States of America
A Rocha International,Non-governmental organizations,Constituency - Environmental,Mr. Samuel Chiu,London,United Kingdom of Great Britain and Northern Ireland
A Sud Ecology and Cooperation - Onlus,Non-governmental organizations,Constituency - Environmental,Ms. Lucie Greyl,Rome,Italy
A Well-Fed World,Non-governmental organizations,Constituency - Environmental,Ms. Dawn Moncrief,"Washington, DC",United States of America
Abdullah Bin Hamad Al-Attiyah International Foundation for Energy and Sustainable Development,Non-governmental organizations,Constituency - Research and independent,Mr. John Kilani,Doha,Qatar
Abertay University,Non-governmental organizations,Constituency - Research and independent,Ms. Rebecca Wade,Dundee,United Kingdom of Great Britain and Northern Ireland
Abibimman Foundation,Non-governmental organizations,Constituency - Environmental CAN,Mr. Kenneth Nana Amoateng,Tena,Ghana
Academy of Science of South Africa,Non-governmental organizations,Constituency - Research and independent,Ms. Susan Veldsman,Pretoria,South Africa
ACT Alliance - Action by Churches Together,Non-governmental organizations,Constituency - Environmental CAN,Mr. Thorsten Göbel,Geneva,Switzerland
Action des Chrétiens Activistes des Droits de l’Homme à Shabunda,Non-governmental organizations,,,,
"Action Group on Erosion, Technology and Concentration (ETC Group)",Non-governmental organizations,Constituency - Environmental,Mr. Thomas John Wakeford,Val David,Canada
Action pour la taxation des transactions pour l’aide aux citoyens,Non-governmental organizations,,,,
Action pour le Respect et la Protection de l’Environnement,Non-governmental organizations,,,,
Action Solidarité Tiers-Monde a.s.b.l.,Non-governmental organizations,,,,
ActionAid International - South Africa,Non-governmental organizations,Constituency - Environmental CAN,Ms. Teresa Maria Isabel Anderson,Johannesburg,South Africa
Adelphi Research,Non-governmental organizations,Constituency - Research and independent,Mr. Dennis Taenzler,Berlin,Germany
Advocates for International Development,Non-governmental organizations,Constituency - Business and Industry,Ms. Yasmin Batliwala,London,United Kingdom of Great Britain and Northern Ireland
Africa Centre for Citizens Orientation,Non-governmental organizations,Constituency - Environmental,Mr. Peter Olugbenga Adeleye,Kurudu,Nigeria
Africa Youths International Development Foundation,Non-governmental organizations,Constituency - Youth,Mr. Tunji John Asaolu,Abuja,Nigeria
African Centre for Climate Actions and Rural Development Initiative,Non-governmental organizations,Constituency - Environmental,Sr. Prof.Augustine Arukwe,Effurun-Delta State,Nigeria
African Climate Change Research Centre,Non-governmental organizations,Constituency - Research and independent,Mr. Nura Jibo,Dutse,Nigeria
African Forest Forum,Non-governmental organizations,Constituency - Environmental,Mr. Godwin Kowero,Nairobi,Kenya
African Network of Young Leaders for Peace and Sustainable Development,Non-governmental organizations,Constituency - Environmental,Mr. Ismail Joel Eboa Eyoum,Yaoundé,Cameroon
African Smart Cities Innovation Foundation,Non-governmental organizations,Constituency - Local government and Municipal authorities,Mr. David Olatunji,Utako,Nigeria
African Wildlife,Non-governmental organizations,Constituency - Environmental,Mr. Charly Facheux,Nairobi,Kenya
Agriconsulting S.p.A.,Non-governmental organizations,Constituency - Business and Industry,Mr. Giorgio Andreoli,Rome,Italy
Agricord vzw,Non-governmental organizations,Constituency - Farmers,Ms. Gabriela Quiroga Gilardoni,Brussels,Belgium
AgroParisTech,Non-governmental organizations,Constituency - Research and independent,Mme Bluteau Hélène,Paris,France
Air and Waste Management Association,Non-governmental organizations,Constituency - Environmental,Ms. Stephanie Glyptis,Pittsburgh,United States of America
Airlines for America,Non-governmental organizations,Constituency - Business and Industry,Ms. Nancy Young,Washington,United States of America
AJEMALEBU Self Help,Non-governmental organizations,Constituency - Environmental,Mr. Harrison Ajebe Nnoko Ngaaje,Kumba,Cameroon
Akatu Institute,Non-governmental organizations,Constituency - Environmental,Mr. Helio Mattar,São Paulo,Brazil
Alana,Non-governmental organizations,Constituency - Environmental,Mr. JP Amaral,São Paulo,Brazil
Aldersgate Group,Non-governmental organizations,Constituency - Business and Industry,Ms. Signe Norberg,London,United Kingdom of Great Britain and Northern Ireland
All Africa Conference of Churches,Non-governmental organizations,Constituency - Environmental,Mr. Fidon Mwombeki,Nairobi,Kenya
All China Environment Federation,Non-governmental organizations,Constituency - Environmental,Ms. Xiaoyi Gao,Beijing,China
All India Women’s Conference,Non-governmental organizations,,,,
AllForClimate,Non-governmental organizations,Constituency - Environmental,Ms. Leen Schelfhout,Brussels,Belgium
Alliance for Climate Education,Non-governmental organizations,Constituency - Environmental CAN,Ms. Leah Qusba,Oakland,United States of America
Alliance for Global Water Adaptation,Non-governmental organizations,Constituency - Research and independent,Ms. Ingrid Timboe,Corvallis,United States of America
Alliance for Responsible Atmospheric Policy,Non-governmental organizations,Constituency - Business and Industry,Mr. Kevin Fay,Arlington,United States of America
Alliance for Rural Electrification,Non-governmental organizations,Constituency - Business and Industry,Mr. David Lecoque,Brussels,Belgium
Alliance of Nurses for Healthy Environments,Non-governmental organizations,Constituency - Environmental,Ms. Cara Cook,"Mt. Rainier, MD",United States of America
Alliance to Save Energy,Non-governmental organizations,Constituency - Business and Industry,Ms. Susanna McElroy,Washington,United States of America
Alziras Institute,Non-governmental organizations,Constituency - Women and Gender,Sra. Marina Barros,Rio de Janeiro,Brazil
Amazon Center for Environmental Education and Research Foundation,Non-governmental organizations,Constituency - Environmental,Mr. Paul Alan Morgan,Westchester,United States of America
Amazon Environmental Research Institute,Non-governmental organizations,Constituency - Environmental,Ms. Gabriela Savian,Belem,Brazil
Amazon Institute of People and the Environment,Non-governmental organizations,Constituency - Research and independent,Sra. Brenda Brito do Carmo,Belém,Brazil
Amazon Watch,Non-governmental organizations,Constituency - Environmental,Mr. Andrew Miller,San Francisco,United States of America
American Anthropological Association,Non-governmental organizations,Constituency - Environmental,Ms. Julie Raymond,Arlington,United States of America
American Bar Association,Non-governmental organizations,,Ms. Amy Eggert,Chicago,United States of America
American Chemical Society,Non-governmental organizations,Constituency - Research and independent,Mr. James C. Maxwell,Washington DC,United States of America
American Federation of Labor and Congress of Industrial Organizations,Non-governmental organizations,Constituency - ENGO,Mr. Brad Markell,Washington,United States of America
American Forests,Non-governmental organizations,Constituency - Environmental,Ms. Rebecca Turner,Washington,United States of America
American Nuclear Society,Non-governmental organizations,Constituency - Research and independent,Ms. Aubrey Whittington,La Grange Park,United States of America
American Psychological Association,Non-governmental organizations,Constituency - Research and independent,Mr. Gabriel Twose,Washington,United States of America
"American Society of Heating, Refrigerating and Air-Conditioning Engineers, Inc.",Non-governmental organizations,Constituency - Business and Industry,Mr. Jeff Littleton,Peachtree Corners,United States of America
American Sustainable Business Council,Non-governmental organizations,Constituency - Business and Industry,Mr. Michael Green,Washington DC,United States of America
American University,Non-governmental organizations,Constituency - Research and independent,Ms. Sikina Jinnah,Washington,United States of America
Amnesty International,Non-governmental organizations,Constituency - Research and independent,Mr. Ashfaq Khalfan,London,United Kingdom of Great Britain and Northern Ireland
An Organization for Socio-Economic Development,Non-governmental organizations,Constituency - Environmental CAN,Mr. Shamim Arfeen,Khulna,Bangladesh
Angel Support Foundation,Non-governmental organizations,Constituency - Environmental,Mme Mary Ugbaa,Makurdi,Nigeria
Anglican Consultative Council,Non-governmental organizations,,Mr. Jack Palmer-White,London,United Kingdom of Great Britain and Northern Ireland
Antarctic and Southern Ocean Coalition,Non-governmental organizations,Constituency - Environmental,Ms. Claire Christian,"Washington, DC",United States of America
Aotearoa Youth Leadership Institute,Non-governmental organizations,Constituency - Youth,Mr. Benjamin Brooking,Auckland,New Zealand
Appalachian State University,Non-governmental organizations,Constituency - Research and independent,Mr. David McEvoy,Boone,United States of America
AQOCI,Non-governmental organizations,Constituency - Women and Gender,Mr. Denis Côté,Montréal,Canada
Arab Network for Environment and Develoment,Non-governmental organizations,,,,
Arapyaú Institute,Non-governmental organizations,Constituency - Environmental,Ms. Renata Piazzon,Sao Paulo,Brazil
Architecture 2030 Inc.,Non-governmental organizations,Constituency - Environmental,Mr. Edward Mazria,Santa Fe,United States of America
Arctic Athabaskan Council,Non-governmental organizations,Constituency - Indigenous peoples,Ms. Cynthia Rose Dickson,Whitehorse,Canada
Arizona State University,Non-governmental organizations,Constituency - Research and independent,Mr. Daniel Bodansky,Glendale,United States of America
Asabe Shehu Yar’adua Foundation,Non-governmental organizations,,,,
"Asheville-Buncombe Sustainable Community Initiatives, Inc.",Non-governmental organizations,Constituency - Environmental,Ms. Virginie Fayolle,Asheville,United States of America
Ashoka Trust for Research in Ecology and the Environment,Non-governmental organizations,Constituency - Environmental,Ms. Karishma Shelar,Bangalore,India
Asia Indigenous Peoples Pact Foundation,Non-governmental organizations,Constituency - Indigenous peoples,Mr. Lakpa Nuri Sherpa,Chiang Mai,Thailand
Asia Society,Non-governmental organizations,Constituency - Research and independent,Ms. Debra Rachel Eisenman,New York,United States of America
Asia-Europe Foundation,Non-governmental organizations,Constituency - Research and independent,Ms. Grazyna Pulawska,Singapore,Singapore
Asian Pacific Resource and Research Centre for Women,Non-governmental organizations,Constituency - Women and Gender,Ms. Biplabi Shrestha,Kuala Lumpur,Malaysia
Asociación AK Tenamit,Non-governmental organizations,Constituency - Indigenous peoples,Mr. Stephen Dudenhoefer,Izabal,Guatemala
Asociación Ambiente y Sociedad,Non-governmental organizations,Constituency - Environmental CAN,Sra. Blanca Maria Margarita Florez Alonso,Bogotá,Colombia
Asociación Civil Oikos,Non-governmental organizations,Constituency - Environmental,Mr. Eric Chavez,Lima,Peru
Asociación Civil Sustentar para el Desarrollo Sostenible,Non-governmental organizations,Constituency - Environmental,Sra. Giselle Quintenla,Ciudad Autonoma de Buenos Aires,Argentina
Asociación Cluster de Industrias de Medio Ambiente de Euskadi,Non-governmental organizations,Constituency - Business and Industry,Sra. Begoña Castillo,Bilbao,Spain
Asociación Coordinadora Latinoamericana y del Caribe de Pequeños Productores de Comercio Justo,Non-governmental organizations,Constituency - Business and Industry,Ms. Xiomara J. Paredes,San Salvador,El Salvador
Asociación de Comunidades Forestales de Petén,Non-governmental organizations,,Mr. Marcedonio Cortave,Petén,Guatemala
Asociación de Empresas de Energía Eléctrica,Non-governmental organizations,Constituency - Business and Industry,Mr. Luis Alberca Carpintero,Madrid,Spain
Asociación Española del Gas,Non-governmental organizations,Constituency - Business and Industry,Ms. Naiara Ortiz de Mendíbil,Barcelona,Spain
Asociación Española para la Economía Energética,Non-governmental organizations,Constituency - Research and independent,Mr. Miguel Ángel Muñoz Rodríguez,Vigo,Spain
Asociación Interamericana para la Defensa del Ambiente,Non-governmental organizations,Constituency - Environmental CAN,Sra. Florencia Ortúzar,Oakland,United States of America
Asociación Interétnica de Desarrollo de la Selva Peruana,Non-governmental organizations,Constituency - Indigenous peoples,Mr. Roberto Alfonso Espinoza Llanos,Lima,Peru
Asociación La Ruta del Clima,Non-governmental organizations,Constituency - Environmental,Mr. Adrian Alberto Martinez Blanco,San José,Costa Rica
Asociación Nacional de Empresas de Servicios Energéticos,Non-governmental organizations,Constituency - Environmental,Mr. Luis Alvarez,Madrid,Spain
Asociacion para la Naturaleza y Desarrollo Sostenible,Non-governmental organizations,Constituency - Indigenous peoples,Mr. Alejandro Argumedo,Cusco,Peru
Asociación Proteger,Non-governmental organizations,Constituency - Environmental,Sr. Juan H. Ortiz Burgos,Buenos Aires,Argentina
Asociación Regional de Empresas de Petróleo y Gas Natural en Latinoamérica y el Caribe,Non-governmental organizations,Constituency - Business and Industry,Sra. Irene Alfaro Barrios,Montevideo,Uruguay
Assemblée des Régions d’Europe,Non-governmental organizations,,,,
Assembly of First Nations,Non-governmental organizations,Constituency - Indigenous peoples,Ms. Regina Toulouse,Ottawa,Canada
Association Actions Vitales Pour Le Développement Durable,Non-governmental organizations,Constituency - Youth,Mr. Affana Affana Jean Paul Brice,Yaounde,Cameroon
Association Climate-KIC,Non-governmental organizations,Constituency - Business and Industry,,London,United Kingdom of Great Britain and Northern Ireland
Association de la Jeunesse Congolaise pour le Développement,Non-governmental organizations,,,,
Association Des 3 Hérissons,Non-governmental organizations,Constituency - Environmental,Ms. Mengjiao Wang,Carpentras,France
Association des Clubs des Amis de la Nature du Cameroun,Non-governmental organizations,,,,
Association des Enseignants des Sciences de la Vie et de la Terre,Non-governmental organizations,Constituency - Environmental,Mr. Mohamed Chaouki,Casablanca,Morocco
Association des Femmes Peules et Peuples Autochtones du Tchad,Non-governmental organizations,Constituency - Indigenous peoples,Ms. Hindou Oumarou Ibrahim,N'Djamena,Chad
Association des Jeunes pour le Développement du Ouaddai,Non-governmental organizations,,,,
Association des Scientifiques Environnementalistes pour un Développement Intégré,Non-governmental organizations,Constituency - Environmental,Mr. Mohamed-Awali Ouro-Djeri Djobo,Lome,Togo
Association du Gharb pour la Protection de l’Environnement,Non-governmental organizations,,,,
Association Femmes Bladi pour le Développement et le Tourisme,Non-governmental organizations,Constituency - Environmental,Ms. Samia El Baouchi,Sefrou,Morocco
Association for Sustainable Development Milieukontakt Macedonia,Non-governmental organizations,,,,
Association Française des Entreprises pour l’Environnement,Non-governmental organizations,,,,
Association Internationale des Maires et Responsables des Capitales et Metropoles Partiellement ou Entièrement Francophones,Non-governmental organizations,,,,
Association Jeunesse Verte du Cameroun,Non-governmental organizations,Constituency - Women and Gender,Ms. Marie Tamoifo Nkom,Yaounde,Cameroon
Association Marocaine pour la Protection des Aires Marines et Développement Durable,Non-governmental organizations,Constituency - Environmental,Mr. Abdechahid Loukili,Berrechid,Morocco
Association of American Geographers,Non-governmental organizations,Constituency - Research and independent,Ms. Candida Livia Mannozzi,Washington,United States of America
Association of Consulting Engineers,Non-governmental organizations,Constituency - Business and Industry,Mr. Clemens Marcel Kremer,Berlin,Germany
Association of Energy Engineers,Non-governmental organizations,Constituency - Business and Industry,Mr. William Kent,Atlanta,United States of America
Association pour l’Innovation et la Recherche au Service du Climat,Non-governmental organizations,,,,
Association Québécoise de Lutte contre la Pollution Atmosphérique,Non-governmental organizations,Constituency - Environmental CAN,Mr. Alain Francois Brunel,St. Léon -de-Standon,Canada
Atelier21,Non-governmental organizations,Constituency - Environmental,Mr. Cedric Carles,Paris,France
Ateneo de Manila University,Non-governmental organizations,Constituency - Research and independent,Mr. Antonio Gabriel La Viña,Quezon City,Philippines
Atlantic Council,Non-governmental organizations,Constituency - Environmental,Mr. Jorge Gastelumendi,Washington DC,United States of America
Australian Climate Coolers Limited - 1 Million Women,Non-governmental organizations,Constituency - Environmental,Ms. Natalie Isaacs,The Rocks,Australia
Australian Conservation Foundation,Non-governmental organizations,Constituency - Environmental CAN,Ms. Kelly-Ann O'Shanassy,Carlton,Australia
Australian Council for Educational Research,Non-governmental organizations,Constituency - Research and independent,Ms. Bethany Davies,Melbourne,Australia
Australian Rainforest Conservation Society Inc.,Non-governmental organizations,Constituency - Environmental,Ms. Aila Keto,Milton,Australia
Australian Youth Climate Coalition,Non-governmental organizations,Constituency - Youth,Ms. Hillary Eve Montague,Carlton,Australia
Avaaz Foundation,Non-governmental organizations,Constituency - Environmental CAN,Mr. Risalat Khan,New York,United States of America
Avenir Climatique,Non-governmental organizations,Constituency - Youth,Ms. Léa Cruse,Paris,France
Babatunde Development and Empowerment Initiative,Non-governmental organizations,Constituency - Youth,Mr. Ajani Wasiu Babatunde,Akure Ondo State,Nigeria
Bahu Trust,Non-governmental organizations,,Mr. Kamran Shezad,Birmingham,United Kingdom of Great Britain and Northern Ireland
Baltic and International Maritime Council,Non-governmental organizations,Constituency - Business and Industry,Ms. Beverley Mackenzie,Bagsvaerd,Denmark
Ban Ki -moon Centre for Global Citizens,Non-governmental organizations,,,,
Bangladesh Centre for Advanced Studies,Non-governmental organizations,Constituency - Research and independent,Mr. A. Atiq Rahman,Dhaka,Bangladesh
Bangladesh Environmental Lawyers Association,Non-governmental organizations,Constituency - Environmental CAN,Ms. Syeda Hasan,Dhaka,Bangladesh
Bangladesh Resource Centre for Indigenous Knowledge,Non-governmental organizations,Constituency - ENGO,Mr. Sukanta Kumar Sen,Dhaka,Bangladesh
Bangor University,Non-governmental organizations,Constituency - Research and independent,Ms. Alison Mawhinney,Bangor,United Kingdom of Great Britain and Northern Ireland
BankTrack,Non-governmental organizations,Constituency - Environmental,Mr. Johan Frijns,Nijmegen,Netherlands
Basel Agency for Sustainable Energy,Non-governmental organizations,Constituency - Environmental,Mr. Daniel Magallon,Basel,Switzerland
Basque Centre for Climate Change,Non-governmental organizations,Constituency - Research and independent,Ms. Nerea Ortiz,Bilbao,Spain
Bay Area Council Foundation,Non-governmental organizations,Constituency - Business and Industry,Mr. Adrian Joseph Covert,San Francisco,United States of America
BBC Media Action,Non-governmental organizations,Constituency - Research and independent,Ms. Lisa Robinson,London,United Kingdom of Great Britain and Northern Ireland
Bellona Foundation,Non-governmental organizations,Constituency - Environmental,Mr. Olav Oye,Oslo,Norway
Belville Community,Non-governmental organizations,Constituency - Environmental,Ms. Adrian Scott,Greenock,United Kingdom of Great Britain and Northern Ireland
Garden Trust,Non-governmental organizations,Constituency - Environmental,Ms. Adrian Scott,Greenock,United Kingdom of Great Britain and Northern Ireland
BHP Billiton SaskPower Carbon Capture and Storage (CCS) Knowledge Centre Inc. doing business as International CCS Knowledge Centre,Non-governmental organizations,Constituency - Business and Industry,Ms. C. Beth Hardy,Regina,Canada
Biovision - Foundation for Ecological Development,Non-governmental organizations,Constituency - Environmental,Mr. Fabio Leippert,Zurich,Switzerland
BirdLife International,Non-governmental organizations,Constituency - Environmental CAN,Ms. Rhiannon Niven,Cambridge,United Kingdom of Great Britain and Northern Ireland
Bloomberg Philanthropies,Non-governmental organizations,Constituency - Environmental,Ms. Daphne Wang,New York City,United States of America
Blue Marine Foundation,Non-governmental organizations,Constituency - Environmental,Mr. Daniel Crockett,London,United Kingdom of Great Britain and Northern Ireland
Blue Ventures,Non-governmental organizations,Constituency - Environmental,Ms. Annie Tourette,London,United Kingdom of Great Britain and Northern Ireland
Bonsucro Limited,Non-governmental organizations,Constituency - Environmental,Mr. James Jones,London,United Kingdom of Great Britain and Northern Ireland
Boston College,Non-governmental organizations,Constituency - Research and independent,Mr. Joseph Vitale,Chestnut Hill,United States of America
Boston University,Non-governmental organizations,Constituency - Research and independent,Mr. John Prandato,Boston,United States of America
Both ENDS Foundation,Non-governmental organizations,Constituency - Environmental CAN,Mr. Wiert Wiertsema,Amsterdam,Netherlands
Boticário Group Foundation for Nature Protection,Non-governmental organizations,Constituency - Environmental,Mr. Andre Rocha Ferretti,Curitiba,Brazil
Bournemouth University,Non-governmental organizations,Constituency - Research and independent,Ms. Emma Jenkins,Bournemouth,United Kingdom of Great Britain and Northern Ireland
BRAC,Non-governmental organizations,Constituency - Environmental,Mr. Md. Ashadudzaman,Dhaka,Bangladesh
Brahma Kumaris World Spiritual University,Non-governmental organizations,Constituency - Research and independent,Ms. Sonja Maria Ohlsson,Mount Abu,India
Brazilian Biodiversity Fund,Non-governmental organizations,Constituency - Environmental,Mr. Fabio Heuseler Ferreira Leite,Rio de Janeiro,Brazil
Brazilian Business Council for Sustainable Development,Non-governmental organizations,Constituency - Business and Industry,Ms. Luana Maia,Rio de Janiero,Brazil
Brazilian Confederation of Agriculture and Livestock,Non-governmental organizations,,Mr. João Carlos De Petribú Dé Carli Filho,Brasilia,Brazil
Brazilian National Confederation of Industry,Non-governmental organizations,Constituency - Business and Industry,Mr. Davi Bomtempo,Brasília,Brazil
Brazilian Tree Industry,Non-governmental organizations,Constituency - Business and Industry,Ms. Nathalia Loures,Sao Paulo,Brazil
Bread for the World,Non-governmental organizations,Constituency - Environmental CAN,Ms. Annika Rach,Berlin,Germany
Bright Blue,Non-governmental organizations,Constituency - Research and independent,Mr. Patrick Hall,London,United Kingdom of Great Britain and Northern Ireland
"Brighter Green, Inc.",Non-governmental organizations,Constituency - Environmental CAN,Ms. Mia MacDonald,New York,United States of America
British Beauty Council,Non-governmental organizations,Constituency - Business and Industry,Ms. Victoria Marie Brownlie,London,United Kingdom of Great Britain and Northern Ireland
British Columbia Council for International Cooperation,Non-governmental organizations,Constituency - Environmental,Ms. Deborah Glaser,Vancouver,Canada
British Institute of International and Comparative Law,Non-governmental organizations,Constituency - Research and independent,Mr. Ivano Alogna,London,United Kingdom of Great Britain and Northern Ireland
British Lung Foundation,Non-governmental organizations,Constituency - Environmental,Ms. Harriet Edwards,London,United Kingdom of Great Britain and Northern Ireland
British Society of Soil Science,Non-governmental organizations,Constituency - Environmental,Ms. Sarah Garry,Milton Keynes,United Kingdom of Great Britain and Northern Ireland
British Standards Institution,Non-governmental organizations,Constituency - Business and Industry,Mr. David Francis Fatscher,London,United Kingdom of Great Britain and Northern Ireland
Brown University - Watson Institute,Non-governmental organizations,Constituency - Research and independent,Ms. Deborah Gordon,Providence RI,United States of America
Buddhist Tzu Chi Foundation,Non-governmental organizations,Constituency - Environmental,Ms. Debra Boudreaux,San Dimas,United States of America
Business and Industry Advisory Committee to the OECD,Non-governmental organizations,Constituency - Business and Industry,Mr. Dominik Kummerle,Paris,France
Business Council for Sustainable Energy,Non-governmental organizations,Constituency - Business and Industry,Ms. Lisa Jacobson,Washington,United States of America
Business for Social Responsibility,Non-governmental organizations,Constituency - Business and Industry,Mr. David Da-Fan Wei,San Francisco,United States of America
