name,entity_type,constituency,coordinator,city,country
Partnership for Governance Reform,Non-governmental organizations,Constituency - Environmental,Ms. Hindijani Novita,Jakarta,Indonesia
Partnership for Observation of the Global Ocean,Non-governmental organizations,Constituency - Research and independent,Ms. Sophie Seeyave,Plymouth,United Kingdom of Great Britain and Northern Ireland
Pasumai Thaayagam Foundation,Non-governmental organizations,Constituency - Environmental,Mr. Arul Rathinam,Chennai,India
Peace Boat Disaster Relief Volunteer Center,Non-governmental organizations,Constituency - Environmental,Ms. Karen Louise Hallows,Tokyo,Japan
Peace Child International,Non-governmental organizations,Constituency - Business and Industry,Mr. David Rupert Woollcombe,Bunting Ford,United Kingdom of Great Britain and Northern Ireland
Peace Rising,Non-governmental organizations,Constituency - Research and independent,Ms. Amber Houghstow,Somerville,United States of America
Pembina Institute for Appropriate Development,Non-governmental organizations,Constituency - Environmental CAN,Mr. Bora Plumptre,Calgary,Canada
People in Need,Non-governmental organizations,Constituency - ENGO,Mr. Fabrizio Orsini,Prague 2,Czechia
Peoples’ Forum 2001 GWRG,Non-governmental organizations,,,,
Perspectives Climate Research gGmbH,Non-governmental organizations,Constituency - Research and independent,Ms. Cathrin Arenz,Freiburg,Germany
Pew Charitable Trusts,Non-governmental organizations,Constituency - Environmental CAN,Ms. Guinnevere Roberts,Philadelphia,United States of America
Phipps Conservatory and Botanical Gardens,Non-governmental organizations,Constituency - Environmental,Ms. Susan Smith,Pittsburgh,United States of America
Plan International,Non-governmental organizations,Constituency - Environmental,Ms. Jessica Cooke,London,United Kingdom of Great Britain and Northern Ireland
Planète Amazone,Non-governmental organizations,Constituency - Indigenous peoples,Mr. Gert Bruch,Courbevoie,France
Plant for the Planet Foundation,Non-governmental organizations,Constituency - Environmental,Ms. Helge Maren Bork,Tutzing,Germany
Plant Technology Alliance,Non-governmental organizations,Constituency - Environmental,Ms. Yuhui Chai,Hong Kong,China
Plantlife International – The Wild Plant Conservation Charity,Non-governmental organizations,,,,
Plateforme Océan et Climat,Non-governmental organizations,Constituency - Environmental,Ms. Loreley Picourt,Paris,France
Plymouth Marine Laboratory,Non-governmental organizations,Constituency - Environmental,Ms. Thecla Keizer,Plymouth,United Kingdom of Great Britain and Northern Ireland
Point Blue Conservation Science,Non-governmental organizations,Constituency - Environmental,Mr. Manuel Oliva,Petaluma,United States of America
Polar Bears International,Non-governmental organizations,Constituency - Environmental,Mr. Geoff York,Bozeman,United States of America
Policy Connect,Non-governmental organizations,Constituency - Environmental,Ms. Agnes Szuda,London,United Kingdom of Great Britain and Northern Ireland
Polish Ecological Club,Non-governmental organizations,Constituency - Environmental CJN,Ms. Urszula Stefanowicz,Kraków,Poland
Polytechnic of Turin,Non-governmental organizations,Constituency - Research and independent,Ms. Patrizia Lombardi,Turin,Italy
Pompeu Fabra University,Non-governmental organizations,Constituency - Research and independent,Mr. Jaume Albertí,Barcelona,Spain
Potsdam Institute for Climate Impact Research,Non-governmental organizations,Constituency - Research and independent,Ms. Annika Günther,Potsdam,Germany
Practical Action,Non-governmental organizations,Constituency - Environmental CAN,Mr. Colin McQuistan,Rugby,United Kingdom of Great Britain and Northern Ireland
Prakriti Resources Centre,Non-governmental organizations,Constituency - Environmental,Mr. Raju Pandit Chhetri,Kathmandu,Nepal
Presbyterian Church (U.S.A.),Non-governmental organizations,Constituency - Environmental CAN,Ms. Rebecca Jane Barnes,Louisville,United States of America
Presbyterians for Earth Care,Non-governmental organizations,Constituency - Environmental,Ms. Mindy Hidenfelter,Asheville,United States of America
Press Club Brussels Europe,Non-governmental organizations,Constituency - Research and independent,Mr. Laurence Moffett,Brussels,Belgium
PRI Association,Non-governmental organizations,Constituency - Business and Industry,Mr. Jack Balsdon,London,United Kingdom of Great Britain and Northern Ireland
Prime Initiative for Green Development,Non-governmental organizations,Constituency - Environmental,Mr. Thankgod Tito Uzomah,Port Harcourt,Nigeria
Prince’s Trust International,Non-governmental organizations,,,,
Princeton University,Non-governmental organizations,Constituency - Research and independent,Mr. Charles Crosby,Princeton,United States of America
Pro-Natura International,Non-governmental organizations,Constituency - Environmental,Mr. Guy Reinaud,Paris,France
ProClim - Forum for Climate and Global Change,Non-governmental organizations,Constituency - Research and independent,Ms. Karin Ammon,Bern,Switzerland
Professional Government Association,Non-governmental organizations,Constituency - Local government and Municipal authorities,Ms. Marta Trofimova,Kyiv,Ukraine
Project Developer Forum Ltd.,Non-governmental organizations,Constituency - Business and Industry,Mr. Sven Gunther Kolmetz,Wigan,United Kingdom of Great Britain and Northern Ireland
"Pronatura Sur, A. C.",Non-governmental organizations,Constituency - Environmental,Mr. Jose Antonio Montero Solano,San Cristobal De Las Casas,Mexico
Protect Our Winters,Non-governmental organizations,Constituency - Environmental,Ms. Lauren MacCallum,Edinburgh,United Kingdom of Great Britain and Northern Ireland
ProVeg Deutschland e.V.,Non-governmental organizations,Constituency - Environmental,Mr. Raphael Podselver,Berlin,Germany
Proyectando un Ambiente y Sociedad verde A.C.,Non-governmental organizations,Constituency - Environmental,Mr. Ricardo González Hernández,Mexico City,Mexico
Public Health Institute,Non-governmental organizations,Constituency - Local government and Municipal authorities,Ms. Linda Rudolph,Oakland,United States of America
Purdue University - Purdue Climate Change Research Center,Non-governmental organizations,Constituency - Research and independent,M. Filley,West Lafayette,United States of America
Purves Environmental Fund,Non-governmental organizations,Constituency - Environmental,Ms. Erika Hosoyama,Sydney,Australia
PUSH Sweden,Non-governmental organizations,Constituency - Youth,Mr. Adam Leckius,Stockholm,Sweden
Quaker Earthcare Witness,Non-governmental organizations,Constituency - Environmental,Ms. Shelley Tanenbaum,Albany,United States of America
Quakers in Britain,Non-governmental organizations,Constituency - Environmental,Ms. Suzanne Ismail,London,United Kingdom of Great Britain and Northern Ireland
Queen Mary University of London,Non-governmental organizations,Constituency - Research and independent,Mr. David McCoy,London,United Kingdom of Great Britain and Northern Ireland
Queen’s University,Non-governmental organizations,,,,
R20 - Regions of Climate Action,Non-governmental organizations,Constituency - Environmental,Mr. Christophe Nuttall,Geneva,Switzerland
Rainforest Action Network,Non-governmental organizations,Constituency - Environmental CJN,Mr. Patrick McCully,San Francisco,United States of America
Rainforest Alliance,Non-governmental organizations,Constituency - Environmental,Mr. Martin Noponen,New York,United States of America
Rainforest Concern,Non-governmental organizations,Constituency - Environmental,Mr. Peter Bennett,London,United Kingdom of Great Britain and Northern Ireland
Rainforest Foundation Norway,Non-governmental organizations,Constituency - Environmental CAN,Mr. Torbjørn Gjefsen,Oslo,Norway
Rainforest Foundation UK,Non-governmental organizations,Constituency - Environmental,Mr. Joseph Eisen,London,United Kingdom of Great Britain and Northern Ireland
Rainforest Partnership,Non-governmental organizations,Constituency - Environmental,Ms. Niyanta Spelman,Austin,United States of America
Rare,Non-governmental organizations,Constituency - Environmental,Ms. Arlane Marietta Steins - Meier,Arlington,United States of America
Real Instituto Elcano,Non-governmental organizations,Constituency - Research and independent,Sra. Lara Lazaro Touza,Madrid (28006),Spain
Recourse,Non-governmental organizations,Constituency - Environmental,Ms. Petra Kjell,Amsterdam,Netherlands
ReefQuest Foundation,Non-governmental organizations,Constituency - Environmental,Ms. Megan Bettilyon,Pacific Palisades,United States of America
Reevaluation Foundation,Non-governmental organizations,Constituency - Environmental,Ms. Janet Wambui Kabue,Shoreline,United States of America
Reforestamos Mexico,Non-governmental organizations,Constituency - Environmental,Ms. Raquel Jimenez Acosta,Mexico City,Mexico
Regen SW Ltd,Non-governmental organizations,Constituency - Research and independent,Ms. Paula Scott,Exeter,United Kingdom of Great Britain and Northern Ireland
Regeneration International,Non-governmental organizations,Constituency - Environmental,Ms. Ercilia Sahores,Finland,United States of America
Regional Environmental Centre for Central Asia,Non-governmental organizations,Constituency - Environmental,Ms. Irina Bekmirzaeva,Almaty,Kazakhstan
"Regional Institute of Health, Medicine and Research",Non-governmental organizations,Constituency - Research and independent,Mr. Vijay Sharma,Jaipur,India
Regions4 for Sustainable Development,Non-governmental organizations,Constituency - Local government and Municipal authorities,Ms. Heloise Chicou,Brussels,Belgium
Regroupement National des Conseils Régionaux de l’Environnement du Québec,Non-governmental organizations,,,,
Renewable Energy and Energy Efficiency Partnership,Non-governmental organizations,Constituency - Environmental,Ms. Eszter Winkler,Vienna,Austria
Renewable Energy Institute,Non-governmental organizations,Constituency - Research and independent,Ms. Mika Ohbayashi,Tokyo,Japan
Renewable Energy Policy Network,Non-governmental organizations,Constituency - Environmental,Ms. Laura Williamson,Paris,France
Renewables Grid Initiative e.V.,Non-governmental organizations,Constituency - Environmental,Ms. Antonella Battaglini,Berlin,Germany
REScoop.eu vzw,Non-governmental organizations,Constituency - Business and Industry,Ms. Sara Tachelet,Brussels,Belgium
"Research and Development Centre, Nepal",Non-governmental organizations,Constituency - Research and independent,Mr. Ramdhyan Prasad Yadav,Kathmandu,Nepal
Research and Innovation Centre Pro-Akademia,Non-governmental organizations,Constituency - Research and independent,Ms. Katarzyna Korczak,Konstantynow Lodzki,Poland
Research Triangle Institute,Non-governmental organizations,Constituency - Research and independent,Mr. Robert Beach,Research Triangle Park,United States of America
Réseau Action Climat - France,Non-governmental organizations,Constituency - Environmental CAN,Ms. Aurore Mathieu,Montreuil,France
Réseau Communautaire pour le Pauvre,Non-governmental organizations,Constituency - Environmental,Mr. Feli Esau Ubebu,Kinshasa,Democratic Republic of the Congo
Réseau Français des Etudiants pour le Développement Durable,Non-governmental organizations,Constituency - Youth,Mr. Lucas Paoli,Paris,France
Resources for the Future,Non-governmental organizations,Constituency - Research and independent,Ms. Kristin Hayes,Washington,United States of America
Responding to Climate Change,Non-governmental organizations,Constituency - Business and Industry,Ms. Nicole Serrij,London,United Kingdom of Great Britain and Northern Ireland
Restless Development,Non-governmental organizations,Constituency - Youth,Ms. Inés Yabar,London,United Kingdom of Great Britain and Northern Ireland
"Reusa Misión Planeta, A.C.",Non-governmental organizations,Constituency - Environmental,Mme Isela Indira Salas Juárez,Iztapalapa,Mexico
Rheinische Friedrich-Wilhelms-Universität Bonn,Non-governmental organizations,Constituency - Research and independent,Ms. Sandra Gilgan,Bonn,Germany
"Rights and Resources Institute, Inc.",Non-governmental organizations,Constituency - Environmental,Mr. Joseph Bono,Washington,United States of America
Rios to Rivers,Non-governmental organizations,Constituency - Youth,Mr. Weston Boyles,Aspen,United States of America
Robert Bosch Foundation,Non-governmental organizations,,Ms. Julia Sonntag,Stuttgart,Germany
Rock Environment and Energy Institute,Non-governmental organizations,Constituency - Research and independent,Mr. Jiaqiao Lin,Beijing,China
"Rockefeller Brothers Fund, Inc.",Non-governmental organizations,Constituency - Environmental,Mr. Thomas Kruse,New York,United States of America
"Rockefeller Philanthropy Advisors, Inc.",Non-governmental organizations,Constituency - Research and independent,Ms. Rachel Mary Potter,New York,United States of America
Rocky Mountain Institute,Non-governmental organizations,Constituency - Environmental,Ms. Denali Rose Hussin,Boulder,United States of America
Rosa-Luxemburg-Stiftung Gesellschaftsanalye und Politische Bildung e.V.,Non-governmental organizations,,,,
Rotary International,Non-governmental organizations,Constituency - Environmental,Ms. Jane Lawicki,"Evanston, IL",United States of America
Roundtable on Sustainable Palm Oil,Non-governmental organizations,Constituency - Environmental,Ms. Monisha Mohandas,Kuala Lumpur,Malaysia
Royal College of Physicians of London,Non-governmental organizations,Constituency - Environmental,Mr. Rory Murray,London,United Kingdom of Great Britain and Northern Ireland
Royal College of Psychiatrists,Non-governmental organizations,Constituency - Research and independent,Ms. Minha Fayoom,London,United Kingdom of Great Britain and Northern Ireland
"Royal Holloway, University of London",Non-governmental organizations,Constituency - Research and independent,Ms. Sue Starbuck,Egham,United Kingdom of Great Britain and Northern Ireland
Royal Institute of British Architects,Non-governmental organizations,Constituency - Business and Industry,Ms. Eve Pienaar,London,United Kingdom of Great Britain and Northern Ireland
Royal Meteorological Society,Non-governmental organizations,Constituency - ENGO,Ms. Liz Bentley,Reading,United Kingdom of Great Britain and Northern Ireland
Royal Society of Wildlife Trusts,Non-governmental organizations,Constituency - Environmental,Mr. Gary Jonathan Mantle,Newark,United Kingdom of Great Britain and Northern Ireland
Rural Women Energy Security Ltd/Gte,Non-governmental organizations,Constituency - Women and Gender,Ms. Nafisah Abubakar,Abuja,Nigeria
Russian Carbon Fund,Non-governmental organizations,Constituency - Environmental,Mr. Alexey Shadrin,Moscow,Russian Federation
Saami Council Headquarters,Non-governmental organizations,Constituency - Indigenous peoples,Ms. Aile Javo,Karasjok,Norway
Sabanci University,Non-governmental organizations,Constituency - Environmental,Mr. Umit Sahin,Istanbul,Turkey
Sachamama,Non-governmental organizations,Constituency - Environmental,Ms. Claudia Zegarra,Boynton Beach,United States of America
Sahkar Social Welfare Association,Non-governmental organizations,Constituency - Women and Gender,Mr. Riaz Hussain Chandio,Larkana,Pakistan
Saint John’s University,Non-governmental organizations,,,,
Salve Regina University,Non-governmental organizations,Constituency - Research and independent,Ms. Theresa Ladrigan-Whelpley,Newport RI,United States of America
Sant’Anna School of Advanced Studies,Non-governmental organizations,,,,
Santa Fe Community Foundation,Non-governmental organizations,Constituency - Environmental,Mr. Gary Payton,Santa Fe,United States of America
Sasakawa Peace,Non-governmental organizations,Constituency - Environmental,Ms. Miko Maekawa,Tokyo,Japan
Sauvons Le Climat,Non-governmental organizations,Constituency - Environmental,Mr. Stephan Savarese,Paris,France
Save the Children International,Non-governmental organizations,Constituency - Youth,Mr. Christophe Belperron,London,United Kingdom of Great Britain and Northern Ireland
Saving Our Planet,Non-governmental organizations,Constituency - Environmental,Mr. Stephan Savarese,Paris,France
School of Environmental Studies Education Foundation,Non-governmental organizations,Constituency - Environmental,Mr. Robert Joseph Haider,Apple Valley,United States of America
Science Museum of Minnesota,Non-governmental organizations,Constituency - Research and independent,Mr. Patrick Hamilton,Saint Paul,United States of America
Sciences Po,Non-governmental organizations,Constituency - Research and independent,Mr. Vincent Morandi,Paris,France
Scientific Committee on Antarctic Research,Non-governmental organizations,Constituency - Research and independent,Ms. Pathikonda Chandrika Nath,Cambridge,United Kingdom of Great Britain and Northern Ireland
Scientists Warning Europe,Non-governmental organizations,Constituency - Environmental,Mr. Edmund Gemmell,London,United Kingdom of Great Britain and Northern Ireland
Scotland’s International Development Alliance,Non-governmental organizations,,,,
Scottish Association for Marine Science,Non-governmental organizations,Constituency - Research and independent,Mr. Adam Hughes,Oban,United Kingdom of Great Britain and Northern Ireland
Scottish Catholic International Aid Fund,Non-governmental organizations,Constituency - Environmental,Ms. Geraldine Hill,Glasgow,United Kingdom of Great Britain and Northern Ireland
Scottish Council of Jewish Communities,Non-governmental organizations,,Ms. Ruby Katz,Glasgow,United Kingdom of Great Britain and Northern Ireland
Scottish Ecological Design Association,Non-governmental organizations,Constituency - Environmental,Ms. Catherine Cosgrove,Glasgow,United Kingdom of Great Britain and Northern Ireland
Scottish Hydrogen and Fuel Cell Association,Non-governmental organizations,Constituency - Business and Industry,Mr. Nigel Holmes,Edinburgh,United Kingdom of Great Britain and Northern Ireland
"SDSN Association, Inc.",Non-governmental organizations,Constituency - Research and independent,Ms. Elena Crete,New York,United States of America
Seas at Risk,Non-governmental organizations,Constituency - Environmental,Mr. John Maggs,Brussels,Belgium
SeaTrust Institute,Non-governmental organizations,Constituency - Research and independent,Ms. Lynn Wilson,Olympia,United States of America
Seawater Foundation,Non-governmental organizations,Constituency - Research and independent,Ms. Elizabeth Swilling Hodges,Tucson,United States of America
Second Nature,Non-governmental organizations,Constituency - Environmental,Mr. Tim Carter,Boston,United States of America
Sentinel Advocacy,Non-governmental organizations,Constituency - Environmental,Ms. Brook Meakins,Berkeley,United States of America
Servicios Ecumenicos para Reconciliacion y Reconstruccion,Non-governmental organizations,Constituency - Environmental,Ms. Cheryl Desmond,Lancaster,United States of America
Seven Generations Ahead,Non-governmental organizations,Constituency - Environmental,Mr. Gary Cuneen,Oak Park,United States of America
Shariatpur Development Society,Non-governmental organizations,Constituency - Women and Gender,Ms. Rabeya Begum,Shariatpur,Bangladesh
Shinji Shumeikai,Non-governmental organizations,Constituency - Environmental,Ms. Kristina Mayo,Koka,Japan
Sierra Club,Non-governmental organizations,Constituency - Environmental CAN,Ms. Cherelle Blazer,Oakland,United States of America
Sierra Club Canada,Non-governmental organizations,Constituency - Environmental CAN,Ms. Gretchen Fitzgerald,Ottawa,Canada
"SILVA, Arbres, Forêts et Sociétes",Non-governmental organizations,Constituency - Environmental,Mr. Joseph Francois Racapé,Paris,France
Simon Fraser University,Non-governmental organizations,Constituency - Research and independent,Mr. Michael Douglas Small,Burnaby,Canada
SINTEF Foundation,Non-governmental organizations,Constituency - Research and independent,Ms. Anne Steenstrup-Duch,Trondheim,Norway
Size of Wales,Non-governmental organizations,Constituency - Environmental,Mr. Kevin Rahmandaultrey,Cardiff,United Kingdom of Great Britain and Northern Ireland
Small and Medium Scale Entrepreneurship Fundamentals Foundation,Non-governmental organizations,Constituency - Environmental,Mr. Femi Oye,Lagos,Nigeria
Smart Energy for Europe Platform (SEFEP) gGmbH,Non-governmental organizations,Constituency - Research and independent,Ms. Lidia Wojtal,Berlin,Germany
Sniffer,Non-governmental organizations,Constituency - Environmental,Mr. Kit England,Edinburgh,United Kingdom of Great Britain and Northern Ireland
SNV Netherlands Development Organisation,Non-governmental organizations,Constituency - Environmental,Ms. Janne Maria Teule,The Hague,Netherlands
SOAS University of London,Non-governmental organizations,Constituency - Research and independent,Mr. James Dunn,London,United Kingdom of Great Britain and Northern Ireland
Sociedad Argentino Para el Derecho y la Administración del Ambiente y de los Recursos Naturales,Non-governmental organizations,Constituency - Environmental,Mr. Eduardo Andres Pigretti,Buenos Aires,Argentina
Società Italiana per le Scienze del Clima,Non-governmental organizations,Constituency - Research and independent,Ms. Martina Gambaro,Marghera-Venice,Italy
Society for Development and Community Empowerment,Non-governmental organizations,Constituency - Youth,Mr. Kayode Adedoye,Port Harcourt,Nigeria
Society for Improving Livelihood,Non-governmental organizations,Constituency - Research and independent,Mr. Padian Srinivasan,India,India
Society for the Environment,Non-governmental organizations,Constituency - Environmental,Ms. Emma Wilcox,Coventry,United Kingdom of Great Britain and Northern Ireland
Society of Entrepreneurs and Ecology Foundation,Non-governmental organizations,Constituency - Environmental,Ms. Zhiyao Lu,Beijing,China
Society of Jesus Trust of 1929 for Roman Catholic Purposes,Non-governmental organizations,Constituency - Environmental,Mr. Colm Fahy,London,United Kingdom of Great Britain and Northern Ireland
Soka Gakkai International - UK,Non-governmental organizations,Constituency - Research and independent,Mr. Robert Harrap,Taplow,United Kingdom of Great Britain and Northern Ireland
Soka Gakkai International Office for UN Affairs,Non-governmental organizations,Constituency - Youth,Mr. Hiroyuki Sakurai,New York,United States of America
Solar Cookers,Non-governmental organizations,Constituency - Environmental,Mr. Alan Bigelow,Sacramento,United States of America
Solar Impulse Foundation,Non-governmental organizations,Constituency - Environmental,Mme Charlotte Campiche,Lausanne,Switzerland
Solutions for Our Climate,Non-governmental organizations,Constituency - Environmental,Ms. Soyoung Lee,Seoul,Republic of Korea
Solutions from the Land,Non-governmental organizations,Constituency - Farmers,Ms. Shannon Mott,Lutherville,United States of America
SOS Atlantic Forest Foundation,Non-governmental organizations,Constituency - Environmental,Ms. Maria Luiza Taborda Borges Ribeiro,São Paulo,Brazil
SOS SAHEL International France,Non-governmental organizations,Constituency - Farmers,Ms. Emilie Rouxel,,France
South African Institute of International Affairs,Non-governmental organizations,Constituency - Research and independent,Ms. Desirée Joy Kosciulek,Braamfontein,South Africa
Southeast Climate and Energy Network,Non-governmental organizations,Constituency - Environmental,Sra. Sara Ochoa,Sunrise,United States of America
Southern African Confederation of Agricultural Unions,Non-governmental organizations,Constituency - Farmers,Mr. Ishmael Sunga,Pretoria,South Africa
Southern Institute for Appropriate Technology,Non-governmental organizations,Constituency - Farmers,Mr. Clyde Wilson,Lineville,United States of America
SouthSouthNorth Projects Africa,Non-governmental organizations,Constituency - Environmental,,Cape Town,South Africa
Space for Giants,Non-governmental organizations,Constituency - Environmental,Mr. Henry van der Does de Willebois,London,United Kingdom of Great Britain and Northern Ireland
Stakeholder Forum for a Sustainable Future,Non-governmental organizations,Constituency - ENGO,Mr. Charles Allen Nouhan,Herne Bay,United Kingdom of Great Britain and Northern Ireland
Stand,Non-governmental organizations,Constituency - Business and Industry,Mr. David Francis Fatscher,London,United Kingdom of Great Britain and Northern Ireland
Stanford University,Non-governmental organizations,Constituency - Environmental,Ms. Patricia Hines,Stanford,United States of America
Stichting Climate Action Network South Asia,Non-governmental organizations,Constituency - Environmental CAN,Mr. Sanjay Vashist,Dhaka,Bangladesh
Stichting Global Reporting Initiative,Non-governmental organizations,Constituency - Business and Industry,Ms. Tina Nybo Jensen,Amsterdam,Netherlands
Stichting High Carbon Stock Approach Foundation,Non-governmental organizations,Constituency - Environmental,Ms. Fitrah Firdaos,Amsterdam,Netherlands
Stichting Hivos (Humanistisch Instituut voor Ontwikkelingssamen-werking),Non-governmental organizations,,,,
"Stichting Partnership on Sustainable, Low Carbon Transport (SLoCaT) Foundation",Non-governmental organizations,Constituency - Environmental,Ms. Alice Yiu,Utrecht,Netherlands
Stichting Smart Freight Centre,Non-governmental organizations,Constituency - Environmental,Ms. Mirjam Botman,Amsterdam,Netherlands
Stichting Wageningen Research,Non-governmental organizations,Constituency - Research and independent,Mr. Tim van Hattum,Wageningen,Netherlands
Stiftung Mercator Foundation,Non-governmental organizations,Constituency - Environmental,Mr. Lars Grotewold,Essen,Germany
Stockholm Environment Institute,Non-governmental organizations,Constituency - Research and independent,Ms. Cleo Verkuijl,Stockholm,Sweden
Stockholm International Water Institute,Non-governmental organizations,Constituency - Research and independent,Ms. Kristina Gunilla Johansson,Stockholm,Sweden
