,name,entity_type,constituency,coordinator,city,country,remarks,const
486,Global Justice Now,Non-governmental organizations,Constituency - Environmental CJN,Ms. Dorothy Grace Guerrero,London,United Kingdom of Great Britain and Northern Ireland,,ENGO
487,Global Legislators Organisation for a Balanced Environment,Non-governmental organizations,Constituency - Environmental,Mr. Rafael Jiménez-Aybar,Brussels,Belgium,,ENGO
488,Global Marshall Plan Foundation,Non-governmental organizations,Constituency - Research and independent,Mr. Frithjof Michael Finkbeiner,Hamburg,Germany,,RINGO
489,Global Peace Initiative of Women,Non-governmental organizations,Constituency - Environmental,Ms. Marianne Marstrand,New York,United States of America,,ENGO
490,Global Public Policy Institute,Non-governmental organizations,Constituency - Research and independent,Ms. Charlotte Streck,Berlin,Germany,,RINGO
491,Global Sustainable Electricity Partnership,Non-governmental organizations,Constituency - Business and Industry,Ms. Isabelle Mégré,Montreal,Canada,,BINGO
492,Global Village of Beijing,Non-governmental organizations,Constituency - Environmental CAN,Ms. Feng Wang,Beijing,China,,ENGO
493,Global Voices,Non-governmental organizations,Constituency - Youth,Ms. Alexandra Valerio,Victoria,Australia,,Youth
494,Global Wind Energy Council,Non-governmental organizations,Constituency - Business and Industry,Ms. Alyssa Anne Pek,Brussels,Belgium,,BINGO
495,Global Witness Limited,Non-governmental organizations,,Mr. Mike Davis,London,United Kingdom of Great Britain and Northern Ireland,completed manually,not yet affiliated/no data
496,GoodPlanet,Non-governmental organizations,Constituency - Environmental,Mr. Thierry Touchais,Paris,France,,ENGO
497,Gorakhpur Environmental Action Group,Non-governmental organizations,Constituency - Environmental CAN,Mr. Shiraz Akhtar Wajih,Gorakhpur,India,,ENGO
498,Gordon E. and Betty I. Moore Foundation,Non-governmental organizations,Constituency - Environmental,Ms. Katherine Geesey,Palo Alto,United States of America,,ENGO
499,Green Asia Network,Non-governmental organizations,Constituency - Environmental,Mr. Jaekwang Ko,Seoul,Republic of Korea,,ENGO
500,Green Belt Movement,Non-governmental organizations,Constituency - Environmental CAN,Ms. Aisha Wanjiku Karanja,Nairobi,Kenya,,ENGO
501,Green Club,Non-governmental organizations,Constituency - Environmental,Mr. Joseph Lin,Vancouver,Canada,,ENGO
502,Green Cross International,Non-governmental organizations,Constituency - Environmental CAN,Mr. Liam Marcello Quaresimin,Santa Monica,United States of America,,ENGO
503,Green Economics Institute,Non-governmental organizations,Constituency - Research and independent,Ms. Miriam Kennet,Reading,United Kingdom of Great Britain and Northern Ireland,,RINGO
504,Green European Foundation,Non-governmental organizations,Constituency - Research and independent,Mr. Ognjen Sobat,Luxembourg,Luxembourg,,RINGO
505,Green Institute Limited,Non-governmental organizations,Constituency - Environmental,Ms. Margaret Blakers,Hobart,Australia,,ENGO
506,Green Korea United,Non-governmental organizations,Constituency - Environmental,Mr. Seungmoon Kwon,Seoul,Republic of Korea,,ENGO
507,Greener Impact International,Non-governmental organizations,Constituency - Environmental,Mr. Gawusu-Toure Kassim,Accra,Ghana,,ENGO
508,Greenhouse Gas Management Institute,Non-governmental organizations,Constituency - Research and independent,Ms. Molly White,Silver Spring,United States of America,,RINGO
509,Greenpeace International,Non-governmental organizations,Constituency - Environmental CAN,Ms. Naomi Ursula Goodman,Amsterdam,Netherlands,,ENGO
510,Groupe d'études et de recherches sur les énergies renouvelables et l'environnement,Non-governmental organizations,Constituency - Environmental,Mr. Ahmed-Faouzi Senhaji,Rabat,Morocco,completed manually from UNFCCC website,ENGO
511,Groupe de recherche et d'echanges technologiques,Non-governmental organizations,Constituency - Environmental,Ms. Marie Bessières,Nogent-Sur-Marne,France,,ENGO
512,"Groupe Energies Renouvelables, Environnement et Solidarités",Non-governmental organizations,Constituency - Environmental,M. Saverio Ragazzi,Aubagne,France,completed manually from UNFCCC website,ENGO
513,Grupo GEA,Non-governmental organizations,Constituency - ENGO,Mr. Marcos Alegre,Lima,Peru,,ENGO
514,HACEY's Health Initiative,Non-governmental organizations,Constituency - Youth,Mr. Isaiah Oluwatobi Owolabi,Lagos,Nigeria,,Youth
515,Harvard University,Non-governmental organizations,Constituency - Research and independent,Mr. Robert Stowe,Cambridge,United States of America,,RINGO
516,HATOF Foundation,Non-governmental organizations,Constituency - Environmental CAN,Mr. Samuel Confidence Dotse,Tema,Ghana,,ENGO
517,Health and Environment Alliance,Non-governmental organizations,Constituency - Environmental,Ms. Lucy Mathieson,Brussels,Belgium,,ENGO
518,Health Care Without Harm,Non-governmental organizations,Constituency - Environmental CAN,Ms. Jennifer Wang,Reston,United States of America,,ENGO
519,HEDA Resource Centre,Non-governmental organizations,Constituency - Environmental,Mr. Sulaimon Olawale Arigbabu,Ikeya,Nigeria,,ENGO
520,Heinrich Böll Foundation,Non-governmental organizations,Constituency - Environmental,Ms. Kristin Funke,Berlin,Germany,,ENGO
521,HELIO International,Non-governmental organizations,Constituency - Environmental CAN,Ms. Christine Fiebig,Paris,France,,ENGO
522,Helvetas Swiss Intercooperation,Non-governmental organizations,Constituency - Environmental,Ms. Rupa Mukerji,Zuerich,Switzerland,,ENGO
523,Hong Kong Climate Change Forum,Non-governmental organizations,Constituency - Environmental,Ms. Gail Kendall,Hong Kong,China,,ENGO
524,Hong Kong People's Council for Sustainable Development Limited,Non-governmental organizations,Constituency - ENGO,Mr. Kwong Tak Albert Lai,Hong Kong,China,,ENGO
525,Huairou Commission Women Homes and Community,Non-governmental organizations,Constituency - Women and Gender,Ms. Suranjana Gupta,Brooklyn,United States of America,,Women and Gender
526,Humane Society International,Non-governmental organizations,Constituency - Environmental CAN,Ms. Nicola Jane Beynon,Sydney,Australia,,ENGO
527,Ibon Foundation Inc.,Non-governmental organizations,,Ms. Jennifer del Rosario-Malonzo,Quezon City,Philippines,completed manually,not yet affiliated/no data
528,ICLEI-Local Governments for Sustainability,Non-governmental organizations,Constituency - Local government and Municipal authorities,Mr. Yunus Arikan,Bonn,Germany,,LGMA
529,Imperial College London,Non-governmental organizations,Constituency - Research and independent,Ms. Alyssa Gilbert,London,United Kingdom of Great Britain and Northern Ireland,,RINGO
530,Indian Youth Climate Network,Non-governmental organizations,Constituency - Environmental CAN,Mr. Reva Prakash,New Delhi,India,,ENGO
531,Indigenous Education Network of Turtle Island,Non-governmental organizations,,,Bemidji,United States of America,completed manually,not yet affiliated/no data
532,Indigenous People of Africa Coordinating Committee,Non-governmental organizations,Constituency - Indigenous peoples,Ms. Mala Mareacheallee,Cape Town,South Africa,,IPO
533,Indigo Development and Change,Non-governmental organizations,Constituency - Research and independent,Ms. Bettina Koelle,Nieuwoudtville,South Africa,,RINGO
534,Industrial Technology Research Institute,Non-governmental organizations,Constituency - Research and independent,Mr. Chen-An Lien,Hsinchu,China,,RINGO
535,IndustriALL Global Union,Non-governmental organizations,Constituency - Trade Unions,Mr. Brian Kohler,Geneva,Switzerland,,TUNGO
536,IndyACT-The League of Independent Activists,Non-governmental organizations,Constituency - Environmental CAN,Ms. Safa Mustafa Mohammad,Beirut,Lebanon,,ENGO
537,Ingénieurs sans frontières ISF,Non-governmental organizations,,,Paris,France,completed manually,not yet affiliated/no data
538,Initiative Développement,Non-governmental organizations,Constituency - Environmental,Mr. Mathieu Le Gagneux,Poitiers,France,,ENGO
539,Innovation Center for Energy and Transportation,Non-governmental organizations,Constituency - Environmental,Ms. Lucia Green-Weiskel,Pasadena,China,,ENGO
540,Institut de recherche sur l'environnement,Non-governmental organizations,Constituency - Environmental,M. Christian Guerraz,La Roche sur Foron,France,,ENGO
541,Institut du Développement Durable et des Relations Internationales,Non-governmental organizations,Constituency - Research and independent,Mme Lola Vallejo,Paris,France,,RINGO
542,Institut français des formateurs risques majeurs et protection de l'environnement,Non-governmental organizations,,Ms. Sylvette Pierron,Paris,France,completed manually,not yet affiliated/no data
543,Institut national de la recherche agronomique,Non-governmental organizations,,Mr. Philippe Mauguin,Paris,France,completed manually,not yet affiliated/no data
544,Institut Veolia,Non-governmental organizations,Constituency - Environmental,Mme Lorraine de Jerphanion,Aubervilliers,France,,ENGO
545,Institute ECOAR for Citizenship,Non-governmental organizations,Constituency - Environmental,Ms. Miriam Duailibi,Sao Paulo,Brazil,,ENGO
546,Institute for Advanced Sustainability Studies,Non-governmental organizations,Constituency - Research and independent,Ms. Kathleen Anne Mar,Potsdam,Germany,,RINGO
547,Institute for Agricultural and Forest Management and Certification,Non-governmental organizations,Constituency - Environmental,Ms. Marina Piatto,Piracicaba,Brazil,,ENGO
548,Institute for Agriculture and Trade Policy,Non-governmental organizations,Constituency - Environmental,Ms. Shefali Sharma,Minneapolis,United States of America,,ENGO
549,Institute for Conservation and Sustainable Development of Amazonas,Non-governmental organizations,Constituency - Environmental,Ms. Fernanda Peixoto Barbosa,Manaus,Brazil,,ENGO
550,Institute for Environment and Development Sustainability,Non-governmental organizations,Constituency - Environmental,Ms. Abela Gloria Mutabiilwa,Dar Es Salaam,United Republic of Tanzania,,ENGO
551,Institute for Environmental Security,Non-governmental organizations,Constituency - Environmental,Mr. Ronald Kingham,The Hague,Netherlands,,ENGO
552,Institute for Global Environmental Strategies,Non-governmental organizations,Constituency - Research and independent,Mr. Kentaro Tamura,Kanagawa,Japan,,RINGO
553,Institute for Governance and Sustainable Development,Non-governmental organizations,Constituency - Environmental,Ms. Trina Chiemi Thorbjornsen,Washington,United States of America,,ENGO
554,Institute for Policy Studies,Non-governmental organizations,Constituency - Environmental CAN,Mr. Oscar Reyes,Washington,United States of America,,ENGO
555,Institute for Public Policy Research,Non-governmental organizations,Constituency - Environmental,Mr. Luke Murphy,London,United Kingdom of Great Britain and Northern Ireland,,ENGO
556,Institute for Social and Environmental Transition,Non-governmental organizations,Constituency - Research and independent,Mr. Kenneth MacClune,Boulder,United States of America,,RINGO
557,Institute for Sustainable Energy Policies,Non-governmental organizations,Constituency - Environmental CAN,Mr. Tetsunari Iida,Tokyo,Japan,,ENGO
558,Institute for Transportation and Development Policy,Non-governmental organizations,Constituency - Research and independent,Mr. Ramon Javier Cruz-Diaz,New York,United States of America,,RINGO
559,Institute of Development Studies,Non-governmental organizations,Constituency - Research and independent,Ms. Rosalind Price,Brighton,United Kingdom of Great Britain and Northern Ireland,,RINGO
560,"Institute of Energy Economics, Japan",Non-governmental organizations,Constituency - ENGO,Mr. Takahiko Tagami,Tokyo,Japan,,ENGO
561,Institutional Investors Group on Climate Change Ltd.,Non-governmental organizations,Constituency - Business and Industry,Ms. Evagelia Emelia Holdaway,London,United Kingdom of Great Britain and Northern Ireland,,BINGO
562,Instituto de Ecología y Antropología de Acción,Non-governmental organizations,Constituency - Environmental,Ms. Elke Falley-Rothkopf,Cologne,Germany,,ENGO
563,Instituto Educacional Franklin Delano Roosevelt,Non-governmental organizations,Constituency - Youth,Ms. Allana Rumble,Lima,Peru,,Youth
564,Instituto Ethos de Empresas e Responsabilidade Social,Non-governmental organizations,Constituency - ENGO,Ms. Flavia Anguiano Resende,Sao Paulo,Brazil,,ENGO
565,Instituto Torcuato Di Tella,Non-governmental organizations,Constituency - Research and independent,Sr. Daniel Perczyk,Buenos Aires,Argentina,,RINGO
566,Interchurch Organization for Development Cooperation,Non-governmental organizations,Constituency - Environmental,Ms. Regnera Catharina van der Geest,Utrecht,Netherlands,,ENGO
567,InterEnvironment Institute,Non-governmental organizations,Constituency - Environmental,Mr. Thaddeus Trzyna,Sacramento,United States of America,,ENGO
568,International Air Transport Association,Non-governmental organizations,Constituency - Business and Industry,Mr. Michel Adam,Montreal,Canada,,BINGO
569,International Alliance of Indigenous and Tribal Peoples of the Tropical Forests,Non-governmental organizations,Constituency - Indigenous peoples,Mr. Estebancio Castro Diaz,Panama,Panama,,IPO
570,International Association for the Advancement of Innovative Approaches to Global Challenges,Non-governmental organizations,Constituency - Youth,Mr. Miroslav Polzer,Klagenfurt,Austria,,Youth
571,International Association of Public Transport,Non-governmental organizations,Constituency - Local government and Municipal authorities,Mr. Philip Turner,Brussels,Belgium,,LGMA
572,International Association of Schools of Social Work,Non-governmental organizations,Constituency - Research and independent,Ms. Lena Dominelli,Hong Kong,China,,RINGO
573,International Center for Environmental Technology Transfer,Non-governmental organizations,Constituency - Environmental,Mr. Taiki Kuroda,Yokkaichi,Japan,,ENGO
574,International Centre for Trade and Sustainable Development,Non-governmental organizations,,Mr. Ricardo Melendez-Ortiz,Geneva,Switzerland,completed manually,not yet affiliated/no data
575,International Chamber of Commerce,Non-governmental organizations,Constituency - Business and Industry,Ms. Majda Dabaghi,Paris,France,,BINGO
576,International Chamber of Shipping,Non-governmental organizations,Constituency - Business and Industry,Mr. Simon Bennett,London,United Kingdom of Great Britain and Northern Ireland,,BINGO
577,International Climate Change Partnership,Non-governmental organizations,Constituency - Environmental,Mr. Kevin Fay,Arlington,United States of America,,ENGO
578,International Coastal and Ocean Organization,Non-governmental organizations,Constituency - Environmental,Ms. Vanessa Knecht,Washington DC,United States of America,,ENGO
579,International Council for Mining and Metals,Non-governmental organizations,Constituency - Business and Industry,Ms. Meera Thankey,London,United Kingdom of Great Britain and Northern Ireland,,BINGO
580,International Council for Science,Non-governmental organizations,,Mr. Gordon McBean,Paris,France,completed manually,not yet affiliated/no data
581,International Council for Sustainable Energy,Non-governmental organizations,Constituency - Business and Industry,Ms. Laura Tierney,Washington DC,United States of America,,BINGO
582,International Council of Chemical Associations,Non-governmental organizations,Constituency - Business and Industry2,Ms. Touria Lakchiri,Brussels,Belgium,,BINGO
583,International Court for the Environment Coalition,Non-governmental organizations,Constituency - Environmental,Mr. Stephen Alexander Hockman,London,United Kingdom of Great Britain and Northern Ireland,,ENGO
584,International Cryosphere Climate Initiative,Non-governmental organizations,Constituency - Research and independent,Ms. Pamela Jean Pearson,Charlotte,United States of America,,RINGO
585,International Dairy Federation,Non-governmental organizations,Constituency - Business and Industry,Ms. Caroline Emond,Brussels,Belgium,,BINGO
586,International Development Research Centre,Non-governmental organizations,Constituency - Research and independent,Ms. Marie-Eve Landry,"Ottawa, ON",Canada,,RINGO
587,International Emissions Trading Association,Non-governmental organizations,Constituency - Business and Industry,Ms. Stephanie Olegario,Geneva,Switzerland,,BINGO
588,International Environmental Communication Association,Non-governmental organizations,Constituency - Research and independent,Mr. Mark S. Meisner,Cincinnati,United States of America,,RINGO
589,International Federation of Industrial Energy Consumers,Non-governmental organizations,Constituency - Business and Industry,Mr. Paul Cicio,Basel,Switzerland,,BINGO
590,International Federation of Liberal Youth,Non-governmental organizations,Constituency - Youth,Mr. Sven Gerst,London,United Kingdom of Great Britain and Northern Ireland,,Youth
591,International Federation of Medical Students' Associations,Non-governmental organizations,Constituency - Youth,Mr. Skander Essafi,Amsterdam,Netherlands,,Youth
592,International Federation of Organic Agriculture Movements,Non-governmental organizations,Constituency - Farmers,Mr. Gabor Figeczky,Bonn,Germany,,Farmers
593,International Fertilizer Industry Association,Non-governmental organizations,Constituency - Business and Industry,Ms. Margot Rose Clifford,Paris,France,completed manually from UNFCCC website,BINGO
594,International Food Policy Research Institute,Non-governmental organizations,Constituency - Farmers,Ms. Liangzhi You,Washington,United States of America,,Farmers
595,International Forestry Students' Association,Non-governmental organizations,Constituency - Youth,Ms. Aditi Mishra,Freiburg,Germany,,Youth
596,International Forum on Globalization Inc.,Non-governmental organizations,Constituency - Environmental CJN,Mr. Victor Menotti,San Francisco,United States of America,,ENGO
597,International Foundation for African Children,Non-governmental organizations,Constituency - Youth,Mr. Michael Ikechukwu Nwafejoku,Lagos,Nigeria,,Youth
598,International Fund for Animal Welfare Inc.,Non-governmental organizations,Constituency - Environmental CAN,Mr. Matthew Collis,Yarmouth Port,United States of America,,ENGO
599,International Gas Union,Non-governmental organizations,Constituency - Business and Industry,Mr. Luis Calvo,Barcelona,Spain,,BINGO
600,International Hydropower Association,Non-governmental organizations,Constituency - Business and Industry,Mr. Richard M. Taylor,London,United Kingdom of Great Britain and Northern Ireland,,BINGO
601,International Indian Treaty Council,Non-governmental organizations,Constituency - Indigenous peoples,Mr. Alberto Saldamando,San Francisco,United States of America,,IPO
602,International Institute for Applied Systems Analysis,Non-governmental organizations,Constituency - Research and independent,Mr. Iain Stewart,Laxenburg,Austria,,RINGO
603,International Institute for Environment and Development,Non-governmental organizations,Constituency - Research and independent,Ms. Marika Hannah Weinhardt,London,United Kingdom of Great Britain and Northern Ireland,,RINGO
604,International Institute for Sustainable Development,Non-governmental organizations,Constituency - Research and independent,Mr. Cameron Stuart Hunter,Winnipeg,Canada,,RINGO
605,International Movement ATD Fourth World,Non-governmental organizations,,,Pierrelaye,France,completed manually,not yet affiliated/no data
606,International National Trusts Organisation,Non-governmental organizations,Constituency - Environmental,Ms. Catherine Leonard,London,United Kingdom of Great Britain and Northern Ireland,,ENGO
607,International Network for Sustainable Energy,Non-governmental organizations,Constituency - Environmental,Mr. Gunnar Boye Olesen,Hjortshoj,Denmark,,ENGO
608,International Network of Basin Organizations,Non-governmental organizations,Constituency - Environmental,Mr. Edouard Boinet,Paris,France,,ENGO
609,International Organization for Standardization,Non-governmental organizations,Constituency - Business and Industry,Mr. José Ignacio Alcorta,Vernier,Switzerland,,BINGO
610,International Organization of Employers,Non-governmental organizations,Constituency - Business and Industry,Mr. Pierre Vincensini,Geneva,Switzerland,,BINGO
611,International Petroleum Industry Environmental Conservation Association,Non-governmental organizations,,,London,United Kingdom of Great Britain and Northern Ireland,completed manually,not yet affiliated/no data
612,International Planned Parenthood Federation,Non-governmental organizations,Constituency - Women and Gender,Ms. Raffaela Dattler,London,United Kingdom of Great Britain and Northern Ireland,,Women and Gender
613,International Plant Genetic Resources Institute,Non-governmental organizations,Constituency - Research and independent,Ms. Helen Thompson,Maccarese (Fiumicino),Italy,,RINGO
614,International Polar Foundation,Non-governmental organizations,Constituency - Research and independent,Ms. Nighat Johnson-Amin,Brussels,Belgium,,RINGO
615,International Policy Network,Non-governmental organizations,Constituency - Environmental,Ms. Kendra Okonski,London,United Kingdom of Great Britain and Northern Ireland,,ENGO
616,International Social Science Council,Non-governmental organizations,,Mr. Alberto Martinelli,Paris,France,completed manually; currently dissolved,not yet affiliated/no data
617,International Society of Doctors for the Environment,Non-governmental organizations,Constituency - ENGO,Ms. Cathey Eisner Falvo,Basel,Switzerland,,ENGO
618,International Solar Energy Society e.V.,Non-governmental organizations,Constituency - Environmental,Ms. Jennifer McIntosh,Freiburg,Germany,,ENGO
619,International Solid Waste Association,Non-governmental organizations,Constituency - Environmental,Mr. Jose Ignacio Uribe-Echevarria,Vienna,Austria,,ENGO
620,International Trade Union Confederation,Non-governmental organizations,Constituency - Trade Unions,Mr. Bert De Wel,Brussels,Belgium,,TUNGO
621,International Union of Architects,Non-governmental organizations,Constituency - Trade Unions,Ms. Sonia Cela,Paris,France,,TUNGO
622,International Union of Forest Research Organizations,Non-governmental organizations,Constituency - Research and independent,Mr. Alexander Buck,Vienna,Austria,,RINGO
623,International Union of Railways,Non-governmental organizations,Constituency - Business and Industry,Mr. Vincent VU,Paris,France,,BINGO
624,International Volunteering Center for Development Cooperation,Non-governmental organizations,Constituency - Environmental,Mr. Marco Iob,Udine,Italy,,ENGO
625,International Work Group for Indigenous Affairs,Non-governmental organizations,Constituency - Environmental,Mr. Stefan Thorsell,Copenhagen,Denmark,,ENGO
626,International Youth and Student Movement for the United Nations,Non-governmental organizations,Constituency - Environmental,Mr. Oluwole David Oshota,Geneva,Switzerland,,ENGO
627,Inuit Circumpolar Conference,Non-governmental organizations,Constituency - Indigenous peoples,Ms. Joanna MacDonald,Ottawa,Canada,,IPO
628,"Islands First, Inc.",Non-governmental organizations,Constituency - Environmental,Mr. Mark Jariabka,New York,United States of America,,ENGO
629,Italian Climate Network,Non-governmental organizations,Constituency - Youth,Mr. Jacopo Bencini,Milan,Italy,,Youth
630,Italian Local Agenda 21 Association,Non-governmental organizations,Constituency - Local government and Municipal authorities,Ms. Maria Elisa Zuppiroli,Modena,Italy,,LGMA
631,Ithaca College,Non-governmental organizations,Constituency - Research and independent,Mr. Thomas Shevory,Ithaca,United States of America,,RINGO
632,iuventum e.V.,Non-governmental organizations,Constituency - Research and independent,Mr. Henning Stöcks,Velzen,Germany,,RINGO
633,IVL Swedish Environmental Research Institute Ltd.,Non-governmental organizations,Constituency - Research and independent,Mr. Peringe Grennfelt,Stockholm,Sweden,,RINGO
634,Janvikas,Non-governmental organizations,,Mr. Mahesh Pandya,Ahmedabad,India,,not yet affiliated/no data
635,"Japan Atomic Industrial Forum, Inc.",Non-governmental organizations,Constituency - Business and Industry,Ms. Yuko Wada,Tokyo,Japan,,BINGO
636,Japan Automobile Manufacturers Association Inc.,Non-governmental organizations,Constituency - Business and Industry,Mr. Shingo Kawaguchi,Tokyo,Japan,,BINGO
637,Japan Center for a Sustainable Environment and Society,Non-governmental organizations,Constituency - Environmental CAN,Mr. Jiro Adachi,Tokyo,Japan,,ENGO
638,Japan Environmental Council,Non-governmental organizations,Constituency - Environmental,Ms. Yukari Takamura,Tokyo,Japan,,ENGO
639,Japan Fluorocarbon Manufacturers Association,Non-governmental organizations,Constituency - Business and Industry,Mr. Kenroh Kitamura,Tokyo,Japan,,BINGO
640,Japan International Forestry Promotion and Cooperation Center,Non-governmental organizations,Constituency - ENGO,Mr. Kenzo Naka,"Bunkyo-ku, Tokyo",Japan,,ENGO
641,Japan Iron and Steel Federation,Non-governmental organizations,Constituency - Business and Industry,Mr. Masanobu Nakamizu,Tokyo,Japan,,BINGO
642,Jeunes volontaires pour l'environnement,Non-governmental organizations,Constituency - Environmental,Mr. Sena Alouka,Lomé,Togo,completed manually from UNFCCC website,ENGO
643,Joanneum Research,Non-governmental organizations,Constituency - Research and independent,Mr. Andreas Tuerk,Graz,Austria,,RINGO
644,Johns Hopkins University,Non-governmental organizations,Constituency - Research and independent,Mr. Irving Mintzer,Washington,United States of America,,RINGO
645,Joint Implementation Network,Non-governmental organizations,Constituency - Research and independent,Mr. Catrinus Jetsus Jepma,Groningen,Netherlands,,RINGO
646,Joyce Foundation,Non-governmental organizations,Constituency - Environmental,Mr. Edmund Jackson Miller,Chicago,United States of America,,ENGO
