,name,entity_type,constituency,coordinator,city,country,remarks,const
322,Economic Development Foundation,Non-governmental organizations,Constituency - Research and independent,Ms. Ilge Kıvılcım,Istanbul,Turkey,,RINGO
323,Ecumenical Advocacy Alliance,Non-governmental organizations,Constituency - Environmental,Ms. Christine Campeau,Geneva,Switzerland,,ENGO
324,Edison Electric Institute,Non-governmental organizations,Constituency - Business and Industry,Mr. Eric Holdsworth,Washington,United States of America,,BINGO
325,Eikosphere Foundation,Non-governmental organizations,Constituency - Environmental,Ms. Catherine Ann Cunningham,Newport Coast,United States of America,,ENGO
326,Ejecutor de Contrato de Administración de la Reserva Comunal Amarakaeri,Non-governmental organizations,Constituency - Indigenous peoples,Mr. Walter Quertehuari,Puerto Maldonado,Peru,,IPO
327,Electric Power Research Institute,Non-governmental organizations,Constituency - Research and independent,Mr. Tom Wilson,Palo Alto,United States of America,,RINGO
328,Electriciens sans frontières,Non-governmental organizations,Constituency - ENGO,"Mme Laura, Claire Cornu",Bagnolet Cedex,France,,ENGO
329,Emory University,Non-governmental organizations,Constituency - Research and independent,Ms. Stefanie Ebelt Sarnat,Atlanta,United States of America,,RINGO
330,Energies 2050,Non-governmental organizations,Constituency - Environmental,Mr. Stéphane Jacques Henri Pouffary,Biot,France,,ENGO
331,Energiewende Saarland e.V. (Energy Alternative Saarland),Non-governmental organizations,Constituency - ENGO,Ms. Marilyn Heib,Saarbrücken,Germany,,ENGO
332,Energy and Climate Policy Institute for Just Transition,Non-governmental organizations,Constituency - Environmental CJN,Mr. Jin-Woo Lee,Seoul,Republic of Korea,,ENGO
333,Energy Research Centre of the Netherlands,Non-governmental organizations,Constituency - Research and independent,Mr. Paul van Tilburg,Petten,Netherlands,,RINGO
334,Energy-Cities,Non-governmental organizations,Constituency - Local government and Municipal authorities,Mr. Frédéric Boyer,Besancon,France,,LGMA
335,Environment-People-Law,Non-governmental organizations,Constituency - Environmental CAN,Ms. Olena Kravchenko,Lviv,Ukraine,,ENGO
336,"Environmental Business Council of New England, Inc.",Non-governmental organizations,Constituency - Business and Industry,Mr. Leo-Pierre Roy,Boston,United States of America,,BINGO
337,Environmental Defense Fund,Non-governmental organizations,Constituency - Environmental CAN,Mr. Alex George Hanafi,Washington,United States of America,,ENGO
338,Environmental Investigation Agency,Non-governmental organizations,Constituency - Environmental CAN,Ms. Jilian Claire Kuklinski,Washington,United States of America,,ENGO
339,Environmental Law Institute,Non-governmental organizations,Constituency - Research and independent,Mr. Meinhard Doelle,Halifax,Canada,,RINGO
340,Environmental Management for Livelihood Improvement Bwaise Facility,Non-governmental organizations,Constituency - Environmental CAN,Mr. Robert Bakiika,Kampala,Uganda,,ENGO
341,Environmental Monitoring Group Trust,Non-governmental organizations,Constituency - Environmental,Mr. Stephen Law,Cape Town,South Africa,,ENGO
342,Environmental Quality Protection Foundation,Non-governmental organizations,Constituency - Environmental,Mr. Ying-Shih Hsieh,Taipei,China,,ENGO
343,Environmental Services Association of Nova Scotia,Non-governmental organizations,,,Dartmouth,Canada,completed manually,not yet affiliated/no data
344,Environnement et Developpement du Tiers-Monde,Non-governmental organizations,Constituency - Environmental CAN,Mr. Libasse Ba,Dakar,Senegal,,ENGO
345,Environnement Jeunesse,Non-governmental organizations,Constituency - Environmental CAN,Mme Catherine Gauthier,Montréal,Canada,,ENGO
346,Equiterre,Non-governmental organizations,Constituency - Environmental CAN,Ms. Alice Feuillet,Montréal,Canada,,ENGO
347,Erasmus University Rotterdam,Non-governmental organizations,Constituency - Research and independent,Mr. Steven Kennedy,Rotterdam,Netherlands,,RINGO
348,ETC Foundation,Non-governmental organizations,Constituency - Environmental CAN,Ms. Maria Johanna Meijboom,Leusden,Netherlands,,ENGO
349,"ETC Group (Action Group on Erosion, Technology and Concentration)",Non-governmental organizations,Constituency - Research and independent,Ms. Justine Lisette Rastello,Ottawa,Canada,,RINGO
350,Etc Terra,Non-governmental organizations,Constituency - Environmental,Mr. Matthieu Tiberghien,Paris,France,,ENGO
351,EURELECTRIC,Non-governmental organizations,Constituency - Business and Industry,Mr. Henning Häder,Brussels,Belgium,completed manually from UNFCCC website,BINGO
352,Euro-Mediterranean Center on Climate Change,Non-governmental organizations,Constituency - Research and independent,Ms. Lorella Reda,Lecce,Italy,,RINGO
353,EURONATURA - Centre for Environmental Law and Sustainable Development,Non-governmental organizations,Constituency - Environmental,Ms. Rita Mafalda Dionísio de Sousa,Lisboa,Portugal,,ENGO
354,European Association for Solar Energy,Non-governmental organizations,Constituency - Business and Industry,Ms. Irm Scheer-Pontenagel,Bonn,Germany,,BINGO
355,European Bureau for Conservation and Development,Non-governmental organizations,Constituency - Environmental,Mr. Paolo Mattana,Brussels,Belgium,,ENGO
356,European Business Council for Sustainable Energy,Non-governmental organizations,Constituency - Business and Industry,Mr. Kolja Kuse,Muenchen,Germany,,BINGO
357,European Chemical Industry Council,Non-governmental organizations,Constituency - Business and Industry,Mr. Peter Botschek,Brussels,Belgium,,BINGO
358,European Climate Foundation,Non-governmental organizations,Constituency - Environmental,Mr. Jorge Aguado Sánchez,The Hague,Netherlands,,ENGO
359,European Federation of Regional Energy and Environment Agencies/Fédération Européenne des Agences Régionales de L'Energie et de L'Environnement,Non-governmental organizations,Constituency - Local government and Municipal authorities,Mr. Michael Geissler,Brussels,Belgium,,LGMA
360,European Geothermal Energy Council,Non-governmental organizations,Constituency - Business and Industry,Mr. Philippe Dumas,Brussels,Belgium,,BINGO
361,European Landowners Organisation,Non-governmental organizations,Constituency - Environmental,Mr. Thierry de l'Escaille,Brussels,Belgium,,ENGO
362,European Nuclear Society,Non-governmental organizations,Constituency - Business and Industry,Ms. Emilia Janisz,Brussels,Belgium,,BINGO
363,European Round Table of Industrialists,Non-governmental organizations,Constituency - Business and Industry,Mr. Bert D'Hooghe,Brussels,Belgium,,BINGO
364,European Union Chamber of Commerce in China,Non-governmental organizations,Constituency - Business and Industry,Ms. Cecilia Rovelli,Beijing,China,,BINGO
365,European Water Partnership,Non-governmental organizations,Constituency - Environmental,Ms. Cristina Danielle Brabyn,Brussels,Belgium,,ENGO
366,European Wind Energy Association,Non-governmental organizations,,Mr. Markus Tacke,Brussels,Belgium,completed manually,not yet affiliated/no data
367,European Youth Forum,Non-governmental organizations,Constituency - Youth,Ms. Stephanie Anne Beecroft,Brussels,Belgium,,Youth
368,Ev-K2-CNR Committee,Non-governmental organizations,Constituency - Environmental,Ms. Elisa Maria Vuillermoz,Bergamo,Italy,,ENGO
369,Excellent Development,Non-governmental organizations,Constituency - Research and independent,Mr. Jonny Otis McKay,Birmingham,United Kingdom of Great Britain and Northern Ireland,,RINGO
370,FACE Foundation,Non-governmental organizations,Constituency - Business and Industry,Mr. Martijn Snoep,Utrecht,Netherlands,,BINGO
371,Fairtrade Labelling Organizations International e.V.,Non-governmental organizations,Constituency - Research and independent,Ms. Lannette Kambole Chiti,Bonn,Germany,,RINGO
372,Fairwatch Association,Non-governmental organizations,Constituency - Environmental CJN,Mr. Alberto Zoratti,Pisa,Italy,,ENGO
373,Faith Association of the Rehabilitation of Street Children and Orphans,Non-governmental organizations,Constituency - Youth,Mr. David Edusah,Tema,Ghana,,Youth
374,Family Health International,Non-governmental organizations,Constituency - Research and independent,Mr. Nicholas Wedeman,Durham,United States of America,,RINGO
375,Fauna & Flora International,Non-governmental organizations,Constituency - Environmental,Ms. Charlotte Alexandra Fisher,Cambridge,United Kingdom of Great Britain and Northern Ireland,,ENGO
376,Feasta Ltd,Non-governmental organizations,Constituency - Research and independent,Mr. Michael Sandler,Cloughjordan Co. Tipperary,Ireland,,RINGO
377,Federación de Pueblos Indígenas Kechwas de la Región de San Martín,Non-governmental organizations,Constituency - Indigenous peoples,Mr. Janio Sangama Apagüeño,Lamas,Peru,,IPO
378,Federación Nativa del Río Madre de Dios y Afluentes,Non-governmental organizations,Constituency - Indigenous peoples,Mr. Julio Cusurichi Palacios,Puerto Maldonado,Peru,,IPO
379,Federación Regional Indígena Shawi de San Martín,Non-governmental organizations,Constituency - Indigenous peoples,Ms. Reydelinda Pizango Yumbato,Tarapoto,Peru,,IPO
380,Fédération des Elu-es Verts et Ecologistes,Non-governmental organizations,,,Paris,France,completed manually,not yet affiliated/no data
381,Federation of Electric Power Companies,Non-governmental organizations,Constituency - Business and Industry,Mr. Shohei Hasebe,Tokyo,Japan,,BINGO
382,Federation of German Industries,Non-governmental organizations,Constituency - Business and Industry,Mr. Joachim Dieter Erwin Hein,Berlin,Germany,,BINGO
383,Federation of Indian Chambers of Commerce and Industry,Non-governmental organizations,Constituency - Business and Industry,Ms. Rita Roy Choudhury,New Delhi,India,,BINGO
384,Federation of Young European Greens,Non-governmental organizations,Constituency - Environmental,Mr. Markus Drake,Brussels,Belgium,,ENGO
385,Fermes d'Avenir,Non-governmental organizations,Constituency - Environmental,Ms. Lucie Rousselot,Montlouis-sur-Loire,France,,ENGO
386,FERN,Non-governmental organizations,Constituency - Environmental CJN,Ms. Hannah Mowat,Moreton-in-Marsh,United Kingdom of Great Britain and Northern Ireland,,ENGO
387,Fia Foundation for the Automobile and Society,Non-governmental organizations,,,London,United Kingdom of Great Britain and Northern Ireland,completed manually,not yet affiliated/no data
388,Finnish Air Pollution Prevention Society,Non-governmental organizations,Constituency - Environmental,Ms. Essi Pauliina Haapaniemi,Helsinki,Finland,,ENGO
389,Finnish Institute of International Affairs,Non-governmental organizations,Constituency - Research and independent,Mr. Antto Vihma,Helsinki,Finland,,RINGO
390,Finnish NGO Platform KEPA,Non-governmental organizations,,,Helsinki,Finland,completed manually,not yet affiliated/no data
391,Focus on the Global South,Non-governmental organizations,Constituency - Environmental CJN,Ms. Nicola Bullard,Quezon City,Philippines,,ENGO
392,Fondation africaine (Farmapu-Inter & Cecotrap-rcogl),Non-governmental organizations,Constituency - Research and independent,Mr. Hibert Kirongozi,Kigali,Rwanda,,RINGO
393,Fondation BNP Paribas,Non-governmental organizations,Constituency - ENGO,M. Sylvain Taboni,Paris,France,,ENGO
394,Fondation Deserts du Monde,Non-governmental organizations,Constituency - Environmental,Ms. Sihem Medani,Ghardaia,Algeria,,ENGO
395,Fondation Energies pour le Monde,Non-governmental organizations,Constituency - Environmental,Ms. Juliette Darlu,Paris,France,,ENGO
396,Fondation Jean-Jaurès,Non-governmental organizations,Constituency - ENGO,Mr. Alexandre Cyrille Minet,Paris,France,,ENGO
397,Fondation Nicolas Hulot,Non-governmental organizations,,Mr. Alain Grandjean,Boulogne-Billancourt,France,completed manually,not yet affiliated/no data
398,Fondation pour le développement durable des régions de montagne,Non-governmental organizations,Constituency - Local government and Municipal authorities,Mr. Eric Alain Nanchen,Sion,Switzerland,completed manually from UNFCCC website,LGMA
399,Fondation pour les etudes et recherches sur le developpement international,Non-governmental organizations,Constituency - Research and independent,Mr. Patrick Guillaumont,Clermont-Ferrand,France,completed manually from UNFCCC website,RINGO
400,Fondazione Centro Studi Enel,Non-governmental organizations,Constituency - Research and independent,Mr. Mariano Morazzo,Rome,Italy,,RINGO
401,Fondazione Eni Enrico Mattei,Non-governmental organizations,Constituency - Research and independent,Ms. Martina Marian,Milan,Italy,,RINGO
402,Fondo de Promoción de la Areas Naturales Protegidas del Perú,Non-governmental organizations,,Mr. Antom Willems,Lima,Peru,completed manually,not yet affiliated/no data
403,Fonds E7 pour le développement énergétique durable,Non-governmental organizations,Constituency - Business and Industry,Mr. Sidney Lambert,Paris,France,,BINGO
404,"Food, Agriculture and Natural Resources Policy Analysis Network",Non-governmental organizations,Constituency - Research and independent,Mr. Tshilidzi Madzivhandila,Pretoria,South Africa,,RINGO
405,Ford Foundation,Non-governmental organizations,Constituency - Indigenous peoples,Ms. Penny Davies,New York,United States of America,,IPO
406,Forest Peoples' Programme,Non-governmental organizations,Constituency - Research and independent,Ms. Julia Overton,Moreton-in-Marsh,United Kingdom of Great Britain and Northern Ireland,,RINGO
407,Forest Products Association of Canada,Non-governmental organizations,Constituency - ENGO,Mr. Robert Larocque,Ottawa,Canada,,ENGO
408,Forest Stewardship Council,Non-governmental organizations,Constituency - ENGO,Ms. Pina Gervassi,Bonn,Germany,,ENGO
409,Forest Trends Association,Non-governmental organizations,Constituency - Environmental,Ms. Julia Sue Granfors,Washington DC,United States of America,,ENGO
410,Forestry and Forest Products Research Institute,Non-governmental organizations,Constituency - Research and independent,Mr. Yasumasa Hirata,Tsukuba,Japan,,RINGO
411,Forests of the World,Non-governmental organizations,Constituency - Environmental,Ms. Gry Helene Bossen,Aarhus,Denmark,,ENGO
412,Forests Philanthropy Action Network,Non-governmental organizations,Constituency - Environmental,Mr. Edward Rumsey,Horbling,United Kingdom of Great Britain and Northern Ireland,,ENGO
413,Foro Ciudades para la Vida,Non-governmental organizations,Constituency - Environmental,Ms. Liliana Miranda Sara,Lima,Peru,,ENGO
414,Forum atomique européen,Non-governmental organizations,Constituency - ENGO,Ms. Ann Jessica Johnson,Brussels,Belgium,completed manually from UNFCCC website,ENGO
415,Forum for Environment,Non-governmental organizations,Constituency - Environmental,Mr. Najib Saab,Beirut,Lebanon,,ENGO
416,Forum for Reforms and Entrepreneurship,Non-governmental organizations,Constituency - Research and independent,Ms. Anna Halla,Stockholm,Sweden,,RINGO
417,Foundation DLO,Non-governmental organizations,,,Wageningen,Netherlands,completed manually,not yet affiliated/no data
418,Foundation Environment - Law Society,Non-governmental organizations,Constituency - Research and independent,Mr. Michael Mehling,Greifswald,Germany,,RINGO
419,Foundation for Strategic Environmental Research,Non-governmental organizations,Constituency - Environmental,Mr. Thomas Nilsson,Stockholm,Sweden,,ENGO
420,Foundation for the Global Compact,Non-governmental organizations,Constituency - Business and Industry,Ms. Claire Kells,New York,United States of America,,BINGO
421,Foundation for the Rights of Future Generations,Non-governmental organizations,Constituency - Research and independent,Ms. Anna Braam,Stuttgart,Germany,,RINGO
422,Foundation of Taiwan Industry Service,Non-governmental organizations,Constituency - Environmental,Ms. Chen-Yu Yeh,"Taiwan, Province of China",China,,ENGO
423,France Energie Eolienne,Non-governmental organizations,Constituency - Business and Industry,Mme Caroline Sawe,Paris,France,,BINGO
424,France nature environnement,Non-governmental organizations,Constituency - Environmental,M. Jean-Baptiste Poncelet,Paris,France,,ENGO
425,Franciscans International,Non-governmental organizations,Constituency - Environmental,Mr. Antonius Budi Tjahjono,Geneva 20,Switzerland,,ENGO
426,Frankfurt School of Finance and Management GmbH,Non-governmental organizations,Constituency - Research and independent,Mr. Karsten Loeffler,Frankfurt am Main,Germany,completed manually from UNFCCC website,RINGO
427,Fraunhofer Institute for Systems and Innovation Research,Non-governmental organizations,Constituency - Research and independent,Ms. Vicki Duscha,Munic,Germany,,RINGO
428,"Free University Amsterdam, Institute for Environmental Studies",Non-governmental organizations,Constituency - Environmental,Mr. Oscar Widerberg,Amsterdam,Netherlands,completed manually from UNFCCC website,ENGO
429,Freedom from Debt Coalition Inc.,Non-governmental organizations,Constituency - Research and independent,Mr. Samuel Cesar Gamboa,Quezon City,Philippines,,RINGO
430,Freie Universität Berlin,Non-governmental organizations,Constituency - Research and independent,Mr. Stephan Pfahl,Berlin,Germany,,RINGO
431,Fridtjof Nansen Institute,Non-governmental organizations,Constituency - Research and independent,Mr. Claes Ragner,Lysaker,Norway,,RINGO
432,Friedrich Schiller University Jena,Non-governmental organizations,Constituency - Research and independent,Mr. Martin Herold,Jena,Germany,,RINGO
433,Friedrich-Ebert-Stiftung e.V.,Non-governmental organizations,Constituency - Research and independent,Ms. Yvonne Blos,Berlin,Germany,,RINGO
434,Friends of Environment and Humanity Foundation,Non-governmental organizations,Constituency - Environmental,Mr. Wisdom Tettey,Tema,Ghana,,ENGO
435,Friends of the Earth International,Non-governmental organizations,Constituency - Environmental CJN,Ms. Sara Shaw,Amsterdam,Netherlands,,ENGO
436,Friends World Committee for Consultation,Non-governmental organizations,Constituency - Research and independent,Ms. Lindsey Fielder Cook,London,United Kingdom of Great Britain and Northern Ireland,,RINGO
437,Fundação Getúlio Vargas,Non-governmental organizations,Constituency - Research and independent,Mr. Mario Prestes Monzoni,Sao Paulo,Brazil,,RINGO
438,Fundación Ambiente y Recursos Naturales,Non-governmental organizations,Constituency - Environmental,Mr. Enrique Gabriel Maurtua Konstantinidis,Buenos Aires,Argentina,,ENGO
439,Fundación Amigos de la Naturaleza,Non-governmental organizations,Constituency - Research and independent,Ms. Natalia Valentina Calderón Angeleri,Santa Cruz,Bolivia (Plurinational State of),,RINGO
440,Fundación Argentina de Etoecología,Non-governmental organizations,Constituency - Environmental,Sra. Alcira Perlini Montiel,Buenos Aires,Argentina,,ENGO
441,Fundación Avina,Non-governmental organizations,Constituency - Environmental,Ms. Paula Ellinger da Fonseca,"Panama City,",Panama,,ENGO
442,Fundación Biosfera,Non-governmental organizations,Constituency - Environmental CAN,Mr. Horacio Pablo de Belaustegui,La Plata,Argentina,,ENGO
443,Fundación Bosques para la Conservación,Non-governmental organizations,Constituency - Environmental,Mr. Xavier Enrique Elizalde Romero,Quito,Ecuador,,ENGO
444,Fundación Cayetano Heredia,Non-governmental organizations,Constituency - Research and independent,Mr. Jahir Anicama Diaz,Lima,Peru,,RINGO
445,Fundación de Iniciativas de Cambio Climático,Non-governmental organizations,Constituency - Environmental CAN,Sra. Suyapa Concepción Zelaya Amaya,Tegucigalpa,Honduras,,ENGO
446,Fundación Defensores de la Naturaleza,Non-governmental organizations,Constituency - Environmental,Sr. Oscar Manuel Nuñez Saravia,Guatemala,Guatemala,,ENGO
447,"Fundación Desarrollo Sustentable, A.C.",Non-governmental organizations,Constituency - Research and independent,Mr. Jose Maria Valenzuela Robles Linares,México. D.F.,Mexico,,RINGO
448,Fundación Ecología y Desarrollo,Non-governmental organizations,Constituency - Environmental,Sra. Christina Monge Lasierra,Zaragoza,Spain,,ENGO
449,Fundación Futuro Latinoamericano,Non-governmental organizations,Constituency - Environmental,Ms. Lucia Gabriela Villamarin Jurado,Quito,Ecuador,,ENGO
450,Fundación Natura,Non-governmental organizations,Constituency - Environmental,Ms. Romina Paola Villegas,Santa Cruz de la Sierra,Bolivia (Plurinational State of),,ENGO
451,Fundación Natura Bolivia,Non-governmental organizations,Constituency - Environmental,Ms. Romina Paola Villegas,Santa Cruz de la Sierra,Bolivia (Plurinational State of),,ENGO
452,Fundación para la Promoción del Conocimiento Indígena,Non-governmental organizations,Constituency - Indigenous peoples,Mr. Onel Masardule,Panamá,Panama,,IPO
453,Fundación Peruana para la Conservación de la Naturaleza,Non-governmental organizations,Constituency - Environmental,Ms. Elizabeth Peña Izquierdo,Lima,Peru,,ENGO
454,Fundación Privada Empresa & Clima,Non-governmental organizations,,Mr. Joan Planes Vila,Barcelona,Spain,completed manually,not yet affiliated/no data
455,"Fundación Sur Futuro, Inc.",Non-governmental organizations,Constituency - Environmental,Sr. Federico Alfredo Grullón de La Cruz,Santo Domingo,Dominican Republic,,ENGO
456,Fundación TierraVida,Non-governmental organizations,Constituency - Environmental,Ms. Marina Mansilla Hermann,Córdoba,Argentina,,ENGO
457,Gaia Association,Non-governmental organizations,Constituency - Business and Industry,Mr. Milkyas Debebe Mogessie,Addis Ababa,Ethiopia,,BINGO
458,genderCC - women for climate justice e.V.,Non-governmental organizations,Constituency - Women and Gender,Ms. Gotelind Alber,Berlin,Germany,completed manually from UNFCCC website,Women and Gender
459,George Mason University,Non-governmental organizations,Constituency - Research and independent,Mr. Paul Schopf,Fairfax VA,United States of America,,RINGO
460,Georgetown University,Non-governmental organizations,Constituency - Research and independent,Ms. Joanna Lewis,Washington,United States of America,,RINGO
461,German Advisory Council on Global Change,Non-governmental organizations,Constituency - Research and independent,Ms. Astrid Schulz,Berlin,Germany,,RINGO
462,German Association of Energy and Water Industries,Non-governmental organizations,Constituency - Business and Industry,Mr. Tilman Schwencke,Berlin,Germany,,BINGO
463,German Committee for Disaster Reduction,Non-governmental organizations,Constituency - Research and independent,Ms. Sina Marx,Bonn,Germany,,RINGO
464,German Development Institute,Non-governmental organizations,Constituency - Research and independent,Mr. Steffen Bauer,Bonn,Germany,,RINGO
465,German Emissions Trading Association,Non-governmental organizations,Constituency - Business and Industry,Mr. Robert Tippmann,Berlin,Germany,,BINGO
466,German Marshall Fund of the United States,Non-governmental organizations,Constituency - Research and independent,Ms. Irene Garcia,Washington,United States of America,,RINGO
467,German NGO Forum on Environment and Development,Non-governmental organizations,Constituency - Environmental CAN,Ms. Ramona Bruck,Berlin,Germany,,ENGO
468,GERMANWATCH,Non-governmental organizations,Constituency - Environmental CAN,Ms. Katharina Anita Hierl,Bonn,Germany,completed manually from UNFCCC website,ENGO
469,Gherush92 Committee for Human Rights,Non-governmental organizations,Constituency - Research and independent,Ms. Valentina Jappelli,Rome,Italy,,RINGO
470,Global Alert for Defence of Youth and the Less Privileged,Non-governmental organizations,Constituency - Youth,Mr. Kennedy Christian Ezedinbu,Festac Town,Nigeria,,Youth
471,"Global Alliance for Incinerator Alternatives Philippines, Inc.",Non-governmental organizations,Constituency - Environmental CAN,Ms. Maria Elena Vilella Casaus,Quezon City,Philippines,,ENGO
472,Global Buildings Performance Network,Non-governmental organizations,Constituency - Research and independent,Ms. Claire Brule,Paris,France,,RINGO
473,Global Call for Climate Action,Non-governmental organizations,Constituency - Environmental,Ms. Karen Barkley,Montreal,Canada,,ENGO
474,Global Canopy Programme,Non-governmental organizations,,,Oxford,United Kingdom of Great Britain and Northern Ireland,completed manually,not yet affiliated/no data
475,Global Carbon Capture and Storage Institute Ltd,Non-governmental organizations,Constituency - Business and Industry,Ms. Eve Tamme,Canberra,Australia,,BINGO
476,Global Ecovillage Network,Non-governmental organizations,Constituency - Environmental,Ms. Anja Kosha Joubert,Forres,United Kingdom of Great Britain and Northern Ireland,,ENGO
477,Global Environment Centre,Non-governmental organizations,Constituency - Environmental CAN,Mr. Faizal Parish,Selangor,Malaysia,,ENGO
478,Global Environment Centre Foundation,Non-governmental organizations,Constituency - Research and independent,Mr. Osamu Bannai,Osaka,Japan,,RINGO
479,Global Environmental Institute,Non-governmental organizations,Constituency - Environmental,Ms. Lin Ji,Beijing,China,,ENGO
480,Global Footprint Network,Non-governmental organizations,Constituency - Environmental,Mr. Mathis Wackernagel,Oakland,United States of America,,ENGO
481,Global Forest Coalition,Non-governmental organizations,Constituency - Environmental,Ms. Aukje Simone Lovera-Bilderbeek,Amsterdam,Netherlands,,ENGO
482,Global Green Environmental Network,Non-governmental organizations,Constituency - Environmental,Mr. Kweku Amankwah,Tema,Ghana,,ENGO
483,Global Greens (Verts Mondiaux),Non-governmental organizations,Constituency - Environmental,Ms. Margaret Blakers,Brussels,Belgium,,ENGO
484,Global Industrial and Social Progress Research Institute,Non-governmental organizations,Constituency - Research and independent,Mr. Daisuke Miki,Tokyo,Japan,,RINGO
485,"Global Justice Ecology Project, Inc.",Non-governmental organizations,Constituency - Environmental,Ms. Anne Petermann,Hinnesburg,United States of America,,ENGO
