name,entity_type,constituency,coordinator,city,country,remarks
Environmental Quality Protection Foundation,Non-governmental organizations,Constituency - Environmental,Mr. Ying-Shih Hsieh,Taipei,China,
Environmental Services Association of Nova Scotia,Non-governmental organizations,,,Dartmouth,Canada,completed manually
Environnement et Developpement du Tiers-Monde,Non-governmental organizations,Constituency - Environmental CAN,Mr. Libasse Ba,Dakar,Senegal,
Environnement Jeunesse,Non-governmental organizations,Constituency - Environmental CAN,Mme Catherine Gauthier,Montréal,Canada,
Equiterre,Non-governmental organizations,Constituency - Environmental CAN,Ms. Alice Feuillet,Montréal,Canada,
Erasmus University Rotterdam,Non-governmental organizations,Constituency - Research and independent,Mr. Steven Kennedy,Rotterdam,Netherlands,
ETC Foundation,Non-governmental organizations,Constituency - Environmental CAN,Ms. Maria Johanna Meijboom,Leusden,Netherlands,
"ETC Group (Action Group on Erosion, Technology and Concentration)",Non-governmental organizations,Constituency - Research and independent,Ms. Justine Lisette Rastello,Ottawa,Canada,
Etc Terra,Non-governmental organizations,Constituency - Environmental,Mr. Matthieu Tiberghien,Paris,France,
EURELECTRIC,Non-governmental organizations,Constituency - Business and Industry,Mr. Henning Häder,Brussels,Belgium,completed manually from UNFCCC website
Euro-Mediterranean Center on Climate Change,Non-governmental organizations,Constituency - Research and independent,Ms. Lorella Reda,Lecce,Italy,
EURONATURA - Centre for Environmental Law and Sustainable Development,Non-governmental organizations,Constituency - Environmental,Ms. Rita Mafalda Dionísio de Sousa,Lisboa,Portugal,
European Association for Solar Energy,Non-governmental organizations,Constituency - Business and Industry,Ms. Irm Scheer-Pontenagel,Bonn,Germany,
European Bureau for Conservation and Development,Non-governmental organizations,Constituency - Environmental,Mr. Paolo Mattana,Brussels,Belgium,
European Business Council for Sustainable Energy,Non-governmental organizations,Constituency - Business and Industry,Mr. Kolja Kuse,Muenchen,Germany,
European Chemical Industry Council,Non-governmental organizations,Constituency - Business and Industry,Mr. Peter Botschek,Brussels,Belgium,
European Climate Foundation,Non-governmental organizations,Constituency - Environmental,Mr. Jorge Aguado Sánchez,The Hague,Netherlands,
European Federation of Regional Energy and Environment Agencies/Fédération Européenne des Agences Régionales de L'Energie et de L'Environnement,Non-governmental organizations,Constituency - Local government and Municipal authorities,Mr. Michael Geissler,Brussels,Belgium,
European Geothermal Energy Council,Non-governmental organizations,Constituency - Business and Industry,Mr. Philippe Dumas,Brussels,Belgium,
European Landowners Organisation,Non-governmental organizations,Constituency - Environmental,Mr. Thierry de l'Escaille,Brussels,Belgium,
European Nuclear Society,Non-governmental organizations,Constituency - Business and Industry,Ms. Emilia Janisz,Brussels,Belgium,
European Round Table of Industrialists,Non-governmental organizations,Constituency - Business and Industry,Mr. Bert D'Hooghe,Brussels,Belgium,
European Union Chamber of Commerce in China,Non-governmental organizations,Constituency - Business and Industry,Ms. Cecilia Rovelli,Beijing,China,
European Water Partnership,Non-governmental organizations,Constituency - Environmental,Ms. Cristina Danielle Brabyn,Brussels,Belgium,
European Wind Energy Association,Non-governmental organizations,,Mr. Markus Tacke,Brussels,Belgium,completed manually
European Youth Forum,Non-governmental organizations,Constituency - Youth,Ms. Stephanie Anne Beecroft,Brussels,Belgium,
Ev-K2-CNR Committee,Non-governmental organizations,Constituency - Environmental,Ms. Elisa Maria Vuillermoz,Bergamo,Italy,
Excellent Development,Non-governmental organizations,Constituency - Research and independent,Mr. Jonny Otis McKay,Birmingham,United Kingdom of Great Britain and Northern Ireland,
FACE Foundation,Non-governmental organizations,Constituency - Business and Industry,Mr. Martijn Snoep,Utrecht,Netherlands,
Fairtrade Labelling Organizations International e.V.,Non-governmental organizations,Constituency - Research and independent,Ms. Lannette Kambole Chiti,Bonn,Germany,
Fairwatch Association,Non-governmental organizations,Constituency - Environmental CJN,Mr. Alberto Zoratti,Pisa,Italy,
Faith Association of the Rehabilitation of Street Children and Orphans,Non-governmental organizations,Constituency - Youth,Mr. David Edusah,Tema,Ghana,
Family Health International,Non-governmental organizations,Constituency - Research and independent,Mr. Nicholas Wedeman,Durham,United States of America,
Fauna & Flora International,Non-governmental organizations,Constituency - Environmental,Ms. Charlotte Alexandra Fisher,Cambridge,United Kingdom of Great Britain and Northern Ireland,
Feasta Ltd,Non-governmental organizations,Constituency - Research and independent,Mr. Michael Sandler,Cloughjordan Co. Tipperary,Ireland,
Federación de Pueblos Indígenas Kechwas de la Región de San Martín,Non-governmental organizations,Constituency - Indigenous peoples,Mr. Janio Sangama Apagüeño,Lamas,Peru,
Federación Nativa del Río Madre de Dios y Afluentes,Non-governmental organizations,Constituency - Indigenous peoples,Mr. Julio Cusurichi Palacios,Puerto Maldonado,Peru,
Federación Regional Indígena Shawi de San Martín,Non-governmental organizations,Constituency - Indigenous peoples,Ms. Reydelinda Pizango Yumbato,Tarapoto,Peru,
Fédération des Elu-es Verts et Ecologistes,Non-governmental organizations,,,Paris,France,completed manually
Federation of Electric Power Companies,Non-governmental organizations,Constituency - Business and Industry,Mr. Shohei Hasebe,Tokyo,Japan,
Federation of German Industries,Non-governmental organizations,Constituency - Business and Industry,Mr. Joachim Dieter Erwin Hein,Berlin,Germany,
Federation of Indian Chambers of Commerce and Industry,Non-governmental organizations,Constituency - Business and Industry,Ms. Rita Roy Choudhury,New Delhi,India,
Federation of Young European Greens,Non-governmental organizations,Constituency - Environmental,Mr. Markus Drake,Brussels,Belgium,
Fermes d'Avenir,Non-governmental organizations,Constituency - Environmental,Ms. Lucie Rousselot,Montlouis-sur-Loire,France,
FERN,Non-governmental organizations,Constituency - Environmental CJN,Ms. Hannah Mowat,Moreton-in-Marsh,United Kingdom of Great Britain and Northern Ireland,
Fia Foundation for the Automobile and Society,Non-governmental organizations,,,London,United Kingdom of Great Britain and Northern Ireland,completed manually
Finnish Air Pollution Prevention Society,Non-governmental organizations,Constituency - Environmental,Ms. Essi Pauliina Haapaniemi,Helsinki,Finland,
Finnish Institute of International Affairs,Non-governmental organizations,Constituency - Research and independent,Mr. Antto Vihma,Helsinki,Finland,
Finnish NGO Platform KEPA,Non-governmental organizations,,,Helsinki,Finland,completed manually
Focus on the Global South,Non-governmental organizations,Constituency - Environmental CJN,Ms. Nicola Bullard,Quezon City,Philippines,
Fondation africaine (Farmapu-Inter & Cecotrap-rcogl),Non-governmental organizations,Constituency - Research and independent,Mr. Hibert Kirongozi,Kigali,Rwanda,
Fondation BNP Paribas,Non-governmental organizations,Constituency - ENGO,M. Sylvain Taboni,Paris,France,
Fondation Deserts du Monde,Non-governmental organizations,Constituency - Environmental,Ms. Sihem Medani,Ghardaia,Algeria,
Fondation Energies pour le Monde,Non-governmental organizations,Constituency - Environmental,Ms. Juliette Darlu,Paris,France,
Fondation Jean-Jaurès,Non-governmental organizations,Constituency - ENGO,Mr. Alexandre Cyrille Minet,Paris,France,
Fondation Nicolas Hulot,Non-governmental organizations,,Mr. Alain Grandjean,Boulogne-Billancourt,France,completed manually
Fondation pour le développement durable des régions de montagne,Non-governmental organizations,Constituency - Local government and Municipal authorities,Mr. Eric Alain Nanchen,Sion,Switzerland,completed manually from UNFCCC website
Fondation pour les etudes et recherches sur le developpement international,Non-governmental organizations,Constituency - Research and independent,Mr. Patrick Guillaumont,Clermont-Ferrand,France,completed manually from UNFCCC website
Fondazione Centro Studi Enel,Non-governmental organizations,Constituency - Research and independent,Mr. Mariano Morazzo,Rome,Italy,
Fondazione Eni Enrico Mattei,Non-governmental organizations,Constituency - Research and independent,Ms. Martina Marian,Milan,Italy,
Fondo de Promoción de la Areas Naturales Protegidas del Perú,Non-governmental organizations,,Mr. Antom Willems,Lima,Peru,completed manually
Fonds E7 pour le développement énergétique durable,Non-governmental organizations,Constituency - Business and Industry,Mr. Sidney Lambert,Paris,France,
"Food, Agriculture and Natural Resources Policy Analysis Network",Non-governmental organizations,Constituency - Research and independent,Mr. Tshilidzi Madzivhandila,Pretoria,South Africa,
Ford Foundation,Non-governmental organizations,Constituency - Indigenous peoples,Ms. Penny Davies,New York,United States of America,
Forest Peoples' Programme,Non-governmental organizations,Constituency - Research and independent,Ms. Julia Overton,Moreton-in-Marsh,United Kingdom of Great Britain and Northern Ireland,
Forest Products Association of Canada,Non-governmental organizations,Constituency - ENGO,Mr. Robert Larocque,Ottawa,Canada,
Forest Stewardship Council,Non-governmental organizations,Constituency - ENGO,Ms. Pina Gervassi,Bonn,Germany,
Forest Trends Association,Non-governmental organizations,Constituency - Environmental,Ms. Julia Sue Granfors,Washington DC,United States of America,
Forestry and Forest Products Research Institute,Non-governmental organizations,Constituency - Research and independent,Mr. Yasumasa Hirata,Tsukuba,Japan,
Forests of the World,Non-governmental organizations,Constituency - Environmental,Ms. Gry Helene Bossen,Aarhus,Denmark,
Forests Philanthropy Action Network,Non-governmental organizations,Constituency - Environmental,Mr. Edward Rumsey,Horbling,United Kingdom of Great Britain and Northern Ireland,
Foro Ciudades para la Vida,Non-governmental organizations,Constituency - Environmental,Ms. Liliana Miranda Sara,Lima,Peru,
Forum atomique européen,Non-governmental organizations,Constituency - ENGO,Ms. Ann Jessica Johnson,Brussels,Belgium,completed manually from UNFCCC website
Forum for Environment,Non-governmental organizations,Constituency - Environmental,Mr. Najib Saab,Beirut,Lebanon,
Forum for Reforms and Entrepreneurship,Non-governmental organizations,Constituency - Research and independent,Ms. Anna Halla,Stockholm,Sweden,
Foundation DLO,Non-governmental organizations,,,Wageningen,Netherlands,completed manually
Foundation Environment - Law Society,Non-governmental organizations,Constituency - Research and independent,Mr. Michael Mehling,Greifswald,Germany,
Foundation for Strategic Environmental Research,Non-governmental organizations,Constituency - Environmental,Mr. Thomas Nilsson,Stockholm,Sweden,
Foundation for the Global Compact,Non-governmental organizations,Constituency - Business and Industry,Ms. Claire Kells,New York,United States of America,
Foundation for the Rights of Future Generations,Non-governmental organizations,Constituency - Research and independent,Ms. Anna Braam,Stuttgart,Germany,
Foundation of Taiwan Industry Service,Non-governmental organizations,Constituency - Environmental,Ms. Chen-Yu Yeh,"Taiwan, Province of China",China,
France Energie Eolienne,Non-governmental organizations,Constituency - Business and Industry,Mme Caroline Sawe,Paris,France,
France nature environnement,Non-governmental organizations,Constituency - Environmental,M. Jean-Baptiste Poncelet,Paris,France,
Franciscans International,Non-governmental organizations,Constituency - Environmental,Mr. Antonius Budi Tjahjono,Geneva 20,Switzerland,
Frankfurt School of Finance and Management GmbH,Non-governmental organizations,Constituency - Research and independent,Mr. Karsten Loeffler,Frankfurt am Main,Germany,completed manually from UNFCCC website
Fraunhofer Institute for Systems and Innovation Research,Non-governmental organizations,Constituency - Research and independent,Ms. Vicki Duscha,Munic,Germany,
"Free University Amsterdam, Institute for Environmental Studies",Non-governmental organizations,Constituency - Environmental,Mr. Oscar Widerberg,Amsterdam,Netherlands,completed manually from UNFCCC website
Freedom from Debt Coalition Inc.,Non-governmental organizations,Constituency - Research and independent,Mr. Samuel Cesar Gamboa,Quezon City,Philippines,
Freie Universität Berlin,Non-governmental organizations,Constituency - Research and independent,Mr. Stephan Pfahl,Berlin,Germany,
Fridtjof Nansen Institute,Non-governmental organizations,Constituency - Research and independent,Mr. Claes Ragner,Lysaker,Norway,
Friedrich Schiller University Jena,Non-governmental organizations,Constituency - Research and independent,Mr. Martin Herold,Jena,Germany,
Friedrich-Ebert-Stiftung e.V.,Non-governmental organizations,Constituency - Research and independent,Ms. Yvonne Blos,Berlin,Germany,
Friends of Environment and Humanity Foundation,Non-governmental organizations,Constituency - Environmental,Mr. Wisdom Tettey,Tema,Ghana,
Friends of the Earth International,Non-governmental organizations,Constituency - Environmental CJN,Ms. Sara Shaw,Amsterdam,Netherlands,
Friends World Committee for Consultation,Non-governmental organizations,Constituency - Research and independent,Ms. Lindsey Fielder Cook,London,United Kingdom of Great Britain and Northern Ireland,
Fundação Getúlio Vargas,Non-governmental organizations,Constituency - Research and independent,Mr. Mario Prestes Monzoni,Sao Paulo,Brazil,
Fundación Ambiente y Recursos Naturales,Non-governmental organizations,Constituency - Environmental,Mr. Enrique Gabriel Maurtua Konstantinidis,Buenos Aires,Argentina,
Fundación Amigos de la Naturaleza,Non-governmental organizations,Constituency - Research and independent,Ms. Natalia Valentina Calderón Angeleri,Santa Cruz,Bolivia (Plurinational State of),
Fundación Argentina de Etoecología,Non-governmental organizations,Constituency - Environmental,Sra. Alcira Perlini Montiel,Buenos Aires,Argentina,
Fundación Avina,Non-governmental organizations,Constituency - Environmental,Ms. Paula Ellinger da Fonseca,"Panama City,",Panama,
Fundación Biosfera,Non-governmental organizations,Constituency - Environmental CAN,Mr. Horacio Pablo de Belaustegui,La Plata,Argentina,
Fundación Bosques para la Conservación,Non-governmental organizations,Constituency - Environmental,Mr. Xavier Enrique Elizalde Romero,Quito,Ecuador,
Fundación Cayetano Heredia,Non-governmental organizations,Constituency - Research and independent,Mr. Jahir Anicama Diaz,Lima,Peru,
Fundación de Iniciativas de Cambio Climático,Non-governmental organizations,Constituency - Environmental CAN,Sra. Suyapa Concepción Zelaya Amaya,Tegucigalpa,Honduras,
Fundación Defensores de la Naturaleza,Non-governmental organizations,Constituency - Environmental,Sr. Oscar Manuel Nuñez Saravia,Guatemala,Guatemala,
"Fundación Desarrollo Sustentable, A.C.",Non-governmental organizations,Constituency - Research and independent,Mr. Jose Maria Valenzuela Robles Linares,México. D.F.,Mexico,
Fundación Ecología y Desarrollo,Non-governmental organizations,Constituency - Environmental,Sra. Christina Monge Lasierra,Zaragoza,Spain,
Fundación Futuro Latinoamericano,Non-governmental organizations,Constituency - Environmental,Ms. Lucia Gabriela Villamarin Jurado,Quito,Ecuador,
Fundación Natura,Non-governmental organizations,Constituency - Environmental,Ms. Romina Paola Villegas,Santa Cruz de la Sierra,Bolivia (Plurinational State of),
Fundación Natura Bolivia,Non-governmental organizations,Constituency - Environmental,Ms. Romina Paola Villegas,Santa Cruz de la Sierra,Bolivia (Plurinational State of),
Fundación para la Promoción del Conocimiento Indígena,Non-governmental organizations,Constituency - Indigenous peoples,Mr. Onel Masardule,Panamá,Panama,
Fundación Peruana para la Conservación de la Naturaleza,Non-governmental organizations,Constituency - Environmental,Ms. Elizabeth Peña Izquierdo,Lima,Peru,
Fundación Privada Empresa & Clima,Non-governmental organizations,,Mr. Joan Planes Vila,Barcelona,Spain,completed manually
"Fundación Sur Futuro, Inc.",Non-governmental organizations,Constituency - Environmental,Sr. Federico Alfredo Grullón de La Cruz,Santo Domingo,Dominican Republic,
Fundación TierraVida,Non-governmental organizations,Constituency - Environmental,Ms. Marina Mansilla Hermann,Córdoba,Argentina,
Gaia Association,Non-governmental organizations,Constituency - Business and Industry,Mr. Milkyas Debebe Mogessie,Addis Ababa,Ethiopia,
genderCC - women for climate justice e.V.,Non-governmental organizations,Constituency - Women and Gender,Ms. Gotelind Alber,Berlin,Germany,completed manually from UNFCCC website
George Mason University,Non-governmental organizations,Constituency - Research and independent,Mr. Paul Schopf,Fairfax VA,United States of America,
Georgetown University,Non-governmental organizations,Constituency - Research and independent,Ms. Joanna Lewis,Washington,United States of America,
German Advisory Council on Global Change,Non-governmental organizations,Constituency - Research and independent,Ms. Astrid Schulz,Berlin,Germany,
German Association of Energy and Water Industries,Non-governmental organizations,Constituency - Business and Industry,Mr. Tilman Schwencke,Berlin,Germany,
German Committee for Disaster Reduction,Non-governmental organizations,Constituency - Research and independent,Ms. Sina Marx,Bonn,Germany,
German Development Institute,Non-governmental organizations,Constituency - Research and independent,Mr. Steffen Bauer,Bonn,Germany,
German Emissions Trading Association,Non-governmental organizations,Constituency - Business and Industry,Mr. Robert Tippmann,Berlin,Germany,
German Marshall Fund of the United States,Non-governmental organizations,Constituency - Research and independent,Ms. Irene Garcia,Washington,United States of America,
German NGO Forum on Environment and Development,Non-governmental organizations,Constituency - Environmental CAN,Ms. Ramona Bruck,Berlin,Germany,
GERMANWATCH,Non-governmental organizations,Constituency - Environmental CAN,Ms. Katharina Anita Hierl,Bonn,Germany,completed manually from UNFCCC website
Gherush92 Committee for Human Rights,Non-governmental organizations,Constituency - Research and independent,Ms. Valentina Jappelli,Rome,Italy,
Global Alert for Defence of Youth and the Less Privileged,Non-governmental organizations,Constituency - Youth,Mr. Kennedy Christian Ezedinbu,Festac Town,Nigeria,
"Global Alliance for Incinerator Alternatives Philippines, Inc.",Non-governmental organizations,Constituency - Environmental CAN,Ms. Maria Elena Vilella Casaus,Quezon City,Philippines,
Global Buildings Performance Network,Non-governmental organizations,Constituency - Research and independent,Ms. Claire Brule,Paris,France,
Global Call for Climate Action,Non-governmental organizations,Constituency - Environmental,Ms. Karen Barkley,Montreal,Canada,
Global Canopy Programme,Non-governmental organizations,,,Oxford,United Kingdom of Great Britain and Northern Ireland,completed manually
Global Carbon Capture and Storage Institute Ltd,Non-governmental organizations,Constituency - Business and Industry,Ms. Eve Tamme,Canberra,Australia,
Global Ecovillage Network,Non-governmental organizations,Constituency - Environmental,Ms. Anja Kosha Joubert,Forres,United Kingdom of Great Britain and Northern Ireland,
Global Environment Centre,Non-governmental organizations,Constituency - Environmental CAN,Mr. Faizal Parish,Selangor,Malaysia,
Global Environment Centre Foundation,Non-governmental organizations,Constituency - Research and independent,Mr. Osamu Bannai,Osaka,Japan,
Global Environmental Institute,Non-governmental organizations,Constituency - Environmental,Ms. Lin Ji,Beijing,China,
Global Footprint Network,Non-governmental organizations,Constituency - Environmental,Mr. Mathis Wackernagel,Oakland,United States of America,
Global Forest Coalition,Non-governmental organizations,Constituency - Environmental,Ms. Aukje Simone Lovera-Bilderbeek,Amsterdam,Netherlands,
Global Green Environmental Network,Non-governmental organizations,Constituency - Environmental,Mr. Kweku Amankwah,Tema,Ghana,
Global Greens (Verts Mondiaux),Non-governmental organizations,Constituency - Environmental,Ms. Margaret Blakers,Brussels,Belgium,
Global Industrial and Social Progress Research Institute,Non-governmental organizations,Constituency - Research and independent,Mr. Daisuke Miki,Tokyo,Japan,
"Global Justice Ecology Project, Inc.",Non-governmental organizations,Constituency - Environmental,Ms. Anne Petermann,Hinnesburg,United States of America,
Global Justice Now,Non-governmental organizations,Constituency - Environmental CJN,Ms. Dorothy Grace Guerrero,London,United Kingdom of Great Britain and Northern Ireland,
Global Legislators Organisation for a Balanced Environment,Non-governmental organizations,Constituency - Environmental,Mr. Rafael Jiménez-Aybar,Brussels,Belgium,
Global Marshall Plan Foundation,Non-governmental organizations,Constituency - Research and independent,Mr. Frithjof Michael Finkbeiner,Hamburg,Germany,
Global Peace Initiative of Women,Non-governmental organizations,Constituency - Environmental,Ms. Marianne Marstrand,New York,United States of America,
Global Public Policy Institute,Non-governmental organizations,Constituency - Research and independent,Ms. Charlotte Streck,Berlin,Germany,
Global Sustainable Electricity Partnership,Non-governmental organizations,Constituency - Business and Industry,Ms. Isabelle Mégré,Montreal,Canada,
Global Village of Beijing,Non-governmental organizations,Constituency - Environmental CAN,Ms. Feng Wang,Beijing,China,
Global Voices,Non-governmental organizations,Constituency - Youth,Ms. Alexandra Valerio,Victoria,Australia,
Global Wind Energy Council,Non-governmental organizations,Constituency - Business and Industry,Ms. Alyssa Anne Pek,Brussels,Belgium,
Global Witness Limited,Non-governmental organizations,,Mr. Mike Davis,London,United Kingdom of Great Britain and Northern Ireland,completed manually
GoodPlanet,Non-governmental organizations,Constituency - Environmental,Mr. Thierry Touchais,Paris,France,
Gorakhpur Environmental Action Group,Non-governmental organizations,Constituency - Environmental CAN,Mr. Shiraz Akhtar Wajih,Gorakhpur,India,
Gordon E. and Betty I. Moore Foundation,Non-governmental organizations,Constituency - Environmental,Ms. Katherine Geesey,Palo Alto,United States of America,
Green Asia Network,Non-governmental organizations,Constituency - Environmental,Mr. Jaekwang Ko,Seoul,Republic of Korea,
Green Belt Movement,Non-governmental organizations,Constituency - Environmental CAN,Ms. Aisha Wanjiku Karanja,Nairobi,Kenya,
Green Club,Non-governmental organizations,Constituency - Environmental,Mr. Joseph Lin,Vancouver,Canada,
Green Cross International,Non-governmental organizations,Constituency - Environmental CAN,Mr. Liam Marcello Quaresimin,Santa Monica,United States of America,
Green Economics Institute,Non-governmental organizations,Constituency - Research and independent,Ms. Miriam Kennet,Reading,United Kingdom of Great Britain and Northern Ireland,
Green European Foundation,Non-governmental organizations,Constituency - Research and independent,Mr. Ognjen Sobat,Luxembourg,Luxembourg,
Green Institute Limited,Non-governmental organizations,Constituency - Environmental,Ms. Margaret Blakers,Hobart,Australia,
Green Korea United,Non-governmental organizations,Constituency - Environmental,Mr. Seungmoon Kwon,Seoul,Republic of Korea,
Greener Impact International,Non-governmental organizations,Constituency - Environmental,Mr. Gawusu-Toure Kassim,Accra,Ghana,
Greenhouse Gas Management Institute,Non-governmental organizations,Constituency - Research and independent,Ms. Molly White,Silver Spring,United States of America,
Greenpeace International,Non-governmental organizations,Constituency - Environmental CAN,Ms. Naomi Ursula Goodman,Amsterdam,Netherlands,
Groupe d'études et de recherches sur les énergies renouvelables et l'environnement,Non-governmental organizations,Constituency - Environmental,Mr. Ahmed-Faouzi Senhaji,Rabat,Morocco,completed manually from UNFCCC website
Groupe de recherche et d'echanges technologiques,Non-governmental organizations,Constituency - Environmental,Ms. Marie Bessières,Nogent-Sur-Marne,France,
"Groupe Energies Renouvelables, Environnement et Solidarités",Non-governmental organizations,Constituency - Environmental,M. Saverio Ragazzi,Aubagne,France,completed manually from UNFCCC website
Grupo GEA,Non-governmental organizations,Constituency - ENGO,Mr. Marcos Alegre,Lima,Peru,
HACEY's Health Initiative,Non-governmental organizations,Constituency - Youth,Mr. Isaiah Oluwatobi Owolabi,Lagos,Nigeria,
Harvard University,Non-governmental organizations,Constituency - Research and independent,Mr. Robert Stowe,Cambridge,United States of America,
HATOF Foundation,Non-governmental organizations,Constituency - Environmental CAN,Mr. Samuel Confidence Dotse,Tema,Ghana,
Health and Environment Alliance,Non-governmental organizations,Constituency - Environmental,Ms. Lucy Mathieson,Brussels,Belgium,
