name,entity_type,constituency,coordinator,city,country,remarks
Health Care Without Harm,Non-governmental organizations,Constituency - Environmental CAN,Ms. Jennifer Wang,Reston,United States of America,
HEDA Resource Centre,Non-governmental organizations,Constituency - Environmental,Mr. Sulaimon Olawale Arigbabu,Ikeya,Nigeria,
Heinrich Böll Foundation,Non-governmental organizations,Constituency - Environmental,Ms. Kristin Funke,Berlin,Germany,
HELIO International,Non-governmental organizations,Constituency - Environmental CAN,Ms. Christine Fiebig,Paris,France,
Helvetas Swiss Intercooperation,Non-governmental organizations,Constituency - Environmental,Ms. Rupa Mukerji,Zuerich,Switzerland,
Hong Kong Climate Change Forum,Non-governmental organizations,Constituency - Environmental,Ms. Gail Kendall,Hong Kong,China,
Hong Kong People's Council for Sustainable Development Limited,Non-governmental organizations,Constituency - ENGO,Mr. Kwong Tak Albert Lai,Hong Kong,China,
Huairou Commission Women Homes and Community,Non-governmental organizations,Constituency - Women and Gender,Ms. Suranjana Gupta,Brooklyn,United States of America,
Humane Society International,Non-governmental organizations,Constituency - Environmental CAN,Ms. Nicola Jane Beynon,Sydney,Australia,
Ibon Foundation Inc.,Non-governmental organizations,,Ms. Jennifer del Rosario-Malonzo,Quezon City,Philippines,completed manually
ICLEI-Local Governments for Sustainability,Non-governmental organizations,Constituency - Local government and Municipal authorities,Mr. Yunus Arikan,Bonn,Germany,
Imperial College London,Non-governmental organizations,Constituency - Research and independent,Ms. Alyssa Gilbert,London,United Kingdom of Great Britain and Northern Ireland,
Indian Youth Climate Network,Non-governmental organizations,Constituency - Environmental CAN,Mr. Reva Prakash,New Delhi,India,
Indigenous Education Network of Turtle Island,Non-governmental organizations,,,Bemidji,United States of America,completed manually
Indigenous People of Africa Coordinating Committee,Non-governmental organizations,Constituency - Indigenous peoples,Ms. Mala Mareacheallee,Cape Town,South Africa,
Indigo Development and Change,Non-governmental organizations,Constituency - Research and independent,Ms. Bettina Koelle,Nieuwoudtville,South Africa,
Industrial Technology Research Institute,Non-governmental organizations,Constituency - Research and independent,Mr. Chen-An Lien,Hsinchu,China,
IndustriALL Global Union,Non-governmental organizations,Constituency - Trade Unions,Mr. Brian Kohler,Geneva,Switzerland,
IndyACT-The League of Independent Activists,Non-governmental organizations,Constituency - Environmental CAN,Ms. Safa Mustafa Mohammad,Beirut,Lebanon,
Ingénieurs sans frontières ISF,Non-governmental organizations,,,Paris,France,completed manually
Initiative Développement,Non-governmental organizations,Constituency - Environmental,Mr. Mathieu Le Gagneux,Poitiers,France,
Innovation Center for Energy and Transportation,Non-governmental organizations,Constituency - Environmental,Ms. Lucia Green-Weiskel,Pasadena,China,
Institut de recherche sur l'environnement,Non-governmental organizations,Constituency - Environmental,M. Christian Guerraz,La Roche sur Foron,France,
Institut du Développement Durable et des Relations Internationales,Non-governmental organizations,Constituency - Research and independent,Mme Lola Vallejo,Paris,France,
Institut français des formateurs risques majeurs et protection de l'environnement,Non-governmental organizations,,Ms. Sylvette Pierron,Paris,France,completed manually
Institut national de la recherche agronomique,Non-governmental organizations,,Mr. Philippe Mauguin,Paris,France,completed manually
Institut Veolia,Non-governmental organizations,Constituency - Environmental,Mme Lorraine de Jerphanion,Aubervilliers,France,
Institute ECOAR for Citizenship,Non-governmental organizations,Constituency - Environmental,Ms. Miriam Duailibi,Sao Paulo,Brazil,
Institute for Advanced Sustainability Studies,Non-governmental organizations,Constituency - Research and independent,Ms. Kathleen Anne Mar,Potsdam,Germany,
Institute for Agricultural and Forest Management and Certification,Non-governmental organizations,Constituency - Environmental,Ms. Marina Piatto,Piracicaba,Brazil,
Institute for Agriculture and Trade Policy,Non-governmental organizations,Constituency - Environmental,Ms. Shefali Sharma,Minneapolis,United States of America,
Institute for Conservation and Sustainable Development of Amazonas,Non-governmental organizations,Constituency - Environmental,Ms. Fernanda Peixoto Barbosa,Manaus,Brazil,
Institute for Environment and Development Sustainability,Non-governmental organizations,Constituency - Environmental,Ms. Abela Gloria Mutabiilwa,Dar Es Salaam,United Republic of Tanzania,
Institute for Environmental Security,Non-governmental organizations,Constituency - Environmental,Mr. Ronald Kingham,The Hague,Netherlands,
Institute for Global Environmental Strategies,Non-governmental organizations,Constituency - Research and independent,Mr. Kentaro Tamura,Kanagawa,Japan,
Institute for Governance and Sustainable Development,Non-governmental organizations,Constituency - Environmental,Ms. Trina Chiemi Thorbjornsen,Washington,United States of America,
Institute for Policy Studies,Non-governmental organizations,Constituency - Environmental CAN,Mr. Oscar Reyes,Washington,United States of America,
Institute for Public Policy Research,Non-governmental organizations,Constituency - Environmental,Mr. Luke Murphy,London,United Kingdom of Great Britain and Northern Ireland,
Institute for Social and Environmental Transition,Non-governmental organizations,Constituency - Research and independent,Mr. Kenneth MacClune,Boulder,United States of America,
Institute for Sustainable Energy Policies,Non-governmental organizations,Constituency - Environmental CAN,Mr. Tetsunari Iida,Tokyo,Japan,
Institute for Transportation and Development Policy,Non-governmental organizations,Constituency - Research and independent,Mr. Ramon Javier Cruz-Diaz,New York,United States of America,
Institute of Development Studies,Non-governmental organizations,Constituency - Research and independent,Ms. Rosalind Price,Brighton,United Kingdom of Great Britain and Northern Ireland,
"Institute of Energy Economics, Japan",Non-governmental organizations,Constituency - ENGO,Mr. Takahiko Tagami,Tokyo,Japan,
Institutional Investors Group on Climate Change Ltd.,Non-governmental organizations,Constituency - Business and Industry,Ms. Evagelia Emelia Holdaway,London,United Kingdom of Great Britain and Northern Ireland,
Instituto de Ecología y Antropología de Acción,Non-governmental organizations,Constituency - Environmental,Ms. Elke Falley-Rothkopf,Cologne,Germany,
Instituto Educacional Franklin Delano Roosevelt,Non-governmental organizations,Constituency - Youth,Ms. Allana Rumble,Lima,Peru,
Instituto Ethos de Empresas e Responsabilidade Social,Non-governmental organizations,Constituency - ENGO,Ms. Flavia Anguiano Resende,Sao Paulo,Brazil,
Instituto Torcuato Di Tella,Non-governmental organizations,Constituency - Research and independent,Sr. Daniel Perczyk,Buenos Aires,Argentina,
Interchurch Organization for Development Cooperation,Non-governmental organizations,Constituency - Environmental,Ms. Regnera Catharina van der Geest,Utrecht,Netherlands,
InterEnvironment Institute,Non-governmental organizations,Constituency - Environmental,Mr. Thaddeus Trzyna,Sacramento,United States of America,
International Air Transport Association,Non-governmental organizations,Constituency - Business and Industry,Mr. Michel Adam,Montreal,Canada,
International Alliance of Indigenous and Tribal Peoples of the Tropical Forests,Non-governmental organizations,Constituency - Indigenous peoples,Mr. Estebancio Castro Diaz,Panama,Panama,
International Association for the Advancement of Innovative Approaches to Global Challenges,Non-governmental organizations,Constituency - Youth,Mr. Miroslav Polzer,Klagenfurt,Austria,
International Association of Public Transport,Non-governmental organizations,Constituency - Local government and Municipal authorities,Mr. Philip Turner,Brussels,Belgium,
International Association of Schools of Social Work,Non-governmental organizations,Constituency - Research and independent,Ms. Lena Dominelli,Hong Kong,China,
International Center for Environmental Technology Transfer,Non-governmental organizations,Constituency - Environmental,Mr. Taiki Kuroda,Yokkaichi,Japan,
International Centre for Trade and Sustainable Development,Non-governmental organizations,,Mr. Ricardo Melendez-Ortiz,Geneva,Switzerland,completed manually
International Chamber of Commerce,Non-governmental organizations,Constituency - Business and Industry,Ms. Majda Dabaghi,Paris,France,
International Chamber of Shipping,Non-governmental organizations,Constituency - Business and Industry,Mr. Simon Bennett,London,United Kingdom of Great Britain and Northern Ireland,
International Climate Change Partnership,Non-governmental organizations,Constituency - Environmental,Mr. Kevin Fay,Arlington,United States of America,
International Coastal and Ocean Organization,Non-governmental organizations,Constituency - Environmental,Ms. Vanessa Knecht,Washington DC,United States of America,
International Council for Mining and Metals,Non-governmental organizations,Constituency - Business and Industry,Ms. Meera Thankey,London,United Kingdom of Great Britain and Northern Ireland,
International Council for Science,Non-governmental organizations,,Mr. Gordon McBean,Paris,France,completed manually
International Council for Sustainable Energy,Non-governmental organizations,Constituency - Business and Industry,Ms. Laura Tierney,Washington DC,United States of America,
International Council of Chemical Associations,Non-governmental organizations,Constituency - Business and Industry2,Ms. Touria Lakchiri,Brussels,Belgium,
International Court for the Environment Coalition,Non-governmental organizations,Constituency - Environmental,Mr. Stephen Alexander Hockman,London,United Kingdom of Great Britain and Northern Ireland,
International Cryosphere Climate Initiative,Non-governmental organizations,Constituency - Research and independent,Ms. Pamela Jean Pearson,Charlotte,United States of America,
International Dairy Federation,Non-governmental organizations,Constituency - Business and Industry,Ms. Caroline Emond,Brussels,Belgium,
International Development Research Centre,Non-governmental organizations,Constituency - Research and independent,Ms. Marie-Eve Landry,"Ottawa, ON",Canada,
International Emissions Trading Association,Non-governmental organizations,Constituency - Business and Industry,Ms. Stephanie Olegario,Geneva,Switzerland,
International Environmental Communication Association,Non-governmental organizations,Constituency - Research and independent,Mr. Mark S. Meisner,Cincinnati,United States of America,
International Federation of Industrial Energy Consumers,Non-governmental organizations,Constituency - Business and Industry,Mr. Paul Cicio,Basel,Switzerland,
International Federation of Liberal Youth,Non-governmental organizations,Constituency - Youth,Mr. Sven Gerst,London,United Kingdom of Great Britain and Northern Ireland,
International Federation of Medical Students' Associations,Non-governmental organizations,Constituency - Youth,Mr. Skander Essafi,Amsterdam,Netherlands,
International Federation of Organic Agriculture Movements,Non-governmental organizations,Constituency - Farmers,Mr. Gabor Figeczky,Bonn,Germany,
International Fertilizer Industry Association,Non-governmental organizations,Constituency - Business and Industry,Ms. Margot Rose Clifford,Paris,France,completed manually from UNFCCC website
International Food Policy Research Institute,Non-governmental organizations,Constituency - Farmers,Ms. Liangzhi You,Washington,United States of America,
International Forestry Students' Association,Non-governmental organizations,Constituency - Youth,Ms. Aditi Mishra,Freiburg,Germany,
International Forum on Globalization Inc.,Non-governmental organizations,Constituency - Environmental CJN,Mr. Victor Menotti,San Francisco,United States of America,
International Foundation for African Children,Non-governmental organizations,Constituency - Youth,Mr. Michael Ikechukwu Nwafejoku,Lagos,Nigeria,
International Fund for Animal Welfare Inc.,Non-governmental organizations,Constituency - Environmental CAN,Mr. Matthew Collis,Yarmouth Port,United States of America,
International Gas Union,Non-governmental organizations,Constituency - Business and Industry,Mr. Luis Calvo,Barcelona,Spain,
International Hydropower Association,Non-governmental organizations,Constituency - Business and Industry,Mr. Richard M. Taylor,London,United Kingdom of Great Britain and Northern Ireland,
International Indian Treaty Council,Non-governmental organizations,Constituency - Indigenous peoples,Mr. Alberto Saldamando,San Francisco,United States of America,
International Institute for Applied Systems Analysis,Non-governmental organizations,Constituency - Research and independent,Mr. Iain Stewart,Laxenburg,Austria,
International Institute for Environment and Development,Non-governmental organizations,Constituency - Research and independent,Ms. Marika Hannah Weinhardt,London,United Kingdom of Great Britain and Northern Ireland,
International Institute for Sustainable Development,Non-governmental organizations,Constituency - Research and independent,Mr. Cameron Stuart Hunter,Winnipeg,Canada,
International Movement ATD Fourth World,Non-governmental organizations,,,Pierrelaye,France,completed manually
International National Trusts Organisation,Non-governmental organizations,Constituency - Environmental,Ms. Catherine Leonard,London,United Kingdom of Great Britain and Northern Ireland,
International Network for Sustainable Energy,Non-governmental organizations,Constituency - Environmental,Mr. Gunnar Boye Olesen,Hjortshoj,Denmark,
International Network of Basin Organizations,Non-governmental organizations,Constituency - Environmental,Mr. Edouard Boinet,Paris,France,
International Organization for Standardization,Non-governmental organizations,Constituency - Business and Industry,Mr. José Ignacio Alcorta,Vernier,Switzerland,
International Organization of Employers,Non-governmental organizations,Constituency - Business and Industry,Mr. Pierre Vincensini,Geneva,Switzerland,
International Petroleum Industry Environmental Conservation Association,Non-governmental organizations,,,London,United Kingdom of Great Britain and Northern Ireland,completed manually
International Planned Parenthood Federation,Non-governmental organizations,Constituency - Women and Gender,Ms. Raffaela Dattler,London,United Kingdom of Great Britain and Northern Ireland,
International Plant Genetic Resources Institute,Non-governmental organizations,Constituency - Research and independent,Ms. Helen Thompson,Maccarese (Fiumicino),Italy,
International Polar Foundation,Non-governmental organizations,Constituency - Research and independent,Ms. Nighat Johnson-Amin,Brussels,Belgium,
International Policy Network,Non-governmental organizations,Constituency - Environmental,Ms. Kendra Okonski,London,United Kingdom of Great Britain and Northern Ireland,
International Social Science Council,Non-governmental organizations,,Mr. Alberto Martinelli,Paris,France,completed manually; currently dissolved
International Society of Doctors for the Environment,Non-governmental organizations,Constituency - ENGO,Ms. Cathey Eisner Falvo,Basel,Switzerland,
International Solar Energy Society e.V.,Non-governmental organizations,Constituency - Environmental,Ms. Jennifer McIntosh,Freiburg,Germany,
International Solid Waste Association,Non-governmental organizations,Constituency - Environmental,Mr. Jose Ignacio Uribe-Echevarria,Vienna,Austria,
International Trade Union Confederation,Non-governmental organizations,Constituency - Trade Unions,Mr. Bert De Wel,Brussels,Belgium,
International Union of Architects,Non-governmental organizations,Constituency - Trade Unions,Ms. Sonia Cela,Paris,France,
International Union of Forest Research Organizations,Non-governmental organizations,Constituency - Research and independent,Mr. Alexander Buck,Vienna,Austria,
International Union of Railways,Non-governmental organizations,Constituency - Business and Industry,Mr. Vincent VU,Paris,France,
International Volunteering Center for Development Cooperation,Non-governmental organizations,Constituency - Environmental,Mr. Marco Iob,Udine,Italy,
International Work Group for Indigenous Affairs,Non-governmental organizations,Constituency - Environmental,Mr. Stefan Thorsell,Copenhagen,Denmark,
International Youth and Student Movement for the United Nations,Non-governmental organizations,Constituency - Environmental,Mr. Oluwole David Oshota,Geneva,Switzerland,
Inuit Circumpolar Conference,Non-governmental organizations,Constituency - Indigenous peoples,Ms. Joanna MacDonald,Ottawa,Canada,
"Islands First, Inc.",Non-governmental organizations,Constituency - Environmental,Mr. Mark Jariabka,New York,United States of America,
Italian Climate Network,Non-governmental organizations,Constituency - Youth,Mr. Jacopo Bencini,Milan,Italy,
Italian Local Agenda 21 Association,Non-governmental organizations,Constituency - Local government and Municipal authorities,Ms. Maria Elisa Zuppiroli,Modena,Italy,
Ithaca College,Non-governmental organizations,Constituency - Research and independent,Mr. Thomas Shevory,Ithaca,United States of America,
iuventum e.V.,Non-governmental organizations,Constituency - Research and independent,Mr. Henning Stöcks,Velzen,Germany,
IVL Swedish Environmental Research Institute Ltd.,Non-governmental organizations,Constituency - Research and independent,Mr. Peringe Grennfelt,Stockholm,Sweden,
Janvikas,Non-governmental organizations,,Mr. Mahesh Pandya,Ahmedabad,India,
"Japan Atomic Industrial Forum, Inc.",Non-governmental organizations,Constituency - Business and Industry,Ms. Yuko Wada,Tokyo,Japan,
Japan Automobile Manufacturers Association Inc.,Non-governmental organizations,Constituency - Business and Industry,Mr. Shingo Kawaguchi,Tokyo,Japan,
Japan Center for a Sustainable Environment and Society,Non-governmental organizations,Constituency - Environmental CAN,Mr. Jiro Adachi,Tokyo,Japan,
Japan Environmental Council,Non-governmental organizations,Constituency - Environmental,Ms. Yukari Takamura,Tokyo,Japan,
Japan Fluorocarbon Manufacturers Association,Non-governmental organizations,Constituency - Business and Industry,Mr. Kenroh Kitamura,Tokyo,Japan,
Japan International Forestry Promotion and Cooperation Center,Non-governmental organizations,Constituency - ENGO,Mr. Kenzo Naka,"Bunkyo-ku, Tokyo",Japan,
Japan Iron and Steel Federation,Non-governmental organizations,Constituency - Business and Industry,Mr. Masanobu Nakamizu,Tokyo,Japan,
Jeunes volontaires pour l'environnement,Non-governmental organizations,Constituency - Environmental,Mr. Sena Alouka,Lomé,Togo,completed manually from UNFCCC website
Joanneum Research,Non-governmental organizations,Constituency - Research and independent,Mr. Andreas Tuerk,Graz,Austria,
Johns Hopkins University,Non-governmental organizations,Constituency - Research and independent,Mr. Irving Mintzer,Washington,United States of America,
Joint Implementation Network,Non-governmental organizations,Constituency - Research and independent,Mr. Catrinus Jetsus Jepma,Groningen,Netherlands,
Joyce Foundation,Non-governmental organizations,Constituency - Environmental,Mr. Edmund Jackson Miller,Chicago,United States of America,
"Jubilee South Asia Pacific Movement, Inc.",Non-governmental organizations,Constituency - Environmental CJN,Ms. Lydinyda Bunyi Nacpil,Quezon City,Philippines,
"Kadikoyu Friends of Science, Culture and Art Association",Non-governmental organizations,Constituency - Environmental,Mr. Tanay Sıdkı Uyar,Istanbul,Turkey,
Kansai Economic Federation,Non-governmental organizations,Constituency - Environmental,Mr. Hiroshi Nakajima,Osaka,Japan,
Keidanren,Non-governmental organizations,Constituency - Business and Industry,Mr. Kiyoshi Tanigawa,Tokyo,Japan,
Keio University,Non-governmental organizations,Constituency - Research and independent,Mr. Wanglin Yan,Tokyo,Japan,
Kejibaus,Non-governmental organizations,Constituency - Youth,Mr. Aderemi Austino Adetoro,Akure,Nigeria,
Keren Kayemet LeIsrael/The Jewish National Fund,Non-governmental organizations,Constituency - Environmental,Ms. Karine Michelle Bolton,Jerusalem,Israel,
KfW,Non-governmental organizations,Constituency - Business and Industry,Mr. Peter Hilliges,Frankfurt am Main,Germany,
Khazer Ecological and Cultural NGO,Non-governmental organizations,Constituency - Environmental CAN,Ms. Amalia Hambartsumyan,Yerevan,Armenia,
Kiko Network,Non-governmental organizations,Constituency - Environmental CAN,Mr. Kenro Taura,Kyoto,Japan,
"King's College, School of Law",Non-governmental organizations,Constituency - Research and independent,Ms. Megan Bowman,London,United Kingdom of Great Britain and Northern Ireland,
KlimAktiv,Non-governmental organizations,Constituency - Environmental,Mr. Stephan Schunkert,Tübingen,Germany,
Konrad-Adenauer-Foundation,Non-governmental organizations,Constituency - Research and independent,Mr. Jasper Eitze,Berlin,Germany,
Korea Chamber of Commerce and Industry,Non-governmental organizations,Constituency - Business and Industry,Mr. Hyun Kim,Seoul,Republic of Korea,
Korea Green Foundation,Non-governmental organizations,Constituency - ENGO,Mr. Jooyoung Kim,Seoul,Republic of Korea,
Korea Institute of Science and Technology Europe,Non-governmental organizations,Constituency - ENGO,Mr. Jeongho Seo,Saarbrücken,Germany,
Korea University,Non-governmental organizations,Constituency - Research and independent,Mr. Yowhan Son,Seoul,Republic of Korea,
Korean Business Council for Sustainable Development,Non-governmental organizations,Constituency - Business and Industry,Ms. Chai-un Hahn,Seoul,Republic of Korea,
Korean Federation for Environmental Movement,Non-governmental organizations,Constituency - Environmental CJN,Mr. Jieon Lee,Seoul,Republic of Korea,
Korean Standards Association,Non-governmental organizations,Constituency - Business and Industry,Mr. Dohdam Kim,Seoul,Republic of Korea,
"Krasnoyarsk regional public ecological movement ""Friends of the Siberian Forests""",Non-governmental organizations,Constituency - Environmental,Mr. Andrey Laletin,Krasnoyarsk,Russian Federation,completed manually from UNFCCC website
Kyoto Club,Non-governmental organizations,Constituency - Business and Industry,Mr. Sergio Andreis,Roma,Italy,
"Kyoto University, Institute of Economic Research",Non-governmental organizations,Constituency - Research and independent,Mr. Haruo Imai,Kyoto,Japan,
Labor/Community Strategy Center,Non-governmental organizations,Constituency - Environmental,Mr. Eric Mann,Los Angeles,United States of America,
"Labour, Health and Human Rights Development Center",Non-governmental organizations,Constituency - Environmental,Mr. Ayodele Sam Akele,Agege Lagos,Nigeria,
Lancaster University,Non-governmental organizations,Constituency - Research and independent,Mr. Barry Simons,Lancaster,United Kingdom of Great Britain and Northern Ireland,
Latin American Section of the American Nuclear Society,Non-governmental organizations,Constituency - Business and Industry,Mr. Jorge Spitalnik,Rio de Janeiro,Brazil,
LAYA,Non-governmental organizations,Constituency - Environmental,Ms. Nafisa Goga Dsouza,"Visakhapatnam, Andhra Pradesh",India,
LDC Watch,Non-governmental organizations,Constituency - Research and independent,Ms. Rushka Sthapit,Kathmandu,Nepal,
Leadership for Environment and Development,Non-governmental organizations,Constituency - Environmental CAN,Ms. Hina Salim Lotia,Islamabad,Pakistan,
Leadership for Environment and Development International,Non-governmental organizations,Constituency - Environmental,Mr. Hugh Maynard,"Epsom, Surrey",United Kingdom of Great Britain and Northern Ireland,
Legal Response Initiative,Non-governmental organizations,Constituency - Environmental CAN,Ms. Pascale Evelyn Bird,,United Kingdom of Great Britain and Northern Ireland,
Legambiente - League of Environment,Non-governmental organizations,Constituency - Environmental CJN,Mr. Maurizio Gubbiotti,Rome,Italy,
Les Anges Gardiens de la Planete,Non-governmental organizations,,,Boulogne Billancourt,France,completed manually
Les Jeunes Écologistes,Non-governmental organizations,,,Montreuil,France,completed manually
Lewis and Clark College,Non-governmental organizations,Constituency - Research and independent,Mr. Chris Wold,Portland,United States of America,
Liaison Office of the European Ceramic Industry,Non-governmental organizations,Constituency - Business and Industry,Mr. Renaud Batier,Bruxelles,Belgium,
Life and Environment - Israeli Union of Environmental NGOs,Non-governmental organizations,Constituency - Environmental,Ms. Moran Diment,Tel Aviv,Israel,completed manually from UNFCCC website
LIFE e.V.,Non-governmental organizations,Constituency - Women and Gender,Ms. Nanna Birk,Berlin,Germany,
Ligue pour la protection des oiseaux,Non-governmental organizations,Constituency - Environmental,Mr. Yves Verilhac,Rochefort,France,
Lombardy Foundation for the Environment / Fondazione Lombardia per l'Ambiente,Non-governmental organizations,Constituency - Research and independent,Ms. Mita Laura Lapi,Milan,Italy,
London School of Economics and Political Science,Non-governmental organizations,Constituency - Research and independent,Mr. Tim Forsyth,London,United Kingdom of Great Britain and Northern Ireland,
Lund University,Non-governmental organizations,Constituency - Research and independent,Mr. Roger Hildingsson,Lund,Sweden,
