name,entity_type,constituency,coordinator,city,country,remarks
2° Investing Initiative,Non-governmental organizations,Constituency - Research and independent,Mr. Thibaut Ghirardi,Paris,France,completed manually from UNFCCC website
A SEED Europe,Non-governmental organizations,Constituency - Environmental,Mr. Flip Vonk,Amsterdam,Netherlands,
Aarhus University,Non-governmental organizations,Constituency - Research and independent,Mr. Knud Warming,Aarhus C,Denmark,
Abibimman Foundation,Non-governmental organizations,Constituency - Environmental CAN,Mr. Kenneth Nana Amoateng,Tena,Ghana,
Academy for Mountain Environics,Non-governmental organizations,Constituency - Environmental,Mr. Sreedhar Ramamurthi,New Delhi,India,
ACT Alliance - Action by Churches Together,Non-governmental organizations,Constituency - Environmental CAN,Mr. Thorsten Göbel,Geneva,Switzerland,
Action Against Hunger,Non-governmental organizations,Constituency - Environmental,Mme Peggy Pascal,Paris,France,
Action pour la taxation des transactions pour l'aide aux citoyens,Non-governmental organizations,Constituency - Research and independent,Ms. Jeanne Planche,Paris,France,
Action Solidarité Tiers-Monde a.s.b.l.,Non-governmental organizations,Constituency - ENGO,M. Dietmar Mirkes,Luxembourg,Luxembourg,
ActionAid International,Non-governmental organizations,Constituency - Environmental CAN,Ms. Teresa Maria Isabel Anderson,Johannesburg,South Africa,
Adelphi Research,Non-governmental organizations,Constituency - Research and independent,Mr. Dennis Taenzler,Berlin,Germany,
Africa Youths International Development Foundation,Non-governmental organizations,Constituency - Youth,Mr. Tunji John Asaolu,Abuja,Nigeria,
African Climate Change Research Centre,Non-governmental organizations,Constituency - Research and independent,Mr. Nura Jibo,Dutse,Nigeria,
African Forest Forum,Non-governmental organizations,Constituency - Environmental,Mr. Godwin Kowero,Nairobi,Kenya,
African Wildlife Foundation,Non-governmental organizations,Constituency - Environmental,Mr. Charly Facheux,Nairobi,Kenya,
Agence régionale de l'environnement et des nouvelles energies d'Ile-de-France,Non-governmental organizations,Constituency - Environmental,Ms. Tiphaine Durand,Pantin,France,
Agriconsulting S.p.A.,Non-governmental organizations,Constituency - Business and Industry,Mr. Giorgio Andreoli,Rome,Italy,
Agronomes et vétérinaires sans frontières,Non-governmental organizations,Constituency - Farmers,Ms. Katia Roesch,Lyon,France,
Agropolis International,Non-governmental organizations,Constituency - Research and independent,Ms. Melanie Broin,Montpellier,France,
Airlines for America,Non-governmental organizations,Constituency - ENGO,Ms. Nancy Young,Washington,United States of America,
All India Women's Conference,Non-governmental organizations,Constituency - Women and Gender,Ms. Rakesch Dhawan,New Delhi,India,
Alliance for Climate Education,Non-governmental organizations,Constituency - Environmental CAN,Ms. Leah Qusba,Oakland,United States of America,
Alliance for Responsible Atmospheric Policy,Non-governmental organizations,Constituency - Business and Industry,Mr. Stephen Van Maren,Arlington,United States of America,
Alliance froid climatisation environnement,Non-governmental organizations,Constituency - Business and Industry,Mr. François Heyndrickx,L'Aigle,France,
"Alliance pour la Biodiversité, le Climat et la Durabilité dans les Alpes",Non-governmental organizations,Constituency - Environmental,M. Jean-Loup Bertez,Talloires,France,
Alliance to Save Energy,Non-governmental organizations,Constituency - Business and Industry,Ms. Laura Van Wie McGrory,Washington,United States of America,
Alofa Tuvalu,Non-governmental organizations,Constituency - Environmental CAN,Ms. Fanny Heros,Paris,France,
Amazon Aid Foundation,Non-governmental organizations,Constituency - Environmental,Ms. Heather Mytelka,Charlottesville,United States of America,
Amazon Center for Environmental Education and Research Foundation,Non-governmental organizations,Constituency - Environmental,Mr. Paul Alan Morgan,Westchester,United States of America,
Amazon Environmental Research Institute,Non-governmental organizations,Constituency - Environmental,Ms. Gabriela Savian,Belem,Brazil,
Amazon Institute of People and the Environment,Non-governmental organizations,Constituency - Research and independent,Sra. Brenda Brito do Carmo,Belém,Brazil,
Amazon Watch,Non-governmental organizations,Constituency - Environmental,Mr. Andrew Miller,San Francisco,United States of America,
American Chemical Society,Non-governmental organizations,Constituency - Research and independent,Mr. James C. Maxwell,Washington DC,United States of America,
American Council on Renewable Energy,Non-governmental organizations,Constituency - Business and Industry,Mr. Todd Foley,Washington DC,United States of America,
American Federation of Labor and Congress of Industrial Organizations,Non-governmental organizations,Constituency - ENGO,Mr. Brad Markell,Washington,United States of America,
American Nuclear Society,Non-governmental organizations,Constituency - Research and independent,Ms. Aubrey Whittington,La Grange Park,United States of America,
American Society of International Law,Non-governmental organizations,Constituency - ENGO,Ms. Elizabeth Andersen,Washington DC,United States of America,
American Sustainable Business Council,Non-governmental organizations,Constituency - Business and Industry,Mr. Michael Green,Washington DC,United States of America,
American University,Non-governmental organizations,Constituency - Research and independent,Ms. Sikina Jinnah,Washington,United States of America,
Amigos de la Tierra Asociación Civil,Non-governmental organizations,Constituency - Environmental CAN,Ms. Laura Guadalupe Lopez Torres,Puebla,Mexico,
Amour developpement environnement - Benin,Non-governmental organizations,Constituency - Farmers,M. Saturnin Azonkpin,Glazoue,Benin,
An Organization for Socio-Economic Development,Non-governmental organizations,Constituency - Environmental CAN,Mr. Shamim Arfeen,Khulna,Bangladesh,
Antarctic and Southern Ocean Coalition,Non-governmental organizations,Constituency - Environmental,Ms. Claire Christian,Washington DC,United States of America,
Arab Forum for Environment and Development,Non-governmental organizations,Constituency - Environmental,Mr. Najib Saab,Beirut,Lebanon,
Architecture 2030 Inc.,Non-governmental organizations,Constituency - Environmental,Mr. Tighe Glennon Lanning,Santa Fe,United States of America,
Arizona State University,Non-governmental organizations,Constituency - Research and independent,Mr. Daniel Bodansky,Glendale,United States of America,
Asahi Glass Foundation,Non-governmental organizations,Constituency - Environmental,Mr. Junichi Shimizu,Tokyo,Japan,
Asia Indigenous Peoples Pact Foundation,Non-governmental organizations,Constituency - Indigenous peoples,Mr. Lakpa Nuri Sherpa,Chiang Mai,Thailand,
"Asia Pacific Forum on Women, Law and Development",Non-governmental organizations,Constituency - Women and Gender,Ms. Kavita Naidu,Chiangmai,Thailand,
Asian Pacific Resource and Resource Centre for Women,Non-governmental organizations,Constituency - Women and Gender,Ms. Biplabi Shrestha,Kuala Lumpur,Malaysia,
Asian Resource Foundation,Non-governmental organizations,Constituency - Research and independent,Mr. Mohammad Abdus Sabur,Bangkok,Thailand,
Asociación AK Tenamit,Non-governmental organizations,Constituency - Indigenous peoples,Mr. Stephen Dudenhoefer,Izabal,Guatemala,
Asociación Ambiente y Sociedad,Non-governmental organizations,Constituency - Environmental CAN,Ms. Astrid Milena Bernal Rubio,Bogotá,Colombia,
Asociación Civil Oikos,Non-governmental organizations,Constituency - Environmental,Mr. Eric Chavez,Lima,Peru,
Asociación Coordinadora Latinoamericana y del Caribe de Pequeños Productores de Comercio Justo,Non-governmental organizations,Constituency - Business and Industry2,Ms. Xiomara J. Paredes,San Salvador,El Salvador,
Asociación Cubana de las Naciones Unidas,Non-governmental organizations,Constituency - Environmental,Ms. Soraya Elena Alvarez Nuñez,La Habana,Cuba,
Asociación de Comunidades Forestales de Petén,Non-governmental organizations,,Mr. Marcedonio Cortave,Petén,Guatemala,
Asociación Española de la Industria Eléctrica,Non-governmental organizations,,Ms. Marina Serrano,Madrid,Spain,completed manually
Asociación Interamericana para la Defensa del Ambiente,Non-governmental organizations,Constituency - Environmental CAN,Sra. Florencia Ortúzar,Oakland,United States of America,
Asociación Interétnica de Desarrollo de la Selva Peruana,Non-governmental organizations,Constituency - Indigenous peoples,Mr. Roberto Alfonso Espinoza Llanos,Lima,Peru,
Asociación Nacional de Empresas de Agua y Saneamiento,Non-governmental organizations,Constituency - Business and Industry,Mr. Roberto Olivares,Distrito Federal,Mexico,
Asociación Nacional para la Conservación de la Naturaleza,Non-governmental organizations,Constituency - Environmental,Sra. Rita Spadafora Mejía,Panama,Panama,
Asociación para la Investigación y Desarrollo Integral,Non-governmental organizations,Constituency - Environmental,Mr. Jaime Nalvarte Armas,Lima,Peru,
Asociacion para la Naturaleza y Desarrollo Sostenible,Non-governmental organizations,Constituency - Indigenous peoples,Mr. Alejandro Argumedo,Cusco,Peru,
Asociación Proteger,Non-governmental organizations,Constituency - Environmental,Sr. Juan H. Ortiz Burgos,Buenos Aires,Argentina,
Asociación Regional de Pueblos Indígenas de la Selva Central,Non-governmental organizations,Constituency - Indigenous peoples,Sr. Lyndon Pishagua Chinchuya,Satipo,Peru,
Assemblée des départements de France,Non-governmental organizations,Constituency - Local government and Municipal authorities,M. Benjamin Eloire,Paris,France,
Association Actions Vitales Pour Le Developpement Durable,Non-governmental organizations,Constituency - Youth,Mr. Affana Affana Jean Paul Brice,Yaounde,Cameroon,completed manually from UNFCCC website
Association Climate-KIC,Non-governmental organizations,Constituency - Business and Industry,Ms. Julia Franchi Scarselli,London,United Kingdom of Great Britain and Northern Ireland,
Association des clubs des amis de la nature du Cameroun,Non-governmental organizations,Constituency - Environmental,Mr. Raphaël Hanmbock,Douala,Cameroon,
Association des communautés urbaines de France,Non-governmental organizations,Constituency - Local government and Municipal authorities,M. Philippe Angotti,Paris,France,
Association des maires de France,Non-governmental organizations,Constituency - Local government and Municipal authorities,Ms. Gwenola Rabier Stephan,Paris,France,
Association des Regions de France,Non-governmental organizations,Constituency - Local government and Municipal authorities,M. Guilhem Isaac-Georges,Paris,France,
Association des Scientifiques Environnementalistes pour un Développement Intégré,Non-governmental organizations,Constituency - Environmental,Mr. Mohamed-Awali Ouro-Djeri Djobo,Lome,Togo,
Association for Development and Research of Sustainable Habitats,Non-governmental organizations,,,New Delhi,India,completed manually
Association Française des Entreprises pour l'Environnement,Non-governmental organizations,Constituency - Environmental,Mr. David Laurent,Paris,France,
Association française des entreprises privées,Non-governmental organizations,,Mr. Laurent Burelle,Paris,France,completed manually
Association Française des Petits Debrouillards,Non-governmental organizations,,Ms. Ghislaine Hierso,Paris,France,completed manually
Association Française Pour les Nations Unies - Aix-en-Provence,Non-governmental organizations,Constituency - Research and independent,Ms. Marion Claire Eugénie Lemoine ep. Schonne,Aix-en-Provence,France,
Association Internationale des Maires et responsables entièrement ou partiellement Francophones,Non-governmental organizations,Constituency - Local government and Municipal authorities,Mme Julie Guillaume,Paris,France,completed manually from UNFCCC website
Association La Voûte Nubienne,Non-governmental organizations,Constituency - Environmental,Mme Cécilia Rinaudo,Carrieres Sur Seine,France,
Association négaWatt,Non-governmental organizations,Constituency - Research and independent,Mr. Stéphane Chatelin,Alixan,France,
Association Noé 21,Non-governmental organizations,Constituency - Environmental,Mr. Jerome Strobel,Genéve,Switzerland,
Association of American Geographers,Non-governmental organizations,Constituency - Research and independent,Ms. Candida Livia Mannozzi,Washington,United States of America,
Association of Consulting Engineers,Non-governmental organizations,Constituency - Business and Industry,Mr. Clemens Marcel Kremer,Berlin,Germany,
Association of Overseas Countries and Territories of the European Union,Non-governmental organizations,Constituency - Local government and Municipal authorities,Mr. Nicolas Ferellec,Brussels,Belgium,
"Association of Science - Technology Centers, Inc",Non-governmental organizations,Constituency - Research and independent,Mr. Walter Staveloz,Washington,United States of America,
Association pour la promotion de la recherche sur l'economie de carbon,Non-governmental organizations,,,Paris,France,completed manually
Association pour la promotion et le développement international des éco-entreprises de France,Non-governmental organizations,Constituency - Business and Industry,Ms. Florence Jasmin,Paris,France,
Association Québécoise de Lutte contre la Pollution Atmosphérique,Non-governmental organizations,Constituency - Environmental CAN,Mr. Alain Francois Brunel,St. Léon -de-Standon,Canada,
Ateneo de Manila University,Non-governmental organizations,Constituency - Research and independent,Mr. Antonio Gabriel La Viña,Quezon City,Philippines,
Australian Climate Coolers Limited - 1 Million Women,Non-governmental organizations,Constituency - Environmental,Ms. Natalie Isaacs,The Rocks,Australia,
Australian Conservation Foundation,Non-governmental organizations,Constituency - Environmental CAN,Ms. Kelly-Ann O'Shanassy,Carlton,Australia,
Australian Industry Greenhouse Network,Non-governmental organizations,Constituency - Business and Industry,Ms. Susan Smith,Kingston,Australia,
Australian Industry Group,Non-governmental organizations,Constituency - Business and Industry,Mr. Peter Burn,Sydney,Australia,
Australian National University,Non-governmental organizations,Constituency - Research and independent,Mr. Mark Howden,Acton,Australia,
Australian Youth Climate Coalition,Non-governmental organizations,Constituency - Youth,Ms. Hillary Eve Montague,Carlton,Australia,
Avaaz Foundation,Non-governmental organizations,Constituency - Environmental CAN,Mr. Risalat Khan,New York,United States of America,
Avelife (Ltd.),Non-governmental organizations,Constituency - Youth,Mr. Jin Quan Mark Cheng,Singapore,Singapore,
Avenir Climatique,Non-governmental organizations,Constituency - Youth,Ms. Léa Cruse,Paris,France,
Bangladesh Centre for Advanced Studies,Non-governmental organizations,Constituency - Research and independent,Mr. A. Atiq Rahman,Dhaka,Bangladesh,
Bangladesh Environmental Lawyers Association,Non-governmental organizations,Constituency - Environmental CAN,Ms. Syeda Hasan,Dhaka,Bangladesh,
Bangladesh Resource Centre for Indigenous Knowledge,Non-governmental organizations,Constituency - ENGO,Mr. Sukanta Kumar Sen,Dhaka,Bangladesh,
Basel Agency for Sustainable Energy,Non-governmental organizations,Constituency - Environmental,Mr. Daniel Magallon,Basel,Switzerland,
Basque Centre for Climate Change,Non-governmental organizations,Constituency - Research and independent,Ms. Nerea Ortiz,Bilbao,Spain,
Bay Area Council Foundation,Non-governmental organizations,Constituency - Business and Industry,Mr. Adrian Joseph Covert,San Francisco,United States of America,
BBC Media Action,Non-governmental organizations,Constituency - Research and independent,Ms. Lisa Robinson,London,United Kingdom of Great Britain and Northern Ireland,
Beijing Emissions Trading Association,Non-governmental organizations,Constituency - Environmental,Ms. Ling Shu Rao,Beijing,China,completed manually
Beijing NGO Association for International Exchanges,Non-governmental organizations,,Ms. Pu Jin,Beijing,China,
Bellona Foundation,Non-governmental organizations,Constituency - Environmental,Mr. Olav Oye,Oslo,Norway,
Bianca Jagger Human Rights Foundation,Non-governmental organizations,Constituency - Environmental,Ms. Bianca Jagger,London,United Kingdom of Great Britain and Northern Ireland,
BirdLife International,Non-governmental organizations,Constituency - Environmental CAN,Ms. Julie Hammer-Monart,Cambridge,United Kingdom of Great Britain and Northern Ireland,
Bizi !,Non-governmental organizations,,,Bayonne,France,completed manually
Blue Green Alliance Foundation,Non-governmental organizations,Constituency - Trade Unions,Ms. Kelly Marie Schwinghammer,Minneapolis,United States of America,
Boston University,Non-governmental organizations,Constituency - Research and independent,Mr. John Prandato,Boston,United States of America,
Both ENDS Foundation,Non-governmental organizations,Constituency - Environmental CAN,Mr. Wiert Wiertsema,Amsterdam,Netherlands,
Boticário Group Foundation for Nature Protection,Non-governmental organizations,Constituency - Environmental,Mr. Andre Rocha Ferretti,Curitiba,Brazil,
Brahma Kumaris World Spiritual University,Non-governmental organizations,Constituency - Research and independent,Ms. Sonja Maria Ohlsson,Rajasthan,India,
Bread for the World,Non-governmental organizations,Constituency - Environmental CAN,Ms. Annika Rach,Berlin,Germany,
"Brighter Green, Inc.",Non-governmental organizations,Constituency - Environmental CAN,Ms. Mia MacDonald,New York,United States of America,
British Columbia Council for International Cooperation,Non-governmental organizations,Constituency - Environmental,Ms. Deborah Glaser,Vancouver,Canada,
British Council,Non-governmental organizations,Constituency - Research and independent,Ms. Jennifer Carolyn Bardsley,London,United Kingdom of Great Britain and Northern Ireland,
Brown University - Watson Institute,Non-governmental organizations,Constituency - Research and independent,Ms. Deborah Gordon,Providence RI,United States of America,
Buddhist Tzu Chi Foundation,Non-governmental organizations,Constituency - Environmental,Ms. Debra Boudreaux,San Dimas,United States of America,
Business and Industry Advisory Committee to the OECD,Non-governmental organizations,Constituency - Business and Industry,Mr. Dominik Kummerle,Paris,France,
Business Council for Sustainable Energy,Non-governmental organizations,Constituency - Business and Industry,Ms. Lisa Jacobson,Washington,United States of America,
Business Council of Australia,Non-governmental organizations,Constituency - Business and Industry,Ms. Jessica Kate Wilson,Melbourne,Australia,
Business for Social Responsibility,Non-governmental organizations,Constituency - Business and Industry,Ms. Samantha Harris,San Francisco,United States of America,
Business Unity South Africa,Non-governmental organizations,Constituency - Business and Industry,Ms. Corinna Gardner,Johannesburg,South Africa,
BUSINESSEUROPE,Non-governmental organizations,Constituency - Business and Industry,Ms. Jessica Britte,Brussels,Belgium,completed manually from UNFCCC website
C40 Cities Climate Leadership Group,Non-governmental organizations,Constituency - Local government and Municipal authorities,Ms. Agathe Cavicchioli,New York,United States of America,
"Ca' Foscari University, Venice",Non-governmental organizations,Constituency - Research and independent,Ms. Martina Marian,Venice,Italy,
Canadian Federation of Agriculture,Non-governmental organizations,Constituency - Farmers,Mr. Greg Warren Northey,Ottawa,Canada,
Carbon Capture and Storage Association,Non-governmental organizations,Constituency - Business and Industry,Ms. Judith Shapiro-Kønigshøfer,London,United Kingdom of Great Britain and Northern Ireland,
Carbon Market Institute Limited,Non-governmental organizations,Constituency - Business and Industry,Mr. Bradley Kerin,Melbourne,Australia,
"Carbonfund.org Foundation, Inc.",Non-governmental organizations,Constituency - Environmental,Mr. Brian McFarland,Washington,United States of America,
CARE International,Non-governmental organizations,Constituency - Environmental CAN,Mr. Sven Harmeling,Copenhagen N,Denmark,
Caritas Internationalis,Non-governmental organizations,Constituency - Research and independent,Ms. Martina Liebsch,Citta del Vaticano,Holy See,
Carnegie Institution for Washington,Non-governmental organizations,Constituency - Research and independent,Mr. Christopher Bower Field,Washington,United States of America,
Carre Geo & Environnement,Non-governmental organizations,Constituency - Environmental CAN,Mr. Ibrahim Mfondoun Mbamoko,Douala,Cameroon,
CDP Worldwide,Non-governmental organizations,Constituency - Business and Industry,Ms. Jennifer Verity Gleed,London,United Kingdom of Great Britain and Northern Ireland,
CECODHAS - European Liaison Committee for Social Housing,Non-governmental organizations,Constituency - Research and independent,Ms. Alice Pittini,Brussels,Belgium,
CEE Bankwatch Network,Non-governmental organizations,Constituency - Environmental,Mr. Petr Hlobil,Prague 9,Czechia,
Center for American Progress,Non-governmental organizations,Constituency - Research and independent,Mr. Alan Yu,Washington,United States of America,
Center for Biological Diversity,Non-governmental organizations,Constituency - Environmental CAN,Ms. Andrea Weber,Tucson,United States of America,
Center for Clean Air Policy,Non-governmental organizations,Constituency - Research and independent,Ms. Carolina Aguirre Echeverri,Washington DC,United States of America,
Center for Climate and Energy Solutions,Non-governmental organizations,Constituency - Research and independent,Ms. Jennifer Huang,Arlington,United States of America,
"Center for Climate Strategies, Inc.",Non-governmental organizations,Constituency - Environmental,Mr. Scott Williamson,Washington,United States of America,
Center for Environment and Sustainable Development Studies and Application,Non-governmental organizations,Constituency - Environmental,Ms. Catherine Razavi,Tehran,Iran (Islamic Republic of),
"Center for Environmental Information, Inc.",Non-governmental organizations,Constituency - Environmental,Ms. Elizabeth Thorndike,Rochester,United States of America,
Center for Food Safety,Non-governmental organizations,Constituency - Environmental CJN,Ms. Debbie Barker,Washington,United States of America,
Center for Global Development,Non-governmental organizations,Constituency - Research and independent,Ms. Michele de Nevers,Washington DC,United States of America,
Center for International Climate and Environmental Research,Non-governmental organizations,Constituency - Research and independent,Mr. Christian Bjornaes,Oslo,Norway,
Center for International Environmental Law,Non-governmental organizations,Constituency - Environmental CAN,Mr. Sébastien Duyck,Washington,United States of America,
Center for Natural Resource Studies,Non-governmental organizations,Constituency - Environmental,Mr. Anisul M. Islam,Dhaka,Bangladesh,
Center for Policy Research,Non-governmental organizations,Constituency - Research and independent,Mr. Navroz Dubash,New Delhi,India,completed manually from UNFCCC website
Center for Sustainable Rural Development,Non-governmental organizations,Constituency - Farmers,Mr. Thuan Van Nguyen,Hanoi,Viet Nam,
Center of Life Institute,Non-governmental organizations,Constituency - Environmental,Ms. Alice Thuault,Cuiabá,Brazil,
Centre d'accompagnement des autochtones pygmées et minoritaires vulnerables,Non-governmental organizations,Constituency - Indigenous peoples,Mr. Pacifique Isumbisho Mukumba,Bukavu,Congo,
Centre de coopération internationale en recherche agronomique pour le développement,Non-governmental organizations,Constituency - Research and independent,Mr. Bruno Locatelli,Montpellier Cedex 5,France,completed manually from UNFCCC website
Centre de développement de la région de Tensift,Non-governmental organizations,Constituency - Environmental,M. Mohammed Mesouli,Marrakech,Morocco,
Centre for 21st Century Issues,Non-governmental organizations,Constituency - Women and Gender,Ms. Titilope Ngozi Akosa,Lagos,Nigeria,
Centre for Community Economics and Development Consultants Society,Non-governmental organizations,Constituency - Farmers,Mr. Sharad Joshi,Jaipur,India,
Centre for Environment and Development,Non-governmental organizations,Constituency - Environmental,Mr. Demuni Darshana Uchita de Zoysa,Nugegoda,Sri Lanka,
Centre for Environmental Justice,Non-governmental organizations,Constituency - Environmental CJN,Mr. Hemantha Withanage,Colombo,Sri Lanka,
Centre for European Economic Research,Non-governmental organizations,Constituency - Research and independent,Mr. Martin Kesternich,Mannheim,Germany,
Centre for European Policy Studies,Non-governmental organizations,Constituency - Research and independent,Ms. Monica Alessi,Brussels,Belgium,
Centre for International Governance Innovation,Non-governmental organizations,Constituency - Research and independent,Ms. Oonagh Fitzgerald,Waterloo,Canada,
Centre for International Sustainable Development Law,Non-governmental organizations,Constituency - Research and independent,Mr. Patrick Reynaud,Montreal,Canada,
Centre for Science and Environment,Non-governmental organizations,Constituency - Environmental CAN,Ms. Sunita Narain,New Delhi,India,
Centre for Socio-Economic Development,Non-governmental organizations,Constituency - Research and independent,Ms. Lichia Saner-Yiu,Geneva 1,Switzerland,
